sample_id,subject,subject_category,question,option_a,option_b,option_c,option_d,answer,required_knowledge,time_sensitive,reference,culture,region,country,cultural_sensitivity_label,is_annotated
business_ethics/test/6,business_ethics,Business,Although corporate profit maximization is not directly prescribed by major normative theories to which normative theory is it most similar?,hedonistic utilitarianism,preference utilitarianism,The Categorical Imperative,ethics of care,B,[],[],[],[],[],[],-,False
business_ethics/test/7,business_ethics,Business,What does Milton Friedman believe to be the sole responsibility of business?,The only social responsibility of business is to its shareholders,Managers should act in ways that balance the interest of society and shareholders,The primary responsibility organizations have is to its employees,The primary responsibility organizations have is to its stakeholders,A,[],[],[],[],[],[],-,False
business_ethics/test/10,business_ethics,Business," What, according to Schnackenberg and Tomlinson (2014), are the three criteria which can be used to assess the quality of corporate transparency?","Breadth, Clarity, Accuracy","Disclosure, Detail, Accuracy","Disclosure, Clarity, Accuracy","Disclosure, Clarity, Efficiency",C,"['none', 'none', 'none', 'none']","['No', 'No', 'No', 'No']","['-', '-', '-', '-']",[],[],[],CA,True
business_ethics/test/14,business_ethics,Business,What are the three differing types of stakeholder theory according to Donaldson and Preston (1995)?,"Normative, Descriptive and Economic","Normative, Moral and Instrumental","Political, Descriptive and Instrumental","Normative, Descriptive and Instrumental",D,"['regional', 'cultural', 'cultural', 'none']","['Yes', 'No', 'No', 'No']","[{'end': 91, 'label': 'Geographic', 'score': None, 'start': 70}, {'end': 91, 'label': 'Cultural', 'score': None, 'start': 38}, '-', '-']","['Western Culture', 'Western Culture']",['North America'],['United States of America (USA)'],CS,True
business_ethics/test/17,business_ethics,Business,What is the enlightened self-interest model of CSR?,That it is in an organization's own best interest to put itself first rather than its ethics,That it is in an organization's best interest to consider what a shareholder would want,That it is in an organization's own best interest to act in an ethical way,That it is in an organization's own best interest to follow the legislation and abide by the law,C,[],[],[],[],[],[],-,False
business_ethics/test/24,business_ethics,Business,"Better access to certain markets, differentiation of products, and the sale of pollution-control technology are ways in which better environmental performance can:",Increase Revenue,Increase Costs,Decrease Revenue,Decrease Costs,A,[],[],[],[],[],[],-,False
business_ethics/test/32,business_ethics,Business,Predatory pricing.,"1,2,4","1,2,3,4","1,2","1,4",D,"['none', 'none', 'none']","['No', 'No', 'No']","['-', '-', '-', '-']",[],[],[],CA,True
business_ethics/test/37,business_ethics,Business,Sustainability can broadly be defined as,"The short-term maintenance of systems according to environmental, economic and social considerations","The long-term maintenance of processes according to environmental, economic and cultural considerations.","The short-term maintenance of systems according to environmental, political and social considerations.","The long-term maintenance of systems according to environmental, economic and social considerations.",D,[],[],[],[],[],[],-,False
business_ethics/test/40,business_ethics,Business,Demand reduction.,"1,3,4","2,3,4","1,2,3","1,2,4",D,[],[],[],[],[],[],-,False
business_ethics/test/47,business_ethics,Business,"What term can be used to describe 'the hypothetical agreement between member of society and those who govern it which establishes the inter-relationships, rights and responsibilities on a fair basis'?",Social Contract,Duty Ethics,Consequentialism,Virtue Ethics,A,[],[],[],[],[],[],-,False
business_ethics/test/49,business_ethics,Business,According Carroll what four categories or aspects can corporate social responsibility be broken down into?,"Political, Legal, Ethical and Philanthropic","Economic, Legal, Ethical and Philanthropic","Economic, Legal, Cultural and Philanthropic","Economic, Legal, Ethical and Environmental",B,[],[],[],[],[],[],-,False
business_ethics/test/52,business_ethics,Business,"The state of being unable to make an informed, reasoned decision about a product purchase is known as?",Consumer inclusion,Consumer competence,Consumer exclusion,Consumer vulnerability,D,"['none', 'none', 'none', 'none']","['No', 'No', 'No', 'No']","['-', '-', '-', '-']",[],[],[],CA,True
business_ethics/test/55,business_ethics,Business,The complexity of the theory.,"1,2,3,4","1,3,4","1,2,3","1,2,4",C,"['none', 'none', 'none']","['No', 'No', 'No']","['-', '-', '-', '-', '-', '-', '-', '-']",[],[],[],CA,True
business_ethics/test/62,business_ethics,Business,CSO's frequently spend too much time communicating their performance measures and too much time devising them with input from beneficiaries.,"2,3","1,3","3,4","1,2,3,4",B,[],[],[],[],[],[],-,False
business_ethics/test/66,business_ethics,Business,A company may become insolvent if it,has negative working capital,cannot meet its budgeted level of profit,makes a loss,cannot pay creditors in full after realisation of its assets,D,"['none', 'none', 'none', 'none']","['No', 'No', 'No', 'No']","['-', '-', '-', '-']",[],[],[],CA,True
business_ethics/test/69,business_ethics,Business,Managers and directors have a fiduciary responsibility to protect the investment of shareholders.,"1,3,4","1,2,3,","1,2,4","2,3,4",A,"['none', 'none', 'none', 'none']","['No', 'No', 'No', 'No']","['-', '-', '-', '-', '-', '-', '-']",[],[],[],CA,True
business_ethics/test/70,business_ethics,Business,Cultural homogenization.,"1,3,4","1,2,3","1,2,3,4","2,3,4",B,"['none', 'none', 'none', 'cultural']","['No', 'No', 'No', 'No']","['-', '-', '-', '-', '-', '-']",[],[],[],CA,True
business_ethics/test/71,business_ethics,Business,Insider trading undermines the fiduciary relationship.,"1,2,3","1,2,4","2,3,4","1,2,3,4",B,[],[],[],[],[],[],-,False
business_ethics/test/78,business_ethics,Business,"What are, according to Wood (1991), the three outcomes of CSR?","Social policies, Social programmes and Social impacts","Social evaluations, Social programmes and Social impacts","Social policies, Social evidencing and Social impacts","Social policies, Social programmes and Social analysis",A,[],[],[],[],[],[],-,False
business_ethics/test/80,business_ethics,Business,Post-modern ethics assert that ethics are context and individual specific and as such have an internal guide to ethics.,"2,3","1,3","1,2,3","1,2",B,"['cultural', 'none', 'none']","['No', 'No', 'No']","['-', '-', '-', '-']",[],[],[],CA,True
business_ethics/test/84,business_ethics,Business,The need to head off negative publicity.,"1,3,4","2,3,4","1,2,3","1,2,3,4",C,[],[],[],[],[],[],-,False
business_ethics/test/90,business_ethics,Business,They are too irrational and uncodified.,"3,4","1,3","2,3","4,1",B,"['none', 'none', 'none', 'none']","['No', 'No', 'No', 'No']","['-', '-', '-', '-']",[],[],[],CA,True
business_ethics/test/91,business_ethics,Business,The purposes for which the information is used is in the public's interest.,"1,2","1,3","2,3","1,2,3",A,[],[],[],[],[],[],-,False
business_ethics/test/92,business_ethics,Business,The Private Sector Social Enterprise Model.,"1,2,4","2,3,4","1,2,3,4","1,2,3",D,"['none', 'none', 'none']","['No', 'No', 'No']","['-', '-', '-']",[],[],[],CA,True
business_ethics/test/94,business_ethics,Business,How the code is enforced.,"1,2,3","1,2,4","1,3,4","2,3,4",B,[],[],[],[],[],[],-,False
business_ethics/test/96,business_ethics,Business,The relationship between ethics and the law can be described as…,"Incredibly close, in fact, in all instances what is ethical is also what is legal and vice versa.","Not close, ethics and the law share a small amount of overlap, but fundamentally address differing questions and themes.","Close, as there is considerable overlap between ethics and law, but the two are not equivalent.","Not at all close, ethics and the law are virtually incompatible.",C,[],[],[],[],[],[],-,False
