sample_id,subject,subject_category,question,option_a,option_b,option_c,option_d,answer,required_knowledge,time_sensitive,reference,culture,region,country,cultural_sensitivity_label,is_annotated
college_chemistry/test/1,college_chemistry,STEM,Infrared (IR) spectroscopy is useful for determining certain aspects of the structure of organic molecules because,all molecular bonds absorb IR radiation,IR peak intensities are related to molecular mass,most organic functional groups absorb in a characteristic region of the IR spectrum,each element absorbs at a characteristic wavelength,C,[],[],[],[],[],[],-,False
college_chemistry/test/2,college_chemistry,STEM,What is the maximum number of phases that can be at equilibrium with each other in a three component mixture?,2,3,4,5,D,[],[],[],[],[],[],-,False
college_chemistry/test/4,college_chemistry,STEM,The equation ΔH = ΔU + PΔV is applicable,always,only for constant pressure processes,only for constant temperature processes,only for constant volume processes,B,[],[],[],[],[],[],-,False
college_chemistry/test/5,college_chemistry,STEM,Nitronyl nitroxides are stable radicals in which the unpaired electron is coupled to two equivalent nitrogen nuclei. How many lines will appear in the EPR spectrum of a solution of a rigid nitronyl nitroxide diradical with J << a?,3 lines,9 lines,5 lines,7 lines,B,[],[],[],[],[],[],-,False
college_chemistry/test/8,college_chemistry,STEM,"The 1H spectrum of a mixture of dimethylsulphoxide (DMSO) and acetonitrile (AN) contains lines with relative intensities α and 3α, respectively. What is the ratio of the two concentrations, [DMSO]:[AN]?",1:1,1:3,1:6,2:3,C,[],[],[],[],[],[],-,False
college_chemistry/test/10,college_chemistry,STEM,The 1H Larmor frequency of benzene exceeds that of trifluoroacetic acid by 1.656 kHz on a 400 MHz spectrometer. The 1H chemical shift of benzene is 7.16 ppm. What is the chemical shift of trifluoroacetic acid?,3.02 ppm,5.03 ppm,10.56 ppm,11.30 ppm,D,[],[],[],[],[],[],-,False
college_chemistry/test/11,college_chemistry,STEM,"Suppose that the 13C nuclei in a molecule in a 600 MHz spectrometer can be 100% polarized (p = 1). If T1 = 5.0 s, how long does it take for p to reach a value equal to twice the thermal equilibrium polarization at 298 K?",[The polarization relaxes exponentially: p(t) = [p(0) - peq]exp(-t/T1) + peq.],72.0 s,56.6 s,12.7 s,B,"['none', 'none', 'regional', 'none', 'none', 'none', 'none', 'none']","['No', 'No', 'No', 'No', 'No', 'No', 'No', 'No']","['-', '-', '-', '-', '-', '-', '-', '-']",[],['North America'],[],CA,True
college_chemistry/test/12,college_chemistry,STEM,Estimate the β-hyperfine value for the cyclobutyl radical (C4H7•) assuming the radical is flat and the HCH angle is 115°.,4.6 mT,27 G,5.4 mT,3.8 mT,A,[],[],[],[],[],[],-,False
college_chemistry/test/13,college_chemistry,STEM,What is the ratio of line intensities in the EPR spectrum of the t-Bu radical (CH3)3C•?,1:19:36:84:126:126:84:36:19:1,1:9:36:84:126:126:84:36:9:1,1:9:35:82:120:120:82:35:9:1,1:8:28:56:70:56:28:8:1,D,"['none', 'none', 'none', 'none']","['No', 'No', 'No', 'No']","['-', '-', '-', '-']",[],[],[],CA,True
college_chemistry/test/14,college_chemistry,STEM,Which one sentence explains most accurately why spin trapping is often used to detect free radical intermediates?,spin trapping provides more structural information than direct detection by EPR,spin trapping makes it easy to quantify free radical intermediates,steady state concentration of free radical intermediates is often too low to enable direct detection by EPR,detection of spin adducts requires lower power than direct detection of radical intermediates,D,[],[],[],[],[],[],-,False
college_chemistry/test/15,college_chemistry,STEM,Calculate the magnetic moment (μI) of a 13C nucleus.,6.1445 x 10^-27 J T-1,3.1445 x 10^-27 J T-1,9.1445 x 10^-27 J T-1,1.1445 x 10^-28 J T-1,C,"['none', 'none', 'none', 'none', 'none']","['No', 'No', 'No', 'No', 'No']","['-', '-', '-', '-', '-']",[],[],[],CA,True
college_chemistry/test/19,college_chemistry,STEM,Calculate the Larmor frequency for a proton in a magnetic field of 1 T.,23.56 GHz,42.58 MHz,74.34 kHz,13.93 MHz,B,[],[],[],[],[],[],-,False
college_chemistry/test/22,college_chemistry,STEM,"At 25°C, the maximum amount of PbI2 that can be dissolved in 1.00 L of pure water is 1.0 mmol. Assuming complete dissociation, the solubility product, K_sp, for lead iodide at 25°C is",1.0 × 10^−3,1.0 × 10^−6,1.0 × 10^−9,4.0 × 10^−9,D,"['none', 'regional', 'none', 'regional']","['No', 'Yes', 'No', 'No']","['-', '-', '-', '-']",[],['South America'],['United Kingdom (UK)'],CS,True
college_chemistry/test/23,college_chemistry,STEM,The 13C spectrum of which isomer of C6H14 has lines with five distinct chemical shifts?,hexane,2-methylpentane,3-methylpentane,"2,3-dimethylbutane",B,"['none', 'none', 'none', 'none']","['No', 'No', 'No', 'No']","['-', '-', '-', '-']",[],[],[],CA,True
college_chemistry/test/25,college_chemistry,STEM,Which nuclide has an NMR frequency of 115.5 MHz in a 20.0 T magnetic field?,17O,19F,29Si,31P,A,"['none', 'none', 'none', 'none']","['No', 'No', 'No', 'No']","['-', '-', '-', '-']",[],[],[],CA,True
college_chemistry/test/27,college_chemistry,STEM,A single line is seen in the 31P spectrum of a solution of sodium phosphate. The 31P chemical shifts of H2PO4‾ and HPO42– are 3.42 ppm and 5.82 ppm respectively. What is the chemical shift when the pH of the solution equals the pKa of H2PO4‾?,3.41 ppm,3.98 ppm,4.33 ppm,4.62 ppm,D,[],[],[],[],[],[],-,False
college_chemistry/test/29,college_chemistry,STEM,The Henry’s law constant for CO2 dissolved in water at 25°C is 30.0 atm M^−1. The concentration of dissolved CO2 in a vessel pressurized with 2.0 atm of CO2 is,1.5 M,0.15 M,0.067 M,0.015 M,C,"['none', 'none', 'regional', 'none']","['No', 'No', 'No', 'No']","['-', '-', '-', '-']",[],[],[],CA,True
college_chemistry/test/31,college_chemistry,STEM,A Cu(II) metal ion (giso = 2.12) produces four lines with a separation of 500 MHz between each line. Express the hyperfine splitting in field units of mT and the hyperfine coupling in units of wavenumbers.,500 MHz = 0.185 mT = 0.29842 cm-1,500 MHz = 16.850 mT = 0.01667 cm-1,500 MHz = 32.953 mT = 0.76298 cm-1,500 MHz = 45.672 mT = 2.86329 cm-1,C,"['regional', 'none', 'regional', 'none', 'none', 'none']","['No', 'No', 'No', 'No', 'No', 'No']","['-', '-', '-', '-', '-', '-']",[],[],[],CA,True
college_chemistry/test/34,college_chemistry,STEM,"The X-band (9.5 GHz) EPR spectrum of a matrix isolated Na atom reveals four hyperfine lines with resonant field positions of 3074 G, 3174 G, 3274 G and 3374 G. Calculate the g value of the atom.",g = 2.002,g = 1.950,g = 2.250,g = 2.005,A,"['none', 'none', 'none', 'none']","['No', 'No', 'No', 'No']","['-', '-', '-', '-']",[],[],[],CA,True
college_chemistry/test/35,college_chemistry,STEM,Calculate the spin angular momentum of 43Ca. [I = 7⁄2],2.166 x 10^-34 J s,3.691 x 10^-34 J s,4.185 x 10^-34 J s,5.493 x 10^-34 J s,C,"['none', 'none', 'none', 'none']","['No', 'No', 'No', 'No']","['-', '-', '-', '-']",[],[],[],CA,True
college_chemistry/test/36,college_chemistry,STEM,Calculate the magnetic field responsible for the polarization of 2.5 x 10^-6 for 13C at 298 K.,0.5 T,1.2 T,2.9 T,100 T,C,"['none', 'none', 'none', 'none', 'none']","['No', 'No', 'No', 'No', 'No']","['-', '-', '-', '-', '-']",[],[],[],CA,True
college_chemistry/test/37,college_chemistry,STEM,"The T2 of an NMR line is 15 ms. Ignoring other sources of linebroadening, calculate its linewidth.",0.0471 Hz,21.2 Hz,42.4 Hz,66.7 Hz,B,"['none', 'none', 'none', 'none']","['No', 'No', 'No', 'No']","['-', '-', '-', '-']",[],[],[],CA,True
college_chemistry/test/38,college_chemistry,STEM,What is the maximum value of the z-component of the spin angular momentum of 43Ca? [I = 7⁄2],3.691 x 10^-34 J s,4.185 x 10^-34 J s,5.493 x 10^-34 J s,8.370 x 10^-34 J s,A,[],[],[],[],[],[],-,False
college_chemistry/test/41,college_chemistry,STEM,Predict the hyperfine value for the EPR spectrum of fully deuteriated benzene radical anion C6D6•-.,0.375 mT,3.75 G,2.35 mT,0.58 G,D,"['none', 'none', 'none', 'none']","['No', 'No', 'No', 'No']","['-', '-', '-', '-']",[],[],[],CA,True
college_chemistry/test/42,college_chemistry,STEM,The strongest base in liquid ammonia is,NH3,NH2−,NH4+,N2H4,B,"['none', 'none', 'none', 'none']","['No', 'No', 'No', 'No']","['-', '-', '-', '-']",[],[],[],CA,True
college_chemistry/test/43,college_chemistry,STEM,The equilibrium populations of the 1H energy levels of a molecule are nα = nαeq and nβ = nβeq. What are the populations after a 5.0 μs pulse when B1 = 4.697 mT?,nα = nβeq and nβ = nαeq,nα = nαeq and nβ = nβeq,nα = ½(nαeq + nβeq) and nβ = ½(nαeq + nβeq),nα = nαeq + nβeq and nβ = nαeq + nβeq,A,[],[],[],[],[],[],-,False
college_chemistry/test/44,college_chemistry,STEM,Calculate the Q-factor for an X-band EPR cavity with a resonator bandwidth of 1.58 MHz.,Q = 1012,Q = 2012,Q = 3012,Q = 6012,D,[],[],[],[],[],[],-,False
college_chemistry/test/45,college_chemistry,STEM,The 13C chemical shifts of benzene and chloroform are 128.4 ppm and 77.2 ppm respectively. What is the difference in the 13C NMR frequencies of the two compounds on a 600 MHz spectrometer?,7.73 kHz,30.7 kHz,91.6 kHz,122 kHz,A,[],[],[],[],[],[],-,False
college_chemistry/test/47,college_chemistry,STEM,What is the strength (B1) of a 13C 90° pulse of duration 1 μs?,3.72 mT,5.18 mT,17.0 mT,23.3 mT,B,[],[],[],[],[],[],-,False
college_chemistry/test/49,college_chemistry,STEM,"A radioactive isotope, which is used in diagnostic imaging, has a half-life of 6.0 hours. If a quantity of this isotope has an activity of 150 mCi when it is delivered to a hospital, how much activity will remain 24 hours after delivery? (mCi = microcuries)",150 mCi,38 mCi,19 mCi,9.4 mCi,D,[],[],[],[],[],[],-,False
college_chemistry/test/50,college_chemistry,STEM,"What is the orbital angular momentum quantum number, l, of the electron that is most easily removed when ground-state aluminum is ionized?",3,2,1,0,C,"['none', 'none', 'none', 'none', 'none', 'none', 'none', 'none']","['No', 'No', 'No', 'No', 'No', 'No', 'No', 'No']","['-', '-', '-', '-', '-', '-', '-', '-']",[],[],[],CA,True
college_chemistry/test/52,college_chemistry,STEM,"A silyl radical bearing an Si-H· fragment has a g value of 2.0033 and a pair of lines separated by 15.5 MHz. Express the splitting in units of mT, Gauss and cm-1.",15.5 MHz = 11.104 mT = 27.201 Gauss = 0.862 x 10^-4 cm-1,15.5 MHz = 7.352 mT = 10.104 Gauss = 18.39 x 10^-4 cm-1,15.5 MHz = 1.55 mT = 0.562 Gauss = 31.0 x 10^-4 cm-1,15.5 MHz = 0.553 mT = 5.530 Gauss = 5.17 x 10^-4 cm-1,B,"['none', 'none', 'none', 'none']","['No', 'No', 'No', 'No']","['-', '-', '-', '-']",[],[],[],CA,True
college_chemistry/test/54,college_chemistry,STEM,Calculate spin density on the central carbon atom of malonic acid radical (•CH(COOH)2) if the hyperfine value for the α-hydrogen atom is 21.9 G.,0.95,0.85,0.15,0.65,C,[],[],[],[],[],[],-,False
college_chemistry/test/57,college_chemistry,STEM,What is the magnetic moment of 205Tl?,"[ɣ (205TI = 1.569 x 108 T-1 s-1, I = ½]",0.717 x 10^-26 J T-1,0.827 x 10^-26 J T-1,1.433 x 10^-26 J T-1,C,[],[],[],[],[],[],-,False
college_chemistry/test/58,college_chemistry,STEM,A molecule has a rotational correlation time of 1 ns. At what magnetic field would protons in this molecule have the fastest spin-lattice relaxation? [Use eqns 5.3 and 5.4.],3.74 T,5.19 T,6.08 T,9.49 T,A,[],[],[],[],[],[],-,False
college_chemistry/test/61,college_chemistry,STEM,Calculate the equilibrium polarization of 13C nuclei in a 20.0 T magnetic field at 300 K.,10.8 x 10^-5,4.11 x 10^-5,3.43 x 10^-5,1.71 x 10^-5,D,"['none', 'none', 'none', 'none', 'none', 'none', 'none']","['No', 'No', 'No', 'No', 'No', 'No', 'No']","['-', '-', '-', '-', '-']",[],[],[],CA,True
college_chemistry/test/62,college_chemistry,STEM,"The magnetic moment (μI) of an unknown nuclide is 2.884 x 10^-27 J T-1. Given the nuclear spin is known to be 1, identify the unknown nuclide.",14N,2H,19F,6Li,B,"['none', 'none', 'none', 'none']","['No', 'No', 'No', 'No']","['-', '-', '-', '-']",[],[],[],CA,True
college_chemistry/test/67,college_chemistry,STEM,23Na has an NMR frequency of 198.52 MHz in a 750 MHz NMR spectrometer. What is its magnetogyric ratio?,101.1 x 10^7 T-1 s-1,26.75 x 10^7 T-1 s-1,7.081 x 10^7 T-1 s-1,0.9377 x 10^7 T-1 s-1,C,[],[],[],[],[],[],-,False
college_chemistry/test/68,college_chemistry,STEM,Exact solutions of the Schrödinger equation CANNOT be obtained for a,simple harmonic oscillator,particle in a one-dimensional box,rigid rotor,helium atom,D,[],[],[],[],[],[],-,False
college_chemistry/test/69,college_chemistry,STEM,What is the limiting high-temperature molar heat capacity at constant volume (C_V) of a gas-phase diatomic molecule?,1.5R,2R,2.5R,3.5R,D,"['none', 'none', 'none', 'none']","['No', 'No', 'No', 'No']","['-', '-', '-', '-']",[],[],[],CA,True
college_chemistry/test/70,college_chemistry,STEM,The +1 oxidation state is more stable than the +3 oxidation state for which group 13 element?,B,Al,In,Tl,D,[],[],[],[],[],[],-,False
college_chemistry/test/71,college_chemistry,STEM,The fact that the infrared absorption frequency of deuterium chloride (DCl) is shifted from that of hydrogen chloride (HCl) is due to the differences in their,electron distribution,dipole moment,force constant,reduced mass,D,[],[],[],[],[],[],-,False
college_chemistry/test/72,college_chemistry,STEM,The number of allowed energy levels for the 55Mn nuclide are:,3,5,8,4,A,"['none', 'none', 'none', 'none']","['No', 'No', 'No', 'No']","['-', '-', '-', '-']",[],[],[],CA,True
college_chemistry/test/73,college_chemistry,STEM,A substance that is NOT generally considered to be a toxic pollutant in water is,carbonic acid,a halogenated hydrocarbon,lead,mercury,A,"['none', 'none', 'none', 'none']","['No', 'No', 'No', 'No']","['-', '-', '-', '-']",[],[],[],CA,True
college_chemistry/test/74,college_chemistry,STEM,"All proteins absorb electromagnetic radiation of wavelength around 190 nm, which corresponds to a π → π* excitation in the protein molecule. In which region of the spectrum is this wavelength found?",X-ray,Ultraviolet,Visible,Infrared,B,"['none', 'none', 'none', 'none']","['No', 'No', 'No', 'No']","['-', '-', '-', '-']",[],[],[],CA,True
college_chemistry/test/75,college_chemistry,STEM,"The rotational correlation time of a spherical object of radius r immersed in a liquid with viscosity η is given by the Stokes equation: τc = 4πηr3/3kBT. A small molecule with relative molecular mass Mr = 100 in water at 298 K has τc = 50 ps. Assuming that Mr is proportional to the molecular volume, estimate τc for a small protein with Mr = 8400.",420 ns,42 ns,4.2 ns,420 ps,C,[],[],[],[],[],[],-,False
college_chemistry/test/78,college_chemistry,STEM,A buffer is made from equal concentrations of a weak acid and its conjugate base. Doubling the volume of the buffer solution by adding water has what effect on its pH?,It has little effect.,It significantly increases the pH.,It significantly decreases the pH.,It changes the pH asymptotically to the pKa of the acid.,A,[],[],[],[],[],[],-,False
college_chemistry/test/81,college_chemistry,STEM,An electron and a proton are placed in a 1.0 T magnetic field at 300 K. What is the ratio of the equilibrium polarizations: |pe / pH| ?,[|ɣe| = 1.761 x 10^11 T^-1 s^-1],820,658,329,B,[],[],[],[],[],[],-,False
college_chemistry/test/82,college_chemistry,STEM,"The amplitude of a free induction decay drops to 25% of its initial intensity after 1.0 s. Assuming exponential relaxation and Ω = 0, determine the value of T2.",0.721 s,0.750 s,1.386 s,1.661 s,D,[],[],[],[],[],[],-,False
college_chemistry/test/85,college_chemistry,STEM,A PO3- radical produces a pair of lines separated by 280 MHz with giso = 2.005. Calculate the expected resonant field positions of both lines in the X-band EPR spectrum (ν = 9.5 GHz).,Bres for mI = -½ = 325.0 mT; Bres for mI = +½ = 335.0 mT,Bres for mI = -½ = 123.5 mT; Bres for mI = +½ = 124.5 mT.,Bres for mI = -½ = 333.5 mT; Bres for mI = +½ = 343.5 mT.,Bres for mI = -½ = 0.218 mT; Bres for mI = +½ = 0.418 mT.,D,[],[],[],[],[],[],-,False
college_chemistry/test/86,college_chemistry,STEM,"Calculate the relative occupancies of the α and β spin energy levels for a radical species with g = 2.05, at L- and W-band frequencies (take TS = 300 K).",Nα/Nβ = 0.9800 at L-band; Nα/Nβ = 0.9509 at W-band,Nα/Nβ = 0.9950 at L-band; Nα/Nβ = 0.9609 at W-band,Nα/Nβ = 0.9910 at L-band; Nα/Nβ = 0.9709 at W-band,Nα/Nβ = 0.9850 at L-band; Nα/Nβ = 0.9809 at W-band,D,"['none', 'none', 'none', 'none']","['No', 'No', 'No', 'No']","['-', '-', '-', '-']",[],[],[],CA,True
college_chemistry/test/89,college_chemistry,STEM,"The 99Ru chemical shift of [Ru(H2O)6]2+ is 16,050 ppm relative to [Ru(CN)6]2- at 0 ppm. The electronic excitation energies of [Ru(H2O)6]2+, [Ru(CN)6]2- and [Ru(NH3)6]2+ are 18,900, 40,000 and 25,600 cm-1 respectively. Assuming that the chemical shift differences are dominated by paramagnetic currents, determine the chemical shift of [Ru(NH3)6]2+.","7,530 ppm","8,090 ppm","11,070 ppm","14,840 ppm",B,[],[],[],[],[],[],-,False
college_chemistry/test/90,college_chemistry,STEM,"During a delay, spins with an offset frequency Ω = 250 rad s-1 precess through an angle of 60°. How long is the delay?",4.19 ms,26.3 ms,240 ms,1510 ms,A,[],[],[],[],[],[],-,False
college_chemistry/test/92,college_chemistry,STEM,Nitronyl nitroxides are stable radicals in which the unpaired electron is coupled to two equivalent nitrogen nuclei. How many lines will appear in the EPR spectrum of a solution of a rigid nitronyl nitroxide diradical with J >> a?,3 lines,9 lines,5 lines,7 lines,D,"['none', 'none', 'none', 'none', 'none', 'none', 'none']","['No', 'No', 'No', 'No', 'No', 'No', 'No']","['-', '-', '-', '-', '-', '-', '-']",[],[],[],CA,True
college_chemistry/test/97,college_chemistry,STEM,What is the NMR frequency of 31P in a 20.0 T magnetic field?,54.91 MHz,239.2 MHz,345.0 MHz,2167 MHz,C,"['none', 'none', 'none', 'none', 'none', 'none', 'none']","['No', 'No', 'No', 'No', 'No', 'No', 'No']","['-', '-', '-', '-', '-', '-', '-']",[],[],[],CA,True
college_chemistry/test/98,college_chemistry,STEM,Predict the number of lines in the EPR spectrum of a solution of dimethylnitroxide (CH3)2NO• assuming the lines do not overlap.,21,3,7,24,B,[],[],[],[],[],[],-,False
