sample_id,subject,subject_category,question,option_a,option_b,option_c,option_d,answer,required_knowledge,time_sensitive,reference,culture,region,country,cultural_sensitivity_label,is_annotated
high_school_biology/test/1,high_school_biology,STEM,Which of the changes below following the start codon in an mRNA would most likely have the greatest deleterious effect?,a deletion of a single nucleotide,a deletion of a nucleotide triplet,a single nucleotide substitution of the nucleotide occupying the first codon position,a single nucleotide substitution of the nucleotide occupying the third codon position,A,[],[],[],[],[],[],-,False
high_school_biology/test/3,high_school_biology,STEM,"During the period when life is believed to have begun, the atmosphere on primitive Earth contained abundant amounts of all the following gases EXCEPT",oxygen,hydrogen,ammonia,methane,A,[],[],[],[],[],[],-,False
high_school_biology/test/4,high_school_biology,STEM,Convergent evolution is best exemplified by which of the following?,The pectoral fins of fish and the front legs of cats,The presence of a notochord in all chordate embryos,The wings of an insect and the wings of a bird,The leaves of an oak tree and the spines of a cactus,C,[],[],[],[],[],[],-,False
high_school_biology/test/5,high_school_biology,STEM,Which of the following would most likely provide examples of mitotic cell divisions?,cross section of muscle tissue,cross section of an anther (site of pollen production in a flower),longitudinal section of a shoot tip,cross section of a leaf,C,[],[],[],[],[],[],-,False
high_school_biology/test/6,high_school_biology,STEM,Invertebrate immune systems possess which of the following?,Cytotoxic T-lymphocytes,Phagocytes,B-cells,Helper T-cells,B,"['none', 'none', 'none', 'none']","['No', 'No', 'No', 'No']","['-', '-', '-', '-']",[],[],[],CA,True
high_school_biology/test/8,high_school_biology,STEM,Which of the following is the most likely benefit of periodic natural wildfires in some forest ecosystems?,"The fires remove dead and decaying plant matter, reducing the risk of more intense and destructive fires.",The fires leach nutrients from the soil‚ preventing the germination of plants that might compete with native species.,The fires drive off herbivores whose plant-based diets reduce the amount of vegetation.,The fires dry out the soil and decrease the chance of flooding after heavy rains.,A,"['none', 'none', 'none', 'none']","['No', 'No', 'No', 'No']","['-', '-', '-', '-']",[],[],[],CA,True
high_school_biology/test/9,high_school_biology,STEM,"In a hypothetical environment, fishes called pike-cichlids are visual predators of algae-eating fish (i.e., they locate their prey by sight). If a population of algae-eaters experiences predation pressure from pike-cichlids, which of the following should least likely be observed in the algae-eater population over the course of many generations?",Selection for drab coloration of the algae-eaters,Selection for nocturnal algae-eaters (active only at night),"Selection for larger female algae-eaters, bearing broods composed of more, and larger, young",Selection for algae-eaters that become sexually mature at smaller overall body sizes,C,"['none', 'none', 'none', 'none']","['No', 'No', 'No', 'No']","['-', '-', '-', '-']",[],[],[],CA,True
high_school_biology/test/11,high_school_biology,STEM,"The same gene that causes various coat patterns in wild and domesticated cats also causes the cross-eyed condition in these cats, the cross-eyed condition being slightly maladaptive. In a hypothetical environment, the coat pattern that is associated with crossed eyes is highly adaptive, with the result that both the coat pattern and the cross-eyed condition increase in a feline population over time. Which statement is supported by these observations?",Evolution is progressive and tends toward a more perfect population.,Phenotype is often the result of compromise.,Natural selection reduces the frequency of maladaptive genes in populations over the course of time.,"Polygenic inheritance is generally maladaptive, and should become less common in future generations.",B,"['none', 'none', 'none', 'none', 'none']","['No', 'No', 'No', 'No', 'No']","['-', '-', '-', '-', '-']",[],[],[],CA,True
high_school_biology/test/12,high_school_biology,STEM,Which of the following statements is correct?,Water flows from hypertonic to hypotonic.,Germinating seeds use less oxygen than do nongerminating seeds.,The rate of transpiration decreases with an increase in air movement.,Smaller DNA fragments migrate more rapidly than do larger DNA fragments on gel electrophoresis.,D,"['none', 'none', 'none', 'none', 'none']","['No', 'No', 'No', 'No', 'No']","['-', '-', '-', '-', '-']",[],[],[],CA,True
high_school_biology/test/13,high_school_biology,STEM,A gas phase is generally absent from which of the following biogeochemical cycles?,Water,Carbon,Sulfur,Phosphorus,D,[],[],[],[],[],[],-,False
high_school_biology/test/14,high_school_biology,STEM,Which of the following is a property that is shared by Zika fever‚ West Nile fever‚ and malaria?,The diseases are caused by viruses.,The diseases occur only in individuals who visit or live in tropical countries.,The pathogens that cause the diseases have developed resistance to antibiotics.,The pathogens that cause the diseases are primarily transmitted by the bite of an infected mosquito.,D,[],[],[],[],[],[],-,False
high_school_biology/test/16,high_school_biology,STEM,Which of the following statements about lipids is correct?,Unsaturated fatty acids are linked to heart disease.,Lipids make up most cell surface receptors.,Phospholipids are water soluble.,Steroids are lipids that consist of glycerol and fatty acids.,C,[],[],[],[],[],[],-,False
high_school_biology/test/17,high_school_biology,STEM,All of the following are examples of connective tissue EXCEPT,ligaments,muscle,blood,cartilage,B,[],[],[],[],[],[],-,False
high_school_biology/test/18,high_school_biology,STEM,The light reactions of photosynthesis supply the Calvin cycle with which of the following?,The light reactions provide oxygen for the light-independent reactions.,ATP and NADPH provide the power and raw materials for the Calvin cycle.,Water entering the plant through the roots provides hydrogen directly to the Calvin cycle.,CO2 released by the light-dependent reactions provides the raw material for the Calvin cycle.,B,[],[],[],[],[],[],-,False
high_school_biology/test/19,high_school_biology,STEM,"When the first tiny prokaryotic cell took up residence inside a larger prokaryotic cell, it heralded the advent of the eukaryotic cell and led to an explosion of new life on Earth. Since then, most cells on Earth have internal organelles. Which of the following best summarizes an advantage of having internal membranes and organelles?",DNA can reproduce more efficiently.,"Even though prokaryotes do not have mitochondria, they contain structures that carry out the same function.",Organelles separate specific reactions in the cell and increase metabolic efficiency.,Compartmentalization enables prokaryotes to reproduce more quickly.,C,[],[],[],[],[],[],-,False
high_school_biology/test/20,high_school_biology,STEM,Which of the following is correct about vaccination?,It increases the number of different receptors that recognize a particular pathogen.,It increases the number of different macrophages specific to the antigen.,It increases the number of epitopes that the immune system can recognize.,It increases the number of lymphocytes with receptors that can recognize and bind to the antigen.,D,"['none', 'none', 'none', 'none']","['No', 'No', 'No', 'No']","['-', '-', '-', '-']",[],[],[],CA,True
high_school_biology/test/24,high_school_biology,STEM,All of the following statements are true EXCEPT,thyroxine increases the rate of metabolism,insulin decreases storage of glycogen,vasopressin stimulates water reabsorption in the kidney,epinephrine increases blood sugar levels and heart rate,B,[],[],[],[],[],[],-,False
high_school_biology/test/25,high_school_biology,STEM,Which of the following statements best describes what a Barr body is and its significance?,It is an inactivated Y chromosome and results in a man being sterile.,"It is an inactivated Y chromosome, and the person who has it appears female.",It is an inactivated X chromosome and results in females with half their cells having one X inactivated and the other half of their cells having the other X inactivated.,It is an inactivated X chromosome and results in females who are sterile.,C,[],[],[],[],[],[],-,False
high_school_biology/test/27,high_school_biology,STEM,Which of the following reactions occurs in the forward direction during glycolysis but in the reverse direction during fermentation?,pyruvate → lactate,pyruvate → ethanol,NAD+ + H+ + 2e- → NADH,ADP + P → ATP,C,"['none', 'none', 'none', 'none']","['No', 'No', 'No', 'No']","['-', '-', '-', '-']",[],[],[],CA,True
high_school_biology/test/29,high_school_biology,STEM,Which of the following statements most accurately explains what EcoR1 is?,It is a bacterium that lives in the human large intestine.,"It is the best-studied bacteriophage, a virus that attacks E. coli.",It is a restriction enzyme extracted from E. coli.,It is a type of DNA used extensively in research.,C,[],[],[],[],[],[],-,False
high_school_biology/test/30,high_school_biology,STEM,Which of the following pairs of structures is least likely to represent homology?,The wings of a bat and the arms of a human,The hemoglobin of a baboon and that of a gorilla,The mitochondria of a plant and those of an animal,The wings of a bird and those of an insect,D,[],[],[],[],[],[],-,False
high_school_biology/test/34,high_school_biology,STEM,Which of the following best explains why a population is described as the evolutionary unit?,Genetic changes can only occur at the population level.,The gene pool in a population remains fixed over time.,"Natural selection affects individuals, not populations.","Individuals cannot evolve, but populations can.",D,[],[],[],[],[],[],-,False
high_school_biology/test/37,high_school_biology,STEM,Which of the following contributes the MOST to genetic variability in a population?,Sporulation,Binary fission,Vegetative propagation,Mutation,D,[],[],[],[],[],[],-,False
high_school_biology/test/38,high_school_biology,STEM,Which of the following statements most detracts from the claim that the human appendix is a completely vestigial organ?,The appendix can be surgically removed with no immediate ill effects.,The appendix might have been larger in fossil hominids.,The appendix has a substantial amount of defensive lymphatic tissue.,Individuals with a larger-than-average appendix leave fewer offspring than those with a below-average-sized appendix.,C,[],[],[],[],[],[],-,False
high_school_biology/test/41,high_school_biology,STEM,Which of the following statements best summarizes evolution as it is viewed today?,It is goal-directed.,It represents the result of selection for acquired characteristics.,It is synonymous with the process of gene flow.,It is the differential survival and reproduction of the most-fit phenotypes.,D,[],[],[],[],[],[],-,False
high_school_biology/test/42,high_school_biology,STEM,Mosquitoes resistant to the pesticide DDT first appeared in India in 1959 within 15 years of widespread spraying of the insecticide. Which of the following statement best explains how the resistant mosquitoes arose?,Some mosquitoes experienced a mutation after being exposed to DDT that made them resistant to the insecticide. Then their population expanded because these moquitoes had no competition.,Some mosquitoes were already resistant to DDT when DDT was first sprayed. Then their population expanded because all the susceptible mosquitoes had been exterminated.,DDT is generally a very effective insecticide. One can only conclude that it was manufactured improperly.,"Although DDT is effective against a wide range of insects, it is not effective against mosquitoes.",B,"['none', 'none', 'regional', 'none', 'regional']","['No', 'No', 'No', 'No', 'No']","['-', '-', '-', '-', '-']",[],['Asia'],"['India', 'India']",CA,True
high_school_biology/test/43,high_school_biology,STEM,DNA sequences in many human genes are very similar to the sequences of corresponding genes in chimpanzees. The most likely explanation for this result is that,humans and chimpanzees share a relatively recent common ancestor.,humans evolved from chimpanzees.,chimpanzees evolved from humans.,convergent evolution led to the DNA similarities.,A,"['none', 'none', 'none', 'none']","['No', 'No', 'No', 'No']","['-', '-', '-', '-']",[],[],[],CA,True
high_school_biology/test/44,high_school_biology,STEM,Yeast cells carry out both aerobic and anaerobic respiration. A yeast cell that is fed on glucose is moved from an aerobic to an anaerobic environment. Which of the following statements is correct and gives the correct reason for it?,The cell dies because it cannot make ATP.,The cell would need to consume glucose at a much greater rate because aerobic respiration is much more efficient as compared with anaerobic respiration.,The cell would need to consume another food source other than glucose because it will not be able to make adequate ATP with only glucose.,The cell will begin to divide rapidly because larger cells require more oxygen and glucose than smaller ones.,B,[],[],[],[],[],[],-,False
high_school_biology/test/45,high_school_biology,STEM,A researcher conducts a survey of a biome and finds 35 percent more species than she has found in any other biome. Which biome is she most likely to be in?,Tundra,Tiaga,Tropical rainforest,Temperate deciduous forest,C,[],[],[],[],[],[],-,False
high_school_biology/test/47,high_school_biology,STEM,Which of the following best explains why people can digest starch but cannot digest cellulose even though both molecules are composed of glucose monomers?,The bonds linking the monomers of starch differ in shape from the bonds linking the monomers of cellulose.,Molecules of starch are much smaller than molecules of cellulose.,"Starch is an intracellular molecule, while cellulose is an extracellular molecule.","Starch is hydrated by water, but cellulose is not.",A,[],[],[],[],[],[],-,False
high_school_biology/test/49,high_school_biology,STEM,Which of the following is a biotic factor that could affect the growth rate of a population?,Volcanic eruption,Glacier melting,Destruction of the ozone layer,Sudden reduction in the animal food resource,C,[],[],[],[],[],[],-,False
high_school_biology/test/55,high_school_biology,STEM,"Two trees of the same species growing close together will use the same resources, such as light, water, and nutrients. If any of these resources becomes limiting, then each tree will receive less of it than if the trees were growing farther apart. This scenario is an example of which of the following?",Parasitism,Commensalism,Natural selection,Intraspecific competition,D,[],[],[],[],[],[],-,False
high_school_biology/test/58,high_school_biology,STEM,Hydrangea flowers have one gene for flower color. Plants of the same genetic variety have flowers that range in color from blue to pink with the color varying due to the type of soil in which they are grown. Which of the following statement best explains this phenomenon?,The alleles for flower color show incomplete dominance where neither trait is dominant; expression of the genes shows a blending of traits.,The alleles for flower color are codominant; both traits show depending on the environment.,"In this case, the environment alters the expression of a trait.",The genes for flower color show polygenic inheritance.,C,[],[],[],[],[],[],-,False
high_school_biology/test/60,high_school_biology,STEM,"Although mutations occur at a regular and predictable rate, which of the following statements is the LEAST likely reason the frequency of mutation appears to be low?",Some mutations produce alleles that are recessive and may not be expressed.,Some undesirable phenotypic traits may be prevented from reproducing.,Some mutations cause such drastic phenotypic changes that they are removed from the gene pool.,The predictable rate of mutation results in ongoing variability in a gene pool.,D,[],[],[],[],[],[],-,False
high_school_biology/test/61,high_school_biology,STEM,Crossover would most likely occur in which situation?,Two genes (1 and 2) are located right next to each other on chromosome A.,"Gene 1 is located on chromosome A, and gene 2 is on chromosome B.",Genes 1 and 2 are located near each other on the X chromosome.,Gene 1 is located on chromosome A; gene 2 is located far away but on the same chromosome.,D,[],[],[],[],[],[],-,False
high_school_biology/test/62,high_school_biology,STEM,Which aspects of cell structure best reveals the unity of all life?,All cells are surrounded by a plasma membrane.,All cells have at least one nucleus.,All cells carry out cellular respiration in mitochondria.,The surface-to-volume ratio of all cells is the same.,A,[],[],[],[],[],[],-,False
high_school_biology/test/66,high_school_biology,STEM,All of the following play a role in morphogenesis EXCEPT,apoptosis,homeotic genes,operons,inductive effects,C,[],[],[],[],[],[],-,False
high_school_biology/test/68,high_school_biology,STEM,Which of the following is (are) required when performing a polymerase chain reaction (P C R) on a DNA sample?,Reverse transcriptase,A vacuum chamber,Primers complementary to certain portions of the DNA,DNA ligase,C,[],[],[],[],[],[],-,False
high_school_biology/test/69,high_school_biology,STEM,"Each of the following has a better chance of influencing gene frequencies in small populations than in large populations, but which one most consistently requires a small population as a precondition for its occurrence?",Mutation,Non-random mating,Genetic drift,Natural selection,C,[],[],[],[],[],[],-,False
high_school_biology/test/72,high_school_biology,STEM,Which of the following statements is NOT correct about ancient Earth?,Earth was formed about 4? billion years ago.,Amino acid synthesis could have been stimulated by volcanic eruption.,"The first cells formed about 3? billion years ago, according to the fossil record.",The presence of free oxygen facilitated the rapid formation of organic molecules.,D,[],[],[],[],[],[],-,False
high_school_biology/test/73,high_school_biology,STEM,"In modern terminology, diversity is understood to be a result of genetic variation. Sources of variation for evolution include all of the following except",mistakes in translation of structural genes.,mistakes in DNA replication.,translocations and mistakes in meiosis.,recombination at fertilization.,A,[],[],[],[],[],[],-,False
high_school_biology/test/75,high_school_biology,STEM,"Within a few weeks of treatment with the drug 3TC, a patient's HIV population consists entirely of 3TC-resistant viruses. How can this result best be explained?",HIV can change its surface proteins and resist vaccines.,The patient must have become reinfected with 3TC-resistant viruses.,HIV began making drug-resistant versions of reverse transcriptase in response to the drug.,"A few drug-resistant viruses were present at the start of treatment, and natural selection increased their frequency.",D,[],[],[],[],[],[],-,False
high_school_biology/test/77,high_school_biology,STEM,The resting membrane potential depends on which of the following? I. Active transport II. Selective permeability III. Differential distribution of ions across the axonal membrane,III only,I and II only,II and III only,"I, II, and III",D,[],[],[],[],[],[],-,False
high_school_biology/test/78,high_school_biology,STEM,Which of the following statements about the light-dependent reactions of photosynthesis is correct?,They provide the carbon that becomes incorporated into sugar.,"They produce PGA, which is converted to glucose by carbon fixation in the light-independent reactions.","Water is split apart, providing hydrogen ions and electrons to NADP for temporary storage.",They occur in the stroma of chloroplasts.,C,[],[],[],[],[],[],-,False
high_school_biology/test/80,high_school_biology,STEM,Most Swiss starlings produce four to five eggs in each clutch. Those producing fewer or more than this have reduced fitness. Which of the following terms best describes this?,artificial selection,directional selection,stabilizing selection,disruptive selection,C,[],[],[],[],[],[],-,False
high_school_biology/test/81,high_school_biology,STEM,Members of two different species possess a similar-looking structure that they use in a similar fashion to perform the same function. Which information would best help distinguish between an explanation based on homology versus one based on convergent evolution?,The two species live at great distance from each other.,"The two species share many proteins in common, and the nucleotide sequences that code for these proteins are almost identical.",The sizes of the structures in adult members of both species are similar in size.,Both species are well adapted to their particular environments.,B,"['none', 'none', 'none', 'none', 'none']","['No', 'No', 'No', 'No', 'No']","['-', '-', '-', '-', '-']",[],[],[],CA,True
high_school_biology/test/82,high_school_biology,STEM,"When driving from east to west in the U.S. from a forest ecosystem to grasslands, trees gradually give way to grasses. Which of the following is the critical factor responsible for this shift?",Amount of sunlight,Availability of oxygen,Availability of water,Length of growing season,C,[],[],[],[],[],[],-,False
high_school_biology/test/83,high_school_biology,STEM,"Within a cell, the amount of protein synthesized using a given mRNA molecule depends in part on which of the following?",DNA methylation suppresses the expression of genes.,"Transcription factors mediate the binding of RNA polymerase and the initiation of transcription, which will determine how much protein is manufactured.",The speed with which mRNA is degraded will determine how much protein is synthesized.,The location and number of ribosomes in a cell will solely determine how much protein is synthesized.,C,[],[],[],[],[],[],-,False
high_school_biology/test/84,high_school_biology,STEM,All of the following are modes of asexual reproduction EXCEPT,sporulation,fission,budding,meiosis,D,[],[],[],[],[],[],-,False
high_school_biology/test/86,high_school_biology,STEM,Which of the following statements about cellular respiration is correct?,Most CO2 produced during cellular respiration is released from glycolysis.,Protons are pumped through ATP synthase by active transport.,The final electron acceptor of the electron transport chain is NAD+.,ATP is formed because an endergonic reaction is coupled with an exergonic reaction.,D,[],[],[],[],[],[],-,False
high_school_biology/test/87,high_school_biology,STEM,Which of the following principles is NOT part of Darwin's theory of evolution by natural selection?,Evolution is a gradual process that occurs over a long period of time.,Every population has tremendous variation.,Mutations are the main source of all variation in a population.,"Organisms will overpopulate area, giving rise to competition.",C,[],[],[],[],[],[],-,False
high_school_biology/test/89,high_school_biology,STEM,Which of the following is most likely to increase the rate of diffusion of an uncharged solute across the plasma membrane of a cell?,Decreasing the number of different solutes in the solution that bathes the cells,Increasing the concentration gradient of the solute across the membrane,Increasing the ratio of phospholipids to proteins in the membrane,Decreasing the membrane potential across the membrane,B,[],[],[],[],[],[],-,False
high_school_biology/test/93,high_school_biology,STEM,"In reference to a segment of DNA, which of the following molecules contains the fewest number of nucleotides?",a single strand of the original DNA segment,a single strand of the original DNA segment after a point mutation,the primary RNA transcript (before splicing) from the original DNA,a single strand of complementary DNA (cDNA) made from the original DNA,D,[],[],[],[],[],[],-,False
high_school_biology/test/96,high_school_biology,STEM,Which of the following represents an idea that Darwin learned from the writings of Thomas Malthus?,All species are fixed in the form in which they are created.,Populations tend to increase at a faster rate than their food supply normally allows.,Earth changed over the years through a series of catastrophic upheavals.,The environment is responsible for natural selection.,B,[],[],[],[],[],[],-,False
high_school_biology/test/97,high_school_biology,STEM,Which of the following would most likely describe the fate of a vesicle formed as a result of phagocytosis?,The vesicle merges with a mitochondrion.,The vesicle merges with a lysosome.,"The vesicle is shuttled to the nucleus, and its contents become part of the nucleolus.",The vesicle releases its contents to the cytoplasm to be digested.,B,[],[],[],[],[],[],-,False
high_school_biology/test/99,high_school_biology,STEM,Which of the following theories is based on the notion that mitochondria and chloroplasts evolved from prokaryotic cells?,Fluid mosaic model,Endosymbiotic model,Taxonomic model,Respiration feedback model,B,"['none', 'none', 'none', 'none', 'none', 'none', 'none']","['No', 'No', 'No', 'No', 'No', 'No', 'No']","['-', '-', '-', '-', '-', '-', '-']",[],[],[],CA,True
high_school_biology/test/102,high_school_biology,STEM,Which of the following is NOT a characteristic of asexual reproduction in animals?,Daughter cells have the same number of chromosomes as the parent cell.,Daughter cells are identical to the parent cell.,The parent cell produces diploid cells.,The daughter cells fuse to form a zygote.,D,[],[],[],[],[],[],-,False
