sample_id,subject,subject_category,question,option_a,option_b,option_c,option_d,answer,required_knowledge,time_sensitive,reference,culture,region,country,cultural_sensitivity_label,is_annotated
high_school_government_and_politics/test/164,high_school_government_and_politics,Social Sciences,Which of the following statements about the House of Representatives is true?,All revenue bills must originate in the Senate before moving to the House.,"Representation in the House is allocated equally among the states, while representation in the Senate is allocated proportional to population.",The Speaker of the House wields less power than the president pro tempore of the Senate.,"The House has a Committee on Ways and Means, while the Senate does not.",D,"['regional', 'regional', 'regional', 'cultural']","['No', 'No', 'No', 'No']","['-', '-', {'end': 68, 'label': 'Geographic', 'score': None, 'start': 44}, {'end': 68, 'label': 'Cultural', 'score': None, 'start': 44}]",['Western Culture'],"['North America', 'North America']","['United States of America (USA)', 'United States of America (USA)', 'United States of America (USA)', 'United States of America (USA)']",CS,True
high_school_government_and_politics/test/165,high_school_government_and_politics,Social Sciences,Which of the following best describes the Supreme Court's doctrine of incorporation?,"Although the Constitution empowers the federal government to regulate international trade, states may establish boycotts of goods imported from countries that use child labor.","While the Congress creates laws, and the executive branch enacts and enforces those laws, only the Supreme Court may decide which laws and executive actions are unconstitutional.","The Fifth Amendment guarantees that an individual may not be deprived of life, liberty, or property without due process, and this protection provides a legal justification for those who do not wish to serve on a jury.","The Bill of Rights articulates certain rights in order to protect individuals from the federal government, and the Fourteenth Amendment extends most of those rights to protect individuals from the state governments as well.",D,[],[],[],[],[],[],-,False
high_school_government_and_politics/test/170,high_school_government_and_politics,Social Sciences,Appointments to which of the following positions must be confirmed by the Senate before taking effect? I. Director of Homeland Security II. Secretary of the Treasury III. National Security Advisor IV. U.S. Ambassador to the United Nations,II only,I and III only,II and IV only,"I, II, and IV only",D,[],[],[],[],[],[],-,False
high_school_government_and_politics/test/171,high_school_government_and_politics,Social Sciences,Which of the following best describes a block grant?,Money provided to individuals to fund research projects,Funds with few restrictions that are provided to state or local governments for general purpose use,Funds distributed among states according to a set formula,Money that can only be used for a specific purpose,B,[],[],[],[],[],[],-,False
high_school_government_and_politics/test/172,high_school_government_and_politics,Social Sciences,A member of the House of Representatives wishing to influence tax policy would most likely try to serve on which of the following committees?,Commerce,Ways and Means,Education and the Workforce,Resources,B,"['regional', 'regional', 'regional', 'regional']","['Yes', 'No', 'No', 'No']","[{'end': 40, 'label': 'Geographic', 'score': None, 'start': 16}, {'end': 40, 'label': 'Geographic', 'score': None, 'start': 16}, {'end': 40, 'label': 'Cultural', 'score': None, 'start': 16}, {'end': 40, 'label': 'Geographic', 'score': None, 'start': 16}]",['Western Culture'],['North America'],"['United States of America (USA)', 'United States of America (USA)', 'United States of America (USA)', 'United States of America (USA)']",CS,True
high_school_government_and_politics/test/173,high_school_government_and_politics,Social Sciences,Which of the following is an example of devolution?,Allowing states to decide how to meet federally mandated greenhouse gas emissions targets,"A ""race to the bottom"" in which states compete with one another to have the fewest environmental regulations",A state that legalizes marijuana possession in conflict with federal law,A state being prevented from implementing a fuel efficiency standard that is more stringent than that set by the federal government,A,"['none', 'none', 'none', 'none']","['No', 'No', 'No', 'No']","['-', '-', '-', '-']",[],[],[],CA,True
high_school_government_and_politics/test/177,high_school_government_and_politics,Social Sciences,Which of the following CANNOT limit the influence of the federal courts?,A constitutional amendment to the contrary of a court decision,The impeachment of a federal judge,A governor's failure to enforce a court decision,A national election recalling an unpopular judge,D,[],[],[],[],[],[],-,False
high_school_government_and_politics/test/178,high_school_government_and_politics,Social Sciences,All of the following are constitutionally mandated presidential powers EXCEPT the power to,negotiate treaties,veto legislation,grant reprieves and pardons,declare war,D,[],[],[],[],[],[],-,False
high_school_government_and_politics/test/179,high_school_government_and_politics,Social Sciences,"The Constitution, as originally ratified, addressed all of the following weaknesses of the Articles of Confederation EXCEPT the",lack of a chief executive office,national government's inability to levy taxes effectively,absence of a central authority to regulate interstate trade,omission of a universal suffrage clause,D,[],[],[],[],[],[],-,False
high_school_government_and_politics/test/181,high_school_government_and_politics,Social Sciences,Which of the following accurately describes individual entitlements?,"Congress provides funds to the states, and the states decide how best to spend the money.",Congress is allowed to fund these programs only when the federal government has a budget surplus.,Congress must pay benefits to anyone who qualifies to receive them.,"Congress grants money to states, provided that certain criteria are met.",C,[],[],[],[],[],[],-,False
high_school_government_and_politics/test/182,high_school_government_and_politics,Social Sciences,Which of the following is true of most third parties in U.S. history?,They arose and succeeded during times of prosperity.,They were created to protest wars.,At some point they won a majority of seats in Congress.,They flourished during periods of widespread dissatisfaction.,D,[],[],[],[],[],[],-,False
high_school_government_and_politics/test/185,high_school_government_and_politics,Social Sciences,Which of the following is true of Congress's power of oversight?,Congressional oversight activities most often take place at the committee and subcommittee levels.,State challenges to congressional oversight have severely weakened Congress's oversight powers.,Congressional oversight is primarily directed at the judicial branch.,Constituent input does not influence congressional oversight.,A,[],[],[],[],[],[],-,False
high_school_government_and_politics/test/186,high_school_government_and_politics,Social Sciences,Which of the following is the most accurate statement about writs of certiorari?,Fewer than 5% of petitions for writs of certiorari are granted by the Supreme Court.,"The Supreme Court grants writs of certiorari only when there is a ""circuit split.""",The lower court's ruling is overturned if the Supreme Court denies a writ of certiorari.,Only the solicitor general may petition for a writ of certiorari.,A,[],[],[],[],[],[],-,False
high_school_government_and_politics/test/190,high_school_government_and_politics,Social Sciences,"Which of the following is NOT part of the ""iron triangles"" that influence public policy-making?",House committees,Senate committees,The courts,Bureaucratic agencies,C,[],[],[],[],[],[],-,False
high_school_government_and_politics/test/191,high_school_government_and_politics,Social Sciences,The attorney general is the head of which of the following entities?,The Senate Judiciary Committee,The Department of Justice,The Department of State,The Judge Advocate General's Corps,B,"['regional', 'none', 'cultural', 'regional', 'regional']","['No', 'No', 'No', 'No', 'No']","['-', '-', '-', '-', '-']",['Western Culture'],"['North America', 'North America', 'North America']","['United States of America (USA)', 'United States of America (USA)', 'United States of America (USA)']",CS,True
