sample_id,subject,subject_category,question,option_a,option_b,option_c,option_d,answer,required_knowledge,time_sensitive,reference,culture,region,country,cultural_sensitivity_label,is_annotated
high_school_biology/test/205,high_school_biology,STEM,"Nymphaea odorata, a water lily, is an aquatic plant whose leaves and flowers float on the surface of the water. Which of the following characteristics would be expected for leaves of this plant?",stomata on the top surface and relatively few water-conducting (xylem) cells,stomata on the top surface and relatively many water-conducting (xylem) cells,stomata on the bottom surface and relatively few water-conducting (xylem) cells,stomata on the bottom surface and relatively many water-conducting (xylem) cells,A,[],[],[],[],[],[],-,False
high_school_biology/test/206,high_school_biology,STEM,Which of the following statements is not correct about lipids?,Lipids consist of fatty acids and glycerol.,Steroids are examples of lipids.,The molecules of a saturated fatty acid are packed so close together that they form a solid at room temperature.,"The head of a phospholipid is hydrophobic, and the tails are hydrophilic.",D,[],[],[],[],[],[],-,False
high_school_biology/test/207,high_school_biology,STEM,Heterozygote advantage should be most closely linked to which of the following?,sexual selection,stabilizing selection,random selection,directional selection,B,[],[],[],[],[],[],-,False
high_school_biology/test/208,high_school_biology,STEM,"African lungfish often live in small, stagnant, freshwater pools. With reduced gills, they differ from other fish in that they breathe air. They also differ in that they release the nitrogen waste urea instead of ammonia. Which of the following statements correctly explains how this is an advantage for lungfish?",Urea is insoluble in water and sinks to the bottom of the small pools. Thus the poisonous substance is isolated from the fish.,"Ammonia, which is highly toxic, would endanger lungfish that inhabit the small pools.",Other fish in the small pools can use urea as an energy source.,The highly toxic urea makes the pool uninhabitable to competitors.,B,[],[],[],[],[],[],-,False
high_school_biology/test/209,high_school_biology,STEM,Which of the following statements about the immune system is NOT correct?,"Innate immunity, also known as the adaptive immune response, relies on circulating phagocytes engulfing foreign substances.",Adaptive immunity is a slower response than innate immunity.,Innate immunity activates a humoral response.,Dendritic cells are antigen presenting cells.,A,[],[],[],[],[],[],-,False
high_school_biology/test/210,high_school_biology,STEM,Which of the following is most correct concerning cell differentiation in vertebrates?,"Cells in different tissues contain different sets of genes, leading to structural and functional differences.",Differences in the timing and expression levels of different genes leads to structural and functional differences.,Differences in the reading frame of mRNA leads to structural and functional differences.,Differences between tissues result from spontaneous morphogenesis.,B,[],[],[],[],[],[],-,False
high_school_biology/test/211,high_school_biology,STEM,"All of the following support the endosymbiotic theory that ancestors of mitochondria and chloroplasts were once independent, free-living prokaryotes EXCEPT:",Mitochondria and chloroplasts divide independently of the eukaryotic host cell by a process similar to binary fission.,Mitochondria and chloroplasts have ribosomes that more closely resemble those of bacteria than of eukaryotic cells.,Mitochondria and chloroplasts function independently from the eukaryotic host cell.,"Mitochondria, chloroplasts, and bacteria have a single, circular chromosome without histones or proteins.",C,"['none', 'none', 'none', 'none', 'none', 'none']","['No', 'No', 'No', 'No', 'No', 'No']","['-', '-', '-', '-', '-', '-']",[],[],[],CA,True
high_school_biology/test/213,high_school_biology,STEM,Which of the following best accounts for the ability of legumes to grow well in nitrogen-poor soils?,These plants make their own proteins.,These plants have a mutualistic relationship with nitrogen-fixing bacteria.,These plants are capable of directly converting nitrogen gas into nitrates.,These plants do not require nitrogen to make plant proteins.,B,[],[],[],[],[],[],-,False
high_school_biology/test/214,high_school_biology,STEM,"To ensure that hatchling sea turtles orient to the sea rather than inland, which of the following is the most environmentally sound practice around sea turtle nest sites?",Digging troughs in the sand from the nests to the sea,Minimizing artificial lighting in the area,Scattering preferred turtle foods between the nests and the sea,Building low fences on the sand dunes,B,[],[],[],[],[],[],-,False
high_school_biology/test/216,high_school_biology,STEM,Which of the following disorders will most likely result from X chromosome aneuploidy in women?,Cystic fibrosis,Hemophilia,Turner syndrome,Tay-Sachs disease,C,[],[],[],[],[],[],-,False
high_school_biology/test/221,high_school_biology,STEM,Natural selection is based on all of the following except,genetic variation exists within populations.,the best-adapted individuals tend to leave the most offspring.,individuals who survive longer tend to leave more offspring than those who die young.,"individuals adapt to their environments and, thereby, evolve.",D,[],[],[],[],[],[],-,False
high_school_biology/test/223,high_school_biology,STEM,A certain species of land snail exists as either a cream color or a solid brown color. Intermediate individuals are relatively rare. Which of the following terms best describes this?,artificial selection,directional selection,stabilizing selection,disruptive selection,D,"['none', 'none', 'none', 'none', 'none']","['No', 'No', 'No', 'No', 'No']","['-', '-', '-', '-', '-']",[],[],[],CA,True
high_school_biology/test/225,high_school_biology,STEM,Which of the following pairs of scientists pioneered the ecological discipline known as island biogeography?,Robert MacArthur and E. O. Wilson,James Watson and Francis Crick,Matthias Schleiden and Theodor Schwann,Alfred Hershey and Martha Chase,A,"['regional', 'none', 'none']","['No', 'No', 'No']","['-', '-', '-', '-']",[],[],['United States of America (USA)'],CA,True
high_school_biology/test/226,high_school_biology,STEM,The acrosome and cortical reactions that occur immediately after fertilization ensure which of the following?,The sperm will fertilize the ovum.,The zygote will begin to divide normally.,One and only one sperm will fertilize the egg.,"The zygote will not divide into two embryos, producing twins.",C,[],[],[],[],[],[],-,False
high_school_biology/test/227,high_school_biology,STEM,snRNPs are most closely associated with which of the following?,Cell division,Apoptosis,Replication of DNA,RNA processing,D,[],[],[],[],[],[],-,False
high_school_biology/test/228,high_school_biology,STEM,Transpiration is a result of special properties of water. The special properties of water include all of the following EXCEPT,cohesion,adhesion,capillary action,hydrophobicity,D,[],[],[],[],[],[],-,False
high_school_biology/test/229,high_school_biology,STEM,Which of the following statements best explains why Mendel's principle of segregation was deemed a law?,Mendel's work with pea plants and his conclusions have been described in many sources.,The patterns of trait inheritance observed in pea plants were repeatedly demonstrated in other eukaryotes.,Chromosomes were found to contain the genetic information for traits.,The discovery of the structure of D N A supported Mendel's observations and laws.,B,[],[],[],[],[],[],-,False
high_school_biology/test/234,high_school_biology,STEM,"The reaction A + B → C is catalyzed by enzyme K. If the reaction is in equilibrium, which of the following would allow more product C to be produced?",removing some of reactant A,removing some of reactant C,adding more enzyme K,increasing the temperature of the system,B,[],[],[],[],[],[],-,False
high_school_biology/test/235,high_school_biology,STEM,A new plant was discovered and determined to have an unusually low number of stomata on the undersides of its leaves. For what environment would this plant most likely be best adapted?,Cold and rainy,Humid and sunny,Hot and humid,Hot and dry,D,[],[],[],[],[],[],-,False
high_school_biology/test/236,high_school_biology,STEM,Which of the following adaptive features would least likely be found in an animal living in a hot arid environment?,Long loops of Henle to maximize water reabsorption,Storage of water in fatty tissues,Large ears to aid in heat dispersion,Short loops of Henle to maximize water secretion,D,[],[],[],[],[],[],-,False
high_school_biology/test/238,high_school_biology,STEM,Memory loss would most likely be due to a malfunction of which part of the brain?,Medulla,Cerebellum,Cerebrum,Pons,C,[],[],[],[],[],[],-,False
high_school_biology/test/242,high_school_biology,STEM,"The fluidity of the plasma membrane can vary in response to temperature changes. For bacteria and yeast cells, which of the following would be a viable strategy to maintain homeostasis of the plasma membrane in a temperature-varying environment?",Increase the concentration of solutes in the cytosol.,Change the ratio of phospholipids with double covalent bonds in their tails to those without double covalent bonds in their tails.,Replace phospholipids with glucose molecules.,Exchange phospholipids from one side of the plasma membrane to the other.,B,[],[],[],[],[],[],-,False
high_school_biology/test/243,high_school_biology,STEM,"You are told that in a population of guinea pigs, 4 percent are black (recessive) and 96 percent are brown. Which of the following is the frequency of the heterozygous condition?",16 percent,32 percent,40 percent,48 percent,B,[],[],[],[],[],[],-,False
high_school_biology/test/244,high_school_biology,STEM,"Of the following anatomical structures, which is homologous to the wing of a bird?",Dorsal fin of a shark,Hindlimb of a kangaroo,Wing of a butterfly,Flipper of a cetacean,D,[],[],[],[],[],[],-,False
high_school_biology/test/246,high_school_biology,STEM,"A researcher is experimenting with nerve transmission using neurons from a giant squid. At the beginning of the experiment, the axon is at rest and has a threshold measured at –70 mV at 37oC. The axon receives one stimulus that triggers one action potential in the axon. Subsequent stimuli are much stronger. Which of the following statements explains what happens when several strong stimuli are experienced by the axon?",The axon becomes hyperpolarized to –90 mV.,The axon becomes hyperpolarized to –50 mV.,The strength of the action potential becomes greater.,The frequency of the action potential increases.,D,[],[],[],[],[],[],-,False
high_school_biology/test/247,high_school_biology,STEM,Refer to question 15 for details on the squirrel population. Which of the following conditions is required to keep this population in Hardy-Weinberg equilibrium?,Random mating,Genetic drift,Mutation,Gene flow,A,[],[],[],[],[],[],-,False
high_school_biology/test/248,high_school_biology,STEM,The structure of ATP synthase in the plasma membranes of bacteria is nearly identical to that in the mitochondria and chloroplasts of eukaryotic cells. This similarity best supports which of the following hypotheses?,Eukaryotic and prokaryotic cells share a common ancestor.,"Mitochondria are derived from ancient aerobic bacteria, and chloroplasts are derived from ancient photosynthetic bacteria.","The similarity of ATP synthase in bacteria, mitochondria, and chloroplasts is an example of convergent evolution.",Mitochondria and chloroplasts escaped from eukaryotic cells and formed aerobic and photosynthetic prokaryotes.,B,[],[],[],[],[],[],-,False
high_school_biology/test/249,high_school_biology,STEM,"A researcher grows a population of ferns in her laboratory. She notices, after a few generations, a new variant that has a distinct phenotype. When she tries to breed the original phenotype with the new one, no offspring are produced. When she breeds the new variants, however, offspring that look like the new variant result. Which of the following is likely to exhibit the process described earlier?",Fallow deer,Fruit flies,Grass,Spotted toads,C,[],[],[],[],[],[],-,False
high_school_biology/test/250,high_school_biology,STEM,The average birth weight for human babies is about 3 kg. Which of the following terms best describes this?,artificial selection,directional selection,stabilizing selection,disruptive selection,C,[],[],[],[],[],[],-,False
high_school_biology/test/254,high_school_biology,STEM,"A researcher grows a population of ferns in her laboratory. She notices, after a few generations, a new variant that has a distinct phenotype. When she tries to breed the original phenotype with the new one, no offspring are produced. When she breeds the new variants, however, offspring that look like the new variant result. Which of the following could possibly characterize the new variant?",Adaptive radiation,Divergent selection,Equilibrium,Polyploidy,D,[],[],[],[],[],[],-,False
high_school_biology/test/255,high_school_biology,STEM,"What is the best explanation for the fact that tuna, sharks, and dolphins all have a similar streamlined appearance?",They all share a recent common ancestor.,They all sustained the same set of mutations.,They acquire a streamlined body type to survive in their particular environment.,The streamlined body has a selective advantage in that environment.,D,[],[],[],[],[],[],-,False
high_school_biology/test/259,high_school_biology,STEM,Students are conducting a plant pigment separation exercise that requires them to use a closed chromatography chamber with a small amount of acetone in the bottom of the chamber. Safety warnings for acetone include the statement that it is an eye and skin irritant and has flammable vapors. Of the following‚ which safety precaution should the students take while conducting the exercise?,Putting on fire-retardant gloves to carry the chamber to a fume hood if the acetone catches fire,"Placing the chamber in a closed, darkened cabinet for the duration of the pigment separation",Wearing leather gloves and covering the nose and mouth with a particle mask,Wearing goggles and nitrile-type gloves and keeping all acetone containers closed,D,[],[],[],[],[],[],-,False
high_school_biology/test/262,high_school_biology,STEM,"In cells, which of the following can catalyze reactions involving hydrogen peroxide, provide cellular energy, and make proteins, in that order?","Peroxisomes, mitochondria, and ribosomes","Peroxisomes, mitochondria, and lysosomes","Peroxisomes, mitochondria, and Golgi apparatus","Lysosomes, chloroplasts, and ribosomes",A,[],[],[],[],[],[],-,False
high_school_biology/test/264,high_school_biology,STEM,"Many different fermentation pathways occur in different organisms in nature. For example, skeletal muscle cells convert pyruvate into lactic acid when no oxygen is present. Yeast cells can produce alcohol and carbon dioxide under the same circumstances. However, regardless of the specific reactions, the purpose of glycolysis is an important one. Which statement best describes the importance of glycolysis?",It produces large amounts of ATP by substrate level phosphorylation.,It reoxidizes NADH so that glycolysis can continue.,"It produces pyruvate, which is the raw material for oxidative phosphorylation.",It occurs in the cytoplasm.,B,[],[],[],[],[],[],-,False
high_school_biology/test/265,high_school_biology,STEM,Which of the following is not a form of interspecies interaction?,Commensalism,Succession,Mutualism,Parasitism,B,[],[],[],[],[],[],-,False
high_school_biology/test/266,high_school_biology,STEM,"Apoptosis, which is programmed cell death, is a necessary process in living organisms. Which of the following is NOT correct about apoptosis?",It occurs randomly.,A particular cell dies when it is no longer needed by the organism.,A cell carries out apoptosis when too many mutations have accumulated.,Plant cells carry out apoptosis as a defense measure in cells that have been infected by parasites.,A,[],[],[],[],[],[],-,False
high_school_biology/test/269,high_school_biology,STEM,"In the Tularosa Basin of New Mexico are black lava formations surrounded by light-colored sandy desert. Pocket mice inhabit both areas. Dark-colored ones inhabit the lava formations, while light-colored mice inhabit the desert. Which of the following statements is correct about this scenario?",The two varieties of mice descended from a recent common ancestor.,The mouse population was originally one population that diverged into two species because of mutations.,Selection favors some phenotypes over others.,"Originally the mice were all dark colored. As the lava decomposed into sand, the color of some mice changed because that color was favored in that environment.",C,[],[],[],[],[],[],-,False
high_school_biology/test/270,high_school_biology,STEM,Which of the following best explains why lignin is important to the evolutionary success of land plants?,"Lignin provides structural support, allowing plants to grow tall.","Lignin stimulates spore formation, leading to gametogenesis.","Lignin supplies the developing embryo with essential nutrients, enabling its growth.","Lignin supplements the absorption of light by chlorophyll, increasing photosynthetic output.",A,[],[],[],[],[],[],-,False
high_school_biology/test/271,high_school_biology,STEM,Which of the following describes a symbiotic relationship?,A tapeworm feeds off of its host's nutrients causing the host to lose large amounts of weight.,"Certain plants grow on trees in order to gain access to sunlight, not affecting the tree.","Remora fish eat parasites off of sharks; the sharks stay free of parasites, and the remora fish are protected from predators.",Meerkats sound alarm calls to warn other meerkats of predators.,C,[],[],[],[],[],[],-,False
high_school_biology/test/272,high_school_biology,STEM,The endocrine system maintains homeostasis using many feedback mechanisms. Which of the following is an example of positive feedback?,"Infant suckling causes a mother's brain to release oxytocin, which in turn stimulates milk production.",An enzyme is allosterically inhibited by the product of the reaction it catalyzes.,When ATP is abundant the rate of glycolysis decreases.,"When blood sugar levels decrease to normal after a meal, insulin is no longer secreted.",A,[],[],[],[],[],[],-,False
high_school_biology/test/273,high_school_biology,STEM,Which of the following are characteristics of both bacteria and fungi?,"Cell wall, DNA, and plasma membrane","Nucleus, organelles, and unicellularity","Plasma membrane, multicellularity, and Golgi apparatus","Cell wall, unicellularity, and mitochondria",A,[],[],[],[],[],[],-,False
high_school_biology/test/274,high_school_biology,STEM,Which of the following is NOT a characteristic of bacteria?,Circular double-stranded DNA,Membrane-bound cellular organelles,Plasma membrane consisting of lipids and proteins,Ribosomes that synthesize polypeptides,B,[],[],[],[],[],[],-,False
high_school_biology/test/275,high_school_biology,STEM,Which of the following is the source of oxygen produced during photosynthesis?,H2O,H2O2,CO2,CO,A,[],[],[],[],[],[],-,False
high_school_biology/test/276,high_school_biology,STEM,An eager AP Biology student interested in studying osmosis and the movement of water in solutions took a dialysis bag containing a 0.5 M solution and placed it into a beaker containing a 0.6 M solution. Which of the following is true about water potential?,An eager AP Biology student interested in studying osmosis and the movement of water in solutions took a dialysis bag containing a 0.5 M solution and placed it into a beaker containing a 0.6 M solution. It drives the movement of water from a region of lower water potential to a region of higher water potential.,Solute potential is the only factor that determines the water potential.,Pressure potential combines with solute potential to determine the water potential.,Water potential always drives water from an area of lower pressure potential to an area of higher pressure potential.,C,[],[],[],[],[],[],-,False
high_school_biology/test/277,high_school_biology,STEM,Which of the following is a frameshift mutation?,CAT HAS HIS → CAT HAS HIT,CAT HAS HIS → CAT HSH ISA,CAT HAS HIS → CAT HIS HAT,CAT HAS HIS → CAT WAS HIT,B,[],[],[],[],[],[],-,False
high_school_biology/test/278,high_school_biology,STEM,Crossing-over occurs during which of the following phases in meiosis?,Prophase I,Metaphase I,Anaphase I,Prophase II,A,"['none', 'none', 'none', 'none', 'none', 'none']","['No', 'No', 'No', 'No', 'No', 'No']","['-', '-', '-', '-', '-', '-']",[],[],[],CA,True
high_school_biology/test/280,high_school_biology,STEM,High levels of estrogen from maturing follicles inhibit the release of gonadotropin releasing hormone (GnRH). Which of the following endocrine glands produces GnRH?,Anterior pituitary,Posterior pituitary,Hypothalamus,Pineal gland,C,[],[],[],[],[],[],-,False
high_school_biology/test/281,high_school_biology,STEM,All of the following are examples of hydrolysis EXCEPT,conversion of fats to fatty acids and glycerol,conversion of proteins to amino acids,conversion of starch to simple sugars,conversion of pyruvic acid to acetyl CoA,D,[],[],[],[],[],[],-,False
high_school_biology/test/283,high_school_biology,STEM,"Monkeys of South and Central America have prehensile tails, meaning that their tails can be used to grasp objects. The tails of African and Asian monkeys are not prehensile. Which discipline is most likely to provide an evolutionary explanation for how this difference in tails came about?",Aerodynamics,Biogeography,Physiology,Biochemistry,B,[],[],[],[],[],[],-,False
high_school_biology/test/285,high_school_biology,STEM,Which of the following is an example of a detritivore?,Cactus,Algae,Bat,Fungus,D,[],[],[],[],[],[],-,False
high_school_biology/test/286,high_school_biology,STEM,"If a forest of fir, birch, and white spruce trees was devastated by fire, which of the following would most likely happen?",Only animal life would continue to inhabit the region.,Secondary succession would begin to occur.,Only tough grasses would appear.,The number of species would stabilize as the ecosystem matures.,B,[],[],[],[],[],[],-,False
high_school_biology/test/288,high_school_biology,STEM,"There are 40 individuals in population 1, all of which have genotype A1A1, and there are 25 individuals in population 2, all of genotype A2A2. Assume that these populations are located far from one another and that their environmental conditions are very similar. Based on the information given here, the observed genetic variation is mostly likely an example of",genetic drift.,gene flow.,disruptive selection.,discrete variation.,A,[],[],[],[],[],[],-,False
high_school_biology/test/293,high_school_biology,STEM,"In vertebrate embryos, which of the following developmental processes most directly results in the formation of the three primary germ layers?",Neurulation,Blastula formation,Cleavage,Gastrulation,D,[],[],[],[],[],[],-,False
high_school_biology/test/294,high_school_biology,STEM,DNA sequences in many human genes are very similar to the corresponding sequences in chimpanzees. Which statement gives the most likely explanation of this fact?,Humans evolved from chimpanzees millions of year ago.,Chimpanzees evolved from humans millions of years ago.,Humans and chimpanzees evolved from a recent common ancestor—about 6 million years ago.,Humans and chimpanzees evolved from a distant common ancestor about 4 billion years ago.,C,"['none', 'none', 'none', 'none']","['No', 'No', 'No', 'No']","['-', '-', '-', '-']",[],[],[],CA,True
high_school_biology/test/296,high_school_biology,STEM,Natural selection changes allele frequencies in populations because some ____ survive and reproduce more successfully than others.,alleles,loci,gene pools,individuals,D,[],[],[],[],[],[],-,False
high_school_biology/test/300,high_school_biology,STEM,"A scientist carries out a cross between two guinea pigs, both of which have black coats. Black hair coat is dominant over white hair coat. Three quarters of the offspring have black coats, and one quarter have white coats. The genotypes of the parents were most likely",bb × bb,Bb × Bb,Bb × bb,BB × Bb,B,"['none', 'none', 'none', 'none']","['No', 'No', 'No', 'No']","['-', '-', '-', '-']",[],[],[],CA,True
high_school_biology/test/303,high_school_biology,STEM,Crop rotation is the successive planting of different crops on the same land in sequential seasons. Which of the following statements summarizes the most likely benefits of this practice?,It allows the farmer to plant the crops with the greatest demand in the marketplace.,It increases crop yields and soil fertility and minimizes pathogen infection and pest infestation.,It allows the hybridization of successive crops and the development of newer varieties of crop plants.,It decreases the need for diverse harvesting equipment and minimizes production costs.,B,[],[],[],[],[],[],-,False
high_school_biology/test/304,high_school_biology,STEM,The base composition of DNA varies from one species to another. Which of the following ratios would you expect to remain constant in the DNA?,Cytosine : Adenine,Pyrimidine : Purine,Adenine : Guanine,Guanine : Deoxyribose,B,[],[],[],[],[],[],-,False
high_school_biology/test/309,high_school_biology,STEM,A piece of potato is dropped into a beaker of pure water. Which of the following describes the activity after the potato is immersed into the water?,Water moves from the potato into the surrounding water.,Water moves from the surrounding water into the potato.,Potato cells plasmolyze.,Solutes in the water move into the potato.,B,[],[],[],[],[],[],-,False
