sample_id,subject,subject_category,question,option_a,option_b,option_c,option_d,answer,required_knowledge,time_sensitive,reference,culture,region,country,cultural_sensitivity_label,is_annotated
high_school_biology/test/105,high_school_biology,STEM,"Except for identical twins, no two people are genetically identical. Which of the following statements most accurately describes the main source of variation in humans?",The main source of variation in humans is genetic drift.,Changes in the environment cause rapid changes in different human populations.,Shuffling of alleles is responsible for the greatest variation in humans.,Mutations are responsible for the greatest changes in different human populations.,C,"['none', 'none', 'none', 'none', 'none', 'none', 'none', 'none', 'none']","['No', 'No', 'No', 'No', 'No', 'No', 'No', 'No', 'No']","['-', '-', '-', '-', '-', '-', '-', '-', '-']",[],[],[],CA,True
high_school_biology/test/111,high_school_biology,STEM,Which of the following statement is supported by the information given in the pedigree?,The P generation mother is X-X.,The P generation father is X-Y.,"If parents 1 and 2 in row II have another child, the chance that the child would be afflicted with alkaptonuria is 25%.",The genotype of woman 1 is X-X.,C,"['none', 'none', 'none', 'none']","['No', 'No', 'No', 'No']","['-', '-', '-', '-']",[],[],[],CA,True
high_school_biology/test/113,high_school_biology,STEM,Which of the following pieces of evidence most strongly supports the common origin of all life on Earth?,All organisms require energy.,All organisms use essentially the same genetic code.,All organisms reproduce.,All organisms show heritable variation.,B,[],[],[],[],[],[],-,False
high_school_biology/test/114,high_school_biology,STEM,Organisms in which of the following phyla have a true coelom?,Platyhelminthes,Porifera,Annelida,Nematoda,B,[],[],[],[],[],[],-,False
high_school_biology/test/116,high_school_biology,STEM,Which of the following properties is responsible for holding together the water molecules in a vertical column of water in xylem vessels of a plant?,the strong adhesion property of water,the strong cohesion of property of water,the high heat capacity of water,the strong cohesion property of cellulose in the xylem cell wall,B,[],[],[],[],[],[],-,False
high_school_biology/test/117,high_school_biology,STEM,Which of the following statements is NOT correct about apoptosis?,"Apoptosis, a special type of cell division, requires multiple cell signaling.",The fact that apoptosis is widespread across several kingdoms is evidence that it evolved early in the evolution of eukaryotes.,Apoptosis plays a crucial role in the development of fingers in embryonic development.,Apoptosis prevents an aging and dying cell from damaging neighboring cells.,A,[],[],[],[],[],[],-,False
high_school_biology/test/118,high_school_biology,STEM,All of the following organs in the digestive system secrete digestive enzymes EXCEPT the,mouth,stomach,gall bladder,small intestine,C,[],[],[],[],[],[],-,False
high_school_biology/test/119,high_school_biology,STEM,All of the following are stimulated by the sympathetic nervous system EXCEPT,dilation of the pupil of the eye,constriction of blood vessels,increased secretion of the sweat glands,increased peristalsis in the gastrointestinal tract,D,"['none', 'none', 'none', 'none']","['No', 'No', 'No', 'No']","['-', '-', '-', '-']",[],[],[],CA,True
high_school_biology/test/122,high_school_biology,STEM,Which of the following is an example of a cline?,The hybrid tomato plant is stronger and produces better fruit than the pure genotype.,There are two distinct varieties in one population of snail that inhabits an island in the Pacific Ocean.,Males of some species have long antlers to fight other males for females.,"In one species of rabbit, the ones that evolved in the cold, snowy north are white, while the ones that evolved in the south are brown.",D,[],[],[],[],[],[],-,False
high_school_biology/test/125,high_school_biology,STEM,Which of the following is the direct energy source that allows ATP synthase to produce ATP in mitochondria?,NADH diffusing from the mitochondrial intermembrane space to the matrix,The reduction of NAD+ during the conversion of pyruvate to acetyl-CoA,H+ ions flowing down a gradient across the mitochondrial inner membrane,The energy of electrons passing along the electron transport chain,C,[],[],[],[],[],[],-,False
high_school_biology/test/126,high_school_biology,STEM,Which of the following cells is most closely associated with phagocytosis?,Neutrophils,Plasma cells,B cells,Memory cells,A,[],[],[],[],[],[],-,False
high_school_biology/test/128,high_school_biology,STEM,Which of the following is correct about organisms that are the first to colonize a habitat undergoing ecological succession?,They are the fiercest competitors in the area.,They maintain the habitat as it is for their own kind.,They change the habitat in a way that makes it more habitable for other organisms.,They are small invertebrates.,C,"['none', 'none', 'none', 'none']","['No', 'No', 'No', 'No']","['-', '-', '-', '-']",[],[],[],CA,True
high_school_biology/test/129,high_school_biology,STEM,"Unlike large populations, small populations are vulnerable to various processes that draw populations down an extinction vortex toward smaller and smaller populations until no individuals survive. Which of the following statements correctly identifies the factors that endanger a population?",Inbreeding and loss of genetic variation threaten a population.,Migration of new individuals into the population threatens a population.,Mutation reduces the health of a population.,Breeding with individuals from a different population may cause the extinction of the first population due to a decrease in diversity.,A,[],[],[],[],[],[],-,False
high_school_biology/test/130,high_school_biology,STEM,Fossil evidence indicates that horses have gradually increased in size over geologic time. Which of the following terms best describes this?,artificial selection,directional selection,stabilizing selection,disruptive selection,B,[],[],[],[],[],[],-,False
high_school_biology/test/133,high_school_biology,STEM,Which of the following about meiosis is NOT true?,Meiosis produces two haploid gametes.,Homologous chromosomes join during synapsis.,Sister chromatids separate during meiosis I.,Crossing-over increases genetic variation in gametes.,C,[],[],[],[],[],[],-,False
high_school_biology/test/134,high_school_biology,STEM,Oligomycin is an antibiotic that blocks proton channels in the cristae of mitochondria by binding to ATP synthase. Which of the following would be the first expected response after the application of oligomycin to cells?,Water production would increase.,H+ would increase inside the intermembrane space (the compartment between inner and outer membranes).,H+ would increase in the matrix (inside mitochondrial inner membrane).,H+ would increase outside mitochondria.,B,[],[],[],[],[],[],-,False
high_school_biology/test/136,high_school_biology,STEM,Which of the following characteristics would allow you to distinguish a prokaryotic cell from an animal cell?,Ribosomes,Cell membrane,Chloroplasts,Cell wall,D,[],[],[],[],[],[],-,False
high_school_biology/test/140,high_school_biology,STEM,Which of the following must exist in a population before natural selection can act upon that population?,Genetic variation among individuals,Variation among individuals caused by environmental factors,Sexual reproduction,B and C only,A,[],[],[],[],[],[],-,False
high_school_biology/test/141,high_school_biology,STEM,You observe a species that gives birth to only one offspring at a time and has a relatively long life-span for its body size. Which of the following is probably also true of this organism?,It lives in a newly colonized habitat.,It is an aquatic organism.,It requires relatively high parental care of offspring.,The age at which the offspring themselves can give birth is relatively young.,C,[],[],[],[],[],[],-,False
high_school_biology/test/142,high_school_biology,STEM,A piece of potato is dropped into a beaker of pure water. Which of the following describes the initial condition when the potato enters the water?,The water potential of the pure water is negative.,The water potential of the pure water is positive.,The water potential of the potato is positive.,The water potential of the potato is negative.,D,"['none', 'none', 'none', 'none', 'none', 'none']","['No', 'No', 'No', 'No', 'No', 'No']","['-', '-', '-', '-', '-', '-']",[],[],[],CA,True
high_school_biology/test/144,high_school_biology,STEM,"During a study session about evolution, one of your fellow students remarks, ""The giraffe stretched its neck while reaching for higher leaves; its offspring inherited longer necks as a result."" Which statement is most likely to be helpful in correcting this student's misconception?",Characteristics acquired during an organism's life are generally not passed on through genes.,Spontaneous mutations can result in the appearance of new traits.,Only favorable adaptations have survival value.,Disuse of an organ may lead to its eventual disappearance.,A,[],[],[],[],[],[],-,False
high_school_biology/test/145,high_school_biology,STEM,Incomplete dominance and epistasis are two terms that define genetic relationships. Which of the following statements best describes the differences or similarities between the two terms?,Both terms describe inheritance controlled by the interaction of multiple alleles at different loci.,Both terms describe inheritance controlled by the interaction of multiple genes at different loci.,Incomplete dominance describes the interaction of two genes at different loci; epistasis describes the interaction of two alleles.,Incomplete dominance describes the interaction of two alleles on one gene; epistasis describes the interaction of two genes and their respective alleles.,D,[],[],[],[],[],[],-,False
high_school_biology/test/146,high_school_biology,STEM,Which of the following statements about the DNA in one of your liver cells is correct?,Your liver cells contain the same DNA as your white blood cells.,Most of the DNA in your liver cells will be transcribed but not translated.,Most of the DNA in your liver cells will be transcribed in the nucleus and translated in the cytoplasm.,"DNA in your liver cells contains genes unique to storing glycogen, while other cells do not contain those genes.",A,[],[],[],[],[],[],-,False
high_school_biology/test/147,high_school_biology,STEM,Energy is harvested during cellular respiration in stages. Which of the following correctly states which phase of cellular respiration harvests the most energy and the correct explanation why?,The most energy is released during the Krebs cycle because it is here that pyruvate is completely broken down into CO2.,"The most energy is released during the Krebs cycle because in addition to the production of ATP, both FADH2 and NADH are produced. Each of those molecules will release 2 ATPs and 3 ATPs, respectively.","The most energy is released during oxidative phosphorylation because in addition to the phosphorylation of ADP into ATP, all the potential energy held in NADH and FADH is transferred to ATP.",The most energy is released during oxidative phosphorylation because H2O is completely broken down into H+ and O2.,C,[],[],[],[],[],[],-,False
high_school_biology/test/148,high_school_biology,STEM,Which of the following best explains why drinking breast milk is beneficial to a human infant?,Breast milk contains vitamins that repair mutations originating in the sperm or egg.,Breast milk contains maternal antibodies that protect against gastrointestinal pathogens.,Breast milk contains maternal vaccines that destroy common childhood pathogens.,Breast milk contains red blood cells with adult hemoglobin that are beneficial to the infant's developing brain.,B,[],[],[],[],[],[],-,False
high_school_biology/test/149,high_school_biology,STEM,"During oxidative phosphorylation, the energy needed to drive ATP synthesis comes from one source. Which of the following statements states the immediate source of that energy?",Electrons flow down an electron transport chain as they are attracted to oxygen.,The transfer of a phosphate group to ADP is exergonic.,The bonding of electrons to oxygen at the end of the chain releases energy.,The proton gradient across the membrane where the ATP synthase is embedded represents potential energy.,D,"['none', 'none', 'none', 'none', 'none']","['No', 'No', 'No', 'No', 'No']","['-', '-', '-', '-', '-']",[],[],[],CA,True
high_school_biology/test/150,high_school_biology,STEM,"Easily produced genetic variation is key to the rapid evolution of viral and microbial populations. Furthermore, pathogens that need to escape the immune system rely on this variation to generate new surface antigens that go unrecognized by the host’s immune system. Which of the following is an example of this antigenic variation?","HIV, which can remain integrated into the host genome for many years","The flu virus, which changes its envelope proteins","MRSA, which has become resistant to many antibiotics","Multiple sclerosis, which attacks the cells of the nervous system",B,[],[],[],[],[],[],-,False
high_school_biology/test/152,high_school_biology,STEM,Which of the following is an incorrect statement about gel electrophoresis?,DNA migrates from positive charge to negative charge.,Smaller DNA travels faster.,The DNA migrates only when the current is running.,"The longer the current is running, the farther the DNA will travel.",A,[],[],[],[],[],[],-,False
high_school_biology/test/153,high_school_biology,STEM,Which of the following observations helped Darwin shape his concept of descent with modification?,Species diversity declines farther from the equator.,Fewer species live on islands than on the nearest continents.,Birds can be found on islands located farther from the mainland than the birds' maximum nonstop flight distance.,South American temperate plants are more similar to the tropical plants of South America than to the temperate plants of Europe.,D,[],[],[],[],[],[],-,False
high_school_biology/test/154,high_school_biology,STEM,Which of the following statements about post-transcriptional modification are incorrect?,A poly-A tail is added to the 3′ end of the mRNA.,A guanine cap is added to the 5′ end of the mRNA.,Introns are removed from the mRNA.,Posttranscriptional modification occurs in the cytoplasm.,D,[],[],[],[],[],[],-,False
high_school_biology/test/156,high_school_biology,STEM,"The first simple cells evolved approximately 3.5 billion years ago, followed by the more complex eukaryotic cells 2.1 billion years ago. Which of the following statements is correct?","Eukaryotic organelles helped create separate environments for metabolic reactions, thus increasing their metabolic efficiency.",Prokaryotic and eukaryotic cells have no structural similarities.,The organelles in larger eukaryotic cells took care of the problems of having a larger surface area–to–volume ratio.,Eukaryotic cells are able to multiply faster based on their more complex structure.,A,[],[],[],[],[],[],-,False
high_school_biology/test/161,high_school_biology,STEM,Stretching out from the equator is a wide belt of tropical rain forests that are being cut down to provide exotic woods for export to the U.S. and to make land available to graze beef cattle. Which of the following statements is a negative consequence of clear-cutting the tropical rain forests?,Indigenous populations will have access to modern conveniences.,There will be less precipitation in those clear-cut areas.,U.S. markets will have access to less expensive beef.,Deforestation will allow more sunlight to penetrate areas that were kept dark by dense vegetation.,B,[],[],[],[],[],[],-,False
high_school_biology/test/163,high_school_biology,STEM,Which of the following statements explains how a point mutation can have no negative impact in the protein formed from a sequence in DNA?,"The first codon of a gene is always AUG, a leader sequence; a mutation in that sequence will have no effect on the protein produced.",Several codons code for the same amino acid.,DNA polymerase and DNA ligase carry out excision repair before transcription.,RNA processing will repair point mutations before mRNA leaves the nucleus.,B,[],[],[],[],[],[],-,False
high_school_biology/test/164,high_school_biology,STEM,Which of the following statements correctly characterizes an autoimmune disease?,T cells attack healthy body cells.,An aneurysm is a weakness in the wall of a blood vessel that causes it to balloon out. The vessel can rupture and cause a hemorrhage.,"Several factors cause hypertension: smoking, being overweight, lack of physical activity, and too much salt in the diet.","Alzheimer's disease is caused by the buildup of plaque within the brain, causing brain cells to die.",A,[],[],[],[],[],[],-,False
high_school_biology/test/165,high_school_biology,STEM,All of the following play an important role in regulating respiration in humans EXCEPT,an increase in the amount of CO2 in the blood,a decrease in the amount of O2 in the blood,a decrease in the plasma pH level,strenuous exercise,B,[],[],[],[],[],[],-,False
high_school_biology/test/170,high_school_biology,STEM,Which of the following statements about meiosis is correct?,The daughter cells are genetically identical to the parent cells.,Homologues pair during prophase II.,DNA replication occurs before meiosis I and meiosis II.,The number of chromosomes is reduced.,D,[],[],[],[],[],[],-,False
high_school_biology/test/171,high_school_biology,STEM,"Stomata allow gases, such as H2O and CO2, to exchange between the inside of a plant leaf and the surrounding environment. Which of the following occurs under normal daytime environmental conditions?",H2O diffuses out of the leaf faster than CO2 enters.,H2O diffuses out of the leaf slower than CO2 enters.,CO2 diffuses out of the leaf faster than H2O enters.,H2O exchanges with CO2 at equal rates.,A,[],[],[],[],[],[],-,False
high_school_biology/test/174,high_school_biology,STEM,The pH of two lakes is measured. Lake A has a pH of 8.0; Lake B has a pH of 6.0. Which of the following statements is correct about these lakes?,Lake B is alkaline.,Lake B is 100 times more alkaline than Lake A.,The hydrogen ion concentration of Lake B is 104 M.,The pH of both lakes will decrease in response to acid rain.,D,[],[],[],[],[],[],-,False
high_school_biology/test/176,high_school_biology,STEM,Which of the following is known to be involved in the photoperiodic flowering response of angiosperms?,Auxin,Cytochrome,Phytochrome,Gibberellins,C,[],[],[],[],[],[],-,False
high_school_biology/test/178,high_school_biology,STEM,Which of the following is not an observation or inference on which natural selection is based?,There is heritable variation among individuals.,Poorly adapted individuals never produce offspring.,Species produce more offspring than the environment can support.,Individuals whose characteristics are best suited to the environment generally leave more offspring than those whose characteristics are less suited.,B,"['none', 'none', 'none', 'none', 'none']","['No', 'No', 'No', 'No', 'No']","['-', '-', '-', '-', '-']",[],[],[],CA,True
high_school_biology/test/179,high_school_biology,STEM,Microtubules are protein filaments assembled from tubulin protein subunits. The chemical colchicine prevents the assembly of microtubules by binding to tubulin protein subunits. Which of the following cellular processes would be most impaired by the application of colchicine?,the alignment and separation of chromosomes during mitosis,the coordination of ribosomes and mRNA during protein synthesis,the movement of substances across the plasma membrane,the accumulation of protons inside the thylakoids of chloroplasts during chemiosmosis,A,[],[],[],[],[],[],-,False
high_school_biology/test/181,high_school_biology,STEM,Which of the following statements is an inference of natural selection?,Subsequent generations of a population should have greater proportions of individuals that possess traits better suited for success.,An individual organism undergoes evolution over the course of its lifetime.,Habitats do not generally have unlimited resources.,Natural populations tend to reproduce to their full biological potential.,A,[],[],[],[],[],[],-,False
high_school_biology/test/182,high_school_biology,STEM,"Recently, seasonal dead zones in low-oxygen waters have been occurring annually in the Gulf of Mexico near the mouth of the Mississippi River. The dead zones result from the rapid growth of photosynthetic phytoplankton (algal blooms) and their subsequent decay by oxygen-depleting microbes in the water column. Which of the following factors most likely triggers the algal blooms and the associated dead zones?",A decrease in the light level in surface waters as day length starts to shorten after the summer solstice,Increased predation by marine larvae and other zooplankton during the summer months,A summer influx of nutrients derived from chemical fertilizers that are high in nitrogen and phosphorus,Decreased competition from other marine phytoplankton during the summer months,C,[],[],[],[],[],[],-,False
high_school_biology/test/183,high_school_biology,STEM,Which of the following best summarizes the process of allopatric speciation?,differential changes in allele frequencies → reproductive isolation → reproductive barriers → new species,catastrophic event → reproductive isolation → reproductive barriers → new species,reproductive isolation → differential changes in allele frequencies → reproductive barriers → new species,geographic isolation → reproductive isolation → differential changes in allele frequencies → reproductive barriers → new species,D,[],[],[],[],[],[],-,False
high_school_biology/test/185,high_school_biology,STEM,Which of the following is the correct characteristic of arteries?,They are thin-walled blood vessels.,They contain valves that prevent backflow.,They always carry oxygenated blood.,They carry blood away from the heart.,D,"['none', 'none', 'none', 'none']","['No', 'No', 'No', 'No']","['-', '-', '-', '-']",[],[],[],CA,True
high_school_biology/test/186,high_school_biology,STEM,Which of the following statements about trypsin is NOT true?,It is an organic compound made of proteins.,It is a catalyst that alters the rate of a reaction.,It is operative over a wide pH range.,The rate of catalysis is affected by the concentration of substrate.,C,"['none', 'none', 'none', 'none']","['No', 'No', 'No', 'No']","['-', '-', '-', '-']",[],[],[],CA,True
high_school_biology/test/188,high_school_biology,STEM,Which of the following are traits that are affected by more than one gene?,Heterozygous traits,Pleiotropic traits,Polygenic traits,Blended alleles,C,[],[],[],[],[],[],-,False
high_school_biology/test/189,high_school_biology,STEM,A student conducts an experiment to test the efficiency of a certain enzyme. Which of the following protocols would probably not result in a change in the enzyme’s efficiency?,Bringing the temperature of the experimental setup from 20°C to 50°C,Adding an acidic solution to the setup,Adding substrate but not enzyme,Placing the substrate and enzyme in a container with double the capacity,D,[],[],[],[],[],[],-,False
high_school_biology/test/191,high_school_biology,STEM,"The geneticist Mary Lyon hypothesized the existence of structures visible just under the nuclear membrane in mammals, which were later named Barr bodies. Which of the following statement is NOT correct about Barr bodies?","In the early female embryo, one copy of the X chromosome becomes inactivated in every body cell.",The same chromosome in every cell of a normal female is inactivated.,A male with the XXY genotype will have one Barr body.,Barr bodies consist of highly methylated DNA.,B,[],[],[],[],[],[],-,False
high_school_biology/test/194,high_school_biology,STEM,All of the following are examples of events that can prevent interspecific breeding EXCEPT,the potential mates experience geographic isolation,the potential mates experience behavioral isolation,the potential mates have different courtship rituals,the potential mates have similar breeding seasons,D,[],[],[],[],[],[],-,False
high_school_biology/test/198,high_school_biology,STEM,Members of which of the following groups are most likely to be surrounded by a protein coat?,Viruses,Bacteria,Eukaryotes,Archaea,A,"['none', 'none', 'none', 'none']","['No', 'No', 'No', 'No']","['-', '-', '-', '-']",[],[],[],CA,True
high_school_biology/test/203,high_school_biology,STEM,Which of the following statements correctly describes what happens to the preRNA during RNA processing?,Introns are removed in the nucleus. A 5′ cap and the poly-A tail are added after the preRNA leaves the nucleus.,Introns are removed and both a 5′ cap and a poly-A tail are added before the preRNA leaves the nucleus.,"Exons are removed and a 5′ cap is added before the preRNA leaves the nucleus. After leaving the nucleus, the poly-A tail is added.","Point mutations are repaired, exons are removed, and both a 5′ cap and a poly-A tail are added before the preRNA leaves the nucleus.",B,[],[],[],[],[],[],-,False
high_school_biology/test/204,high_school_biology,STEM,A small population of birds is blown to an isolated island by a hurricane and establishes a colony. The gene pool of the newly established population of birds is likely to reflect the effects of which of the following?,Directed mutation,Genetic drift,Adaptive radiation,Disruptive selection,B,[],[],[],[],[],[],-,False
