sample_id,subject,subject_category,question,option_a,option_b,option_c,option_d,answer,required_knowledge,time_sensitive,reference,culture,region,country,cultural_sensitivity_label,is_annotated
high_school_geography/test/146,high_school_geography,Social Sciences,Opponents of genetically modified organisms (GMOs) in food are afraid that the GMOs,will hinder global trade.,make plants more resistant to disease.,may cause irreversible changes in humans.,make plants more resistant to drought.,C,"['none', 'none', 'none', 'none', 'none', 'none']","['No', 'No', 'No', 'No', 'No', 'No']","['-', '-', '-', '-', '-', '-']",[],[],[],CA,True
high_school_geography/test/149,high_school_geography,Social Sciences,The world systems theory divides the world into,"core, periphery, and semi-periphery.",rich and poor.,developed and undeveloped.,haves and have-nots.,A,"['none', 'none', 'regional', 'none']","['No', 'No', 'No', 'No']","['-', '-', '-', '-']",['Western Culture'],[],['United States of America (USA)'],CA,True
high_school_geography/test/150,high_school_geography,Social Sciences,The majority of Kurds are found in which country?,Iran,Iraq,Turkey,Egypt,C,"['none', 'regional', 'regional', 'regional']","['Yes', 'No', 'No', 'No']","['-', '-', {'end': 49, 'label': 'Geographic', 'score': None, 'start': 4}, {'end': 48, 'label': 'Geographic', 'score': None, 'start': 0}]",[],"['Europe', 'Europe']","['Türkiye (Turkey)', 'Türkiye (Turkey)']",CS,True
high_school_geography/test/151,high_school_geography,Social Sciences,In what country are the most Basque speakers found?,Denmark,Finland,Luxembourg,Spain,D,"['dialect', 'cultural', 'regional', 'dialect', 'regional']","['Yes', 'No', 'No', 'Yes', 'No']","[{'end': 44, 'label': 'Dialect', 'score': None, 'start': 29}, {'end': 35, 'label': 'Cultural', 'score': None, 'start': 29}, {'end': 15, 'label': 'Geographic', 'score': None, 'start': 0}, {'end': 44, 'label': 'Dialect', 'score': None, 'start': 29}, {'end': 15, 'label': 'Geographic', 'score': None, 'start': 0}]","['Other', 'Western Culture', 'Western Culture', 'Western Culture']","['Europe', 'Europe', 'Europe', 'Europe']","['Spain', 'Spain', 'Spain']",CS,True
high_school_geography/test/152,high_school_geography,Social Sciences,The most rapidly urbanizing area of the world is:,Europe,East Asia,Sub-Saharan Africa,South Asia,C,"['regional', 'none', 'regional', 'none']","['Yes', 'No', 'No', 'No']","['-', '-', '-', '-']",[],"['Africa', 'Africa']",[],CS,True
high_school_geography/test/153,high_school_geography,Social Sciences,The influence of neo-Malthusianism can be seen in,government programs for birth control and planning.,famine relief.,increased spending in social welfare programs.,increased total fertility rates.,A,[],[],[],[],[],[],-,False
high_school_geography/test/154,high_school_geography,Social Sciences,The process of devolution involves,the change of government from a democracy to a communist dictatorship.,the movement of power from the central government to regional governments in the country.,the movement of power from a monarchy to a military dictatorship.,the movement of power from regional governments to central governments.,B,[],[],[],[],[],[],-,False
high_school_geography/test/155,high_school_geography,Social Sciences,The theory that cities grow outward from a core utilizing several nodes of growth was proposed by,Rostow.,Ravenstein.,von Thünen.,Harris and Ullmann.,D,[],[],[],[],[],[],-,False
high_school_geography/test/156,high_school_geography,Social Sciences,The theory that the main purpose of a settlement or market town is to furnish goods and services to the surrounding market area is called the,urban hierarchy theory.,central place theory.,concentric zone model.,multiplier effect.,B,[],[],[],[],[],[],-,False
high_school_geography/test/158,high_school_geography,Social Sciences,"The ""melting pot"" theory of combining several immigrant groups into one mainstream culture is called",amalgamation theory.,acculturation.,ethnic islands.,ethnic clustering.,A,"['dialect', 'none', 'none', 'none', 'none']","['No', 'No', 'No', 'No', 'No']","['-', '-', '-', '-', '-']",[],[],[],CA,True
high_school_geography/test/159,high_school_geography,Social Sciences,Which theory below was used as justification for US involvement in Vietnam in the 1960s and 1970s?,Devolution,Colonialism,Heartland theory,Containment theory,D,[],[],[],[],[],[],-,False
high_school_geography/test/164,high_school_geography,Social Sciences,An isobar map shows lines connecting all points of equal,atmospheric pressure,surface temperature,elevation,precipitation,A,[],[],[],[],[],[],-,False
high_school_geography/test/165,high_school_geography,Social Sciences,Ralph purchases garden fertilizer at the nearby garden shop rather than drive 50 miles to the neighboring town for the same product. This reflects which type of spatial interaction?,Transferability,Complementarity,Intervening opportunity,Territoriality,C,[],[],[],[],[],[],-,False
high_school_geography/test/166,high_school_geography,Social Sciences,What type of countries generally possesses a greater variety of climates and resources than other countries?,Perforated states,Fragmented states,Elongated states,Prorupt states,C,[],[],[],[],[],[],-,False
high_school_geography/test/168,high_school_geography,Social Sciences,"The idea that you identify with, and give allegiance, to a nation-state is",regionalism.,diffusion.,iconography.,nationalism.,D,[],[],[],[],[],[],-,False
high_school_geography/test/169,high_school_geography,Social Sciences,What condition occurs when the people of one state want to annex a territory whose population is ethnically related to that state's population but now under the rule of another state?,Nationalism,Resource dispute,Irredentism,Positional dispute,C,[],[],[],[],[],[],-,False
high_school_geography/test/170,high_school_geography,Social Sciences,"Variations in vocabulary, pronunciation, and rhythm in a spoken language are called",syntax.,isoglosses.,lingua francas.,dialects.,D,[],[],[],[],[],[],-,False
high_school_geography/test/171,high_school_geography,Social Sciences,Boundary problems along the United States–Mexico border are caused by which type of issue below?,Ownership of fertile ground,Land use,Irredentism,Immigration,D,"['regional', 'regional', 'none', 'regional', 'regional']","['Yes', 'No', 'No', 'No', 'No']","['-', '-', '-', {'end': 55, 'label': 'Geographic', 'score': None, 'start': 28}, {'end': 55, 'label': 'Geographic', 'score': None, 'start': 28}]",['Western Culture'],"['North America', 'North America', 'North America']","['United States of America (USA)', 'United States of America (USA)', 'United States of America (USA)', 'United States of America (USA)']",CS,True
high_school_geography/test/172,high_school_geography,Social Sciences,In which country does language pose a centrifugal force?,Canada,United States,Brazil,Norway,A,[],[],[],[],[],[],-,False
high_school_geography/test/177,high_school_geography,Social Sciences,A chief factor that contributed to the Second Agricultural Revolution was,the Industrial Revolution.,World War I.,World War II.,the discovery of the plow.,A,[],[],[],[],[],[],-,False
high_school_geography/test/178,high_school_geography,Social Sciences,Zero population growth (ZPG) is achieved when,CBR – CDR 5 2.,Births 1 immigration 5 deaths 1 emigration.,Total fertility 5 3.,Replacement fertility is achieved.,B,[],[],[],[],[],[],-,False
high_school_geography/test/182,high_school_geography,Social Sciences,A map that presents a single class of statistics is called a,general purpose map.,thematic map.,reference map.,mental map.,B,[],[],[],[],[],[],-,False
high_school_geography/test/184,high_school_geography,Social Sciences,Which continent has the highest total fertility rates?,Africa,Asia,South America,Europe,A,[],[],[],[],[],[],-,False
high_school_geography/test/185,high_school_geography,Social Sciences,What monotheistic religion is based on the life and teachings of Jesus Christ of Nazareth?,Islam,Christianity,Hinduism,Buddhism,B,[],[],[],[],[],[],-,False
high_school_geography/test/191,high_school_geography,Social Sciences,The global lingua franca is,Chinese.,English.,French.,Arabic.,B,[],[],[],[],[],[],-,False
high_school_geography/test/192,high_school_geography,Social Sciences,What are the two major branches of Islam?,Sunni and Shinto,Shinto and Shiite,Sunni and Shiite,Shamanism and Shiite,C,[],[],[],[],[],[],-,False
high_school_geography/test/193,high_school_geography,Social Sciences,What was the primary reason the Green Revolution did NOT help Africa much?,It targeted crops Africans don't grow and eat.,It required sophisticated machinery.,Population growth has fallen so drastically that Africans don't need the increased food production.,African agricultural production went up without its help.,A,[],[],[],[],[],[],-,False
high_school_geography/test/194,high_school_geography,Social Sciences,The largest exporter of agricultural goods in the world is,China.,Mexico.,Chile.,the United States.,D,[],[],[],[],[],[],-,False
high_school_geography/test/196,high_school_geography,Social Sciences,Which pair of religions below share a long-held tradition of cremating their dead?,Hindu and Buddhist,Hindu and Muslim,Muslim and Jewish,Christian and Buddhist,A,[],[],[],[],[],[],-,False
high_school_geography/test/197,high_school_geography,Social Sciences,"The official languages of Guyana, Suriname, and French Guiana are English, Dutch, and French, respectively. On what continent are those countries located?",North America,South America,Africa,Asia,B,[],[],[],[],[],[],-,False
