sample_id,subject,subject_category,question,option_a,option_b,option_c,option_d,answer,required_knowledge,time_sensitive,reference,culture,region,country,cultural_sensitivity_label,is_annotated
high_school_government_and_politics/test/0,high_school_government_and_politics,Social Sciences,Which of the following best describes the balance the Supreme Court has struck between the establishment clause and the free-exercise clause?,"Freedom of speech is protected except in certain situations, such as yelling ""fire"" in a crowded theater.","Once a church has been recognized by the federal government, its tax-exempt status can never be revoked.","Once Congress has created an administrative agency, that agency can be dissolved only by a constitutional amendment.","State-sponsored prayer during school hours is prohibited, but voluntary prayer by student groups before school is allowed.",D,[],[],[],[],[],[],-,False
high_school_government_and_politics/test/1,high_school_government_and_politics,Social Sciences,Which of the following statements does NOT accurately describe voting behavior in the United States?,Registered voters between the ages of 35 and 45 are more likely to vote than are those under the age of 21.,A registered voter who has attained his or her General Educational Development (GED) is less likely to vote than a high school dropout.,Registered voters are more likely to vote in general elections than they are in primary elections.,More women than men have voted in every presidential election since 1980.,B,"['regional', 'regional', 'regional', 'regional', 'regional', 'cultural']","['Yes', 'Yes', 'Yes', 'Yes', 'No', 'Yes']","[{'end': 99, 'label': 'Geographic', 'score': None, 'start': 63}, {'end': 99, 'label': 'Geographic', 'score': None, 'start': 86}, {'end': 99, 'label': 'Geographic', 'score': None, 'start': 63}, {'end': 78, 'label': 'Cultural', 'score': None, 'start': 63}, {'end': 99, 'label': 'Geographic', 'score': None, 'start': 86}, {'end': 99, 'label': 'Cultural', 'score': None, 'start': 63}]","['Western Culture', 'Western Culture', 'Western Culture', 'Western Culture']","['North America', 'North America', 'North America', 'North America', 'North America']","['United States of America (USA)', 'United States of America (USA)', 'United States of America (USA)', 'United States of America (USA)', 'United States of America (USA)', 'United States of America (USA)']",CS,True
high_school_government_and_politics/test/2,high_school_government_and_politics,Social Sciences,Which of the following plays the most significant role in forming a child's political views?,The geographical area in which the child grows up,The child's family,The media to which the child is exposed,The child's religion,B,[],[],[],[],[],[],-,False
high_school_government_and_politics/test/5,high_school_government_and_politics,Social Sciences,Federal judges are subject to which of the following disciplinary actions?,"Impeachment, conviction, and removal from office by Congress",Removal from office by the appointing president,Removal from office by the president-elect,Recall elections by citizens residing in the district over which the judge has jurisdiction,A,[],[],[],[],[],[],-,False
high_school_government_and_politics/test/6,high_school_government_and_politics,Social Sciences,The amount of access cabinet secretaries have to the president is most likely to be controlled by the,vice president,president's chief of staff,national security advisor,chair of the Federal Reserve Board,B,[],[],[],[],[],[],-,False
high_school_government_and_politics/test/7,high_school_government_and_politics,Social Sciences,Which of the following defines the salience of a political issue?,The amount of coverage the issue receives in the major news media,The degree to which public opinion on the issue is likely to shift quickly,The number of people affected by the issue,The importance of the issue to a particular individual or group,D,[],[],[],[],[],[],-,False
high_school_government_and_politics/test/8,high_school_government_and_politics,Social Sciences,Voters who rely exclusively on television network news coverage of national elections are most likely to be aware of,which special interest groups have endorsed which candidates,"the relative strength of each candidate's support, as indicated by public opinion polls",candidates' positions on international issues,candidates' positions on domestic issues,B,[],[],[],[],[],[],-,False
high_school_government_and_politics/test/10,high_school_government_and_politics,Social Sciences,Which of the following people would most likely be accused of influence peddling?,A congressperson who retires to take a position teaching political science at a university,A former president who advises a current president on a particular foreign policy issue,A voter who researches the positions of all candidates in a race before choosing whom to support,An official who leaves the State Department to work as a paid consultant to foreign governments,D,[],[],[],[],[],[],-,False
high_school_government_and_politics/test/11,high_school_government_and_politics,Social Sciences,Which of the following does the Supreme Court NOT have the power to override?,Constitutional amendments,Presidential executive orders,Laws passed by Congress,Laws passed by state legislatures,A,"['regional', 'none', 'regional', 'regional']","['No', 'No', 'No', 'No']","['-', '-', '-', '-']",[],[],"['United States of America (USA)', 'United States of America (USA)', 'United States of America (USA)']",CS,True
high_school_government_and_politics/test/12,high_school_government_and_politics,Social Sciences,"According to The Federalist Papers, federalism has which of the following effects on political factions?",It provides a structured environment in which factions may flourish.,It limits the dangers of factionalism by diluting political power.,It allows factions to dominate on the national level while limiting their influence on state governments.,It eliminates any opportunity for factions to form.,B,[],[],[],[],[],[],-,False
high_school_government_and_politics/test/13,high_school_government_and_politics,Social Sciences,Which of the following statements about voting patterns is NOT true?,Non-whites are more likely to vote Democratic than are whites.,Women are more likely to vote Democratic than are men.,Low-income Americans are more likely to vote Democratic than are upper-income Americans.,Evangelical Christians are more likely to vote Democratic than are non-religious Americans.,D,"['cultural', 'regional', 'none', 'regional']","['Yes', 'Yes', 'No', 'No']","[{'end': 55, 'label': 'Cultural', 'score': None, 'start': 40}, {'end': 55, 'label': 'Cultural', 'score': None, 'start': 40}, '-', '-']","['Western Culture', 'Western Culture']","['North America', 'North America', 'North America']","['United States of America (USA)', 'United States of America (USA)', 'United States of America (USA)']",CS,True
high_school_government_and_politics/test/15,high_school_government_and_politics,Social Sciences,Voters in which of the following categories would be LEAST likely to vote?,Blue-collar workers who belong to a union,Professionals,Voters who are active in their political parties,Voters aged 18-29,D,"['regional', 'cultural', 'regional', 'cultural']","['Yes', 'No', 'Yes', 'No']","[{'end': 73, 'label': 'Cultural', 'score': None, 'start': 53}, {'end': 73, 'label': 'Cultural', 'score': None, 'start': 53}, {'end': 73, 'label': 'Cultural', 'score': None, 'start': 53}, {'end': 74, 'label': 'Cultural', 'score': None, 'start': 53}]",[],[],[],CS,True
high_school_government_and_politics/test/22,high_school_government_and_politics,Social Sciences,"The Supreme Court issued the opinion quoted below in its ruling on which of the following cases? ""We conclude that in the field of education the doctrine of 'separate but equal' has no place. Separate educational facilities are inherently unequal.""",Gideon v. Wainwright,Marbury v. Madison,Engel v. Vitale,Brown v. Board of Education of Topeka,D,[],[],[],[],[],[],-,False
high_school_government_and_politics/test/25,high_school_government_and_politics,Social Sciences,Federal election laws are designed to achieve all of the following EXCEPT,require disclosure of campaign donations,"prevent campaigns from issuing ""attack"" ads",limit campaign contributions,require disclosure of campaign expenditures,B,"['regional', 'regional', 'regional', 'regional']","['No', 'No', 'No', 'No']","[{'end': 21, 'label': 'Geographic', 'score': None, 'start': 0}, {'end': 21, 'label': 'Geographic', 'score': None, 'start': 0}, '-', '-']",[],['North America'],"['United States of America (USA)', 'United States of America (USA)']",CS,True
high_school_government_and_politics/test/26,high_school_government_and_politics,Social Sciences,"The president executes a ""pocket veto"" by doing which of the following?",Publicly expressing rejection of a bill,Issuing an executive order invalidating a recently passed bill,Failing to sign a bill after Congress has adjourned,Recalling ambassadors from a peace negotiation,C,[],[],[],[],[],[],-,False
high_school_government_and_politics/test/27,high_school_government_and_politics,Social Sciences,Which of the following has been true of the Republican Party since the 1980s?,It has become aligned with civil libertarians.,It has come to be dominated by labor unions.,It has become more antagonistic to business interests.,It has become more influenced by evangelical Christians.,D,"['regional', 'regional', 'regional', 'regional']","['Yes', 'No', 'Yes', 'No']","[{'end': 60, 'label': 'Geographic', 'score': None, 'start': 44}, {'end': 60, 'label': 'Geographic', 'score': None, 'start': 44}, '-', '-']",[],"['North America', 'North America']","['United States of America (USA)', 'United States of America (USA)', 'United States of America (USA)', 'United States of America (USA)']",CS,True
high_school_government_and_politics/test/28,high_school_government_and_politics,Social Sciences,"Which of the following statements is LEAST true of voters in federal, state, and local elections?",Voter turnout is lower in midterm elections than it is in presidential elections.,Voters lacking party affiliation tend to vote less regularly than those with strong party affiliation.,Young adults are less likely to vote than senior citizens.,Individuals are more likely to vote when they believe they know which candidate will win an election.,D,"['none', 'regional', 'regional', 'regional']","['No', 'Yes', 'No', 'No']","['-', '-', {'end': 97, 'label': 'Geographic', 'score': None, 'start': 51}, {'end': 97, 'label': 'Geographic', 'score': None, 'start': 61}]",['Western Culture'],['North America'],"['United States of America (USA)', 'United States of America (USA)']",CS,True
high_school_government_and_politics/test/29,high_school_government_and_politics,Social Sciences,Which of the following is NOT true of executive orders?,Presidents avoid using executive orders for controversial actions.,Executive orders have the same effect as laws passed by Congress.,Presidents have made increased use of executive orders since the 1970s.,Executive orders bypass congressional approval.,A,[],[],[],[],[],[],-,False
high_school_government_and_politics/test/30,high_school_government_and_politics,Social Sciences,Which of the following principles is realized when the federal government provides most of the funding to a project in which multiple levels of government work together?,Confederation,Fiscal federalism,Grant-based funding,Dual federalism,B,[],[],[],[],[],[],-,False
high_school_government_and_politics/test/32,high_school_government_and_politics,Social Sciences,All of the following can be considered true about the impact of a higher level of education on voting habits EXCEPT,voters are more likely to support government-enforced affirmative action programs,voters are more likely to support environmental protection efforts,voters are more likely to support public prayer in schools,voters are less likely to support restrictions on abortion rights,C,[],[],[],[],[],[],-,False
high_school_government_and_politics/test/34,high_school_government_and_politics,Social Sciences,Which of the following is true of appellate courts?,Appellate judges never use the stare decisis principle.,Appellate trials are usually jury trials.,Appellate judges usually decide the facts of a case.,Appellate judges review decisions of lower courts.,D,[],[],[],[],[],[],-,False
high_school_government_and_politics/test/35,high_school_government_and_politics,Social Sciences,Which of the following generally results when the Senate and House of Representatives pass different versions of the same bill?,The president signs the version he prefers.,The bill goes back to each house's committee and restarts the legislative process.,"All amendments to the bill are invalidated, and the original version of the bill is sent to the president to sign.",The two legislative bodies form a conference committee.,D,"['regional', 'regional', 'regional', 'regional']","['No', 'No', 'No', 'No']","['-', '-', '-', '-', '-']",['Western Culture'],['North America'],"['United States of America (USA)', 'United States of America (USA)']",CS,True
high_school_government_and_politics/test/36,high_school_government_and_politics,Social Sciences,"Which of the following accounts for the fact that the power and prestige of the presidency have grown since 1932? I. America's increased prominence in international affairs II. continually improved public confidence in the federal government III. the New Deal and other programs that have expanded federal responsibility IV. the president's increased visibility, due to the development of mass media",I only,I and IV only,"I, III, and IV only",II and IV only,C,[],[],[],[],[],[],-,False
high_school_government_and_politics/test/37,high_school_government_and_politics,Social Sciences,"Interest groups representing businesspeople and investors are often among the most successful lobbying groups in Washington, D.C., for all of the following reasons EXCEPT",Such groups have the financial resources to mount sustained campaigns on their own behalf.,"Many such groups have been in existence for several decades or more, allowing them to master the legislative system and to develop close ties with legislators.","In many districts, these groups' constituents make up the majority of voters.","These groups' constituents contribute heavily to many legislators' campaigns, and in doing so, gain greater access to legislators.",C,[],[],[],[],[],[],-,False
high_school_government_and_politics/test/40,high_school_government_and_politics,Social Sciences,"Among the following groups that have traditionally supposed the Democratic Party, which has the least liberal constituency?",White Southerners,Labor union members,African Americans,Northern ethnic minorities,A,[],[],[],[],[],[],-,False
high_school_government_and_politics/test/41,high_school_government_and_politics,Social Sciences,Which of the following has the Supreme Court held about the death penalty?,The death penalty may only be imposed upon citizens.,"Under some circumstances, the death penalty may not violate the Eighth Amendment.","Under some circumstances, the death penalty may violate the Third Amendment.",States may execute any adult regardless of intellectual disability.,B,"['regional', 'none', 'regional', 'regional']","['Yes', 'No', 'No', 'No']","['-', '-', '-', '-']",['Western Culture'],['North America'],"['United States of America (USA)', 'United States of America (USA)']",CS,True
high_school_government_and_politics/test/42,high_school_government_and_politics,Social Sciences,Which of the following describes a core principle of the Constitution as it was written in 1787?,Direct democracy,Checks and balances,Equal representation,Unitary government,B,[],[],[],[],[],[],-,False
high_school_government_and_politics/test/44,high_school_government_and_politics,Social Sciences,Which of the following statements about presidential elections since 1972 is most accurate?,Voters increasingly get their information from newspapers.,Voters have become more focused on individual candidates.,Elections have become dominated by special interest groups.,Voters increasingly vote based on a party's platform.,B,"['regional', 'regional', 'regional', 'regional', 'regional']","['Yes', 'No', 'Yes', 'No', 'Yes']","['-', '-', '-', '-', '-']",[],[],[],CS,True
high_school_government_and_politics/test/45,high_school_government_and_politics,Social Sciences,Which of the following most accurately describes the right of American citizens to privacy?,The right to privacy is determined entirely by the states on a case-by-case basis.,The right to privacy is explicitly granted in the Preamble to the Constitution.,The Supreme Court has ruled that the right to privacy is implied by the Bill of Rights.,Common law requires the government to respect citizens' right to privacy.,C,[],[],[],[],[],[],-,False
high_school_government_and_politics/test/46,high_school_government_and_politics,Social Sciences,A presidential veto would most likely be overturned in which of the following situations?,Approximately 30% of the senators and representatives are members of the presidential political party.,The majority of American citizens support the proposed legislation.,The chief justice of the Supreme Court was appointed by the president.,The president's successful reelection campaign advocated bipartisanship.,A,[],[],[],[],[],[],-,False
high_school_government_and_politics/test/47,high_school_government_and_politics,Social Sciences,"Of the following interest groups, which has created the largest number of political action committees (PACs) since the 1970s?",Environmental activists,Labor unions,For-profit business,Religious institutions,C,[],[],[],[],[],[],-,False
high_school_government_and_politics/test/49,high_school_government_and_politics,Social Sciences,"Which of the following would occur if Congress were to pass legislation and declare a recess, and the president took no action on the bill within ten days of its passage?",A line-item veto,A pocket veto,An adjournment,A writ of certiorari,B,"['regional', 'regional', 'regional', 'regional']","['No', 'No', 'No', 'No']","['-', '-', '-', '-']",['Western Culture'],"['North America', 'North America']","['United States of America (USA)', 'United States of America (USA)']",CS,True
high_school_government_and_politics/test/52,high_school_government_and_politics,Social Sciences,Which of the following best illustrates a use of the elastic clause?,The Supreme Court allows a lower court ruling to stand by refusing to hear an appeal.,A congressional committee prevents the full chamber from voting on legislation by delaying its report.,Congress passes legislation establishing a national speed limit.,A member of the House of Representatives introduces a bill to increase federal income tax rates.,C,[],[],[],[],[],[],-,False
high_school_government_and_politics/test/53,high_school_government_and_politics,Social Sciences,Which of the following is true of the House Committee on Ways and Means?,Its primary role is to appropriate spending for infrastructure projects.,It is the primary author of congressional banking reform legislation.,It allocates funding for canals and waterways.,Its jurisdiction includes the tax system.,D,[],[],[],[],[],[],-,False
high_school_government_and_politics/test/54,high_school_government_and_politics,Social Sciences,Which of the following is generally understood to be the purpose of the Tenth Amendment to the Constitution?,It allows for trial by jury in common-law cases.,It grants voting rights to all American women.,It lowers the legal voting age from 21 to 18.,It reserves powers to the states.,D,"['regional', 'regional', 'regional', 'regional']","['No', 'No', 'No', 'No']","[{'end': 107, 'label': 'Geographic', 'score': None, 'start': 95}, {'end': 107, 'label': 'Geographic', 'score': None, 'start': 72}, {'end': 108, 'label': 'Geographic', 'score': None, 'start': 72}, {'end': 108, 'label': 'Geographic', 'score': None, 'start': 72}]",[],['North America'],"['United States of America (USA)', 'United States of America (USA)', 'United States of America (USA)', 'United States of America (USA)']",CS,True
high_school_government_and_politics/test/55,high_school_government_and_politics,Social Sciences,Which of the following best articulates the doctrine of original intent?,"When a law is unclear, the Supreme Court may consider the intent of a law or the letter of the law, but not both.",Copyright laws exist to protect the rights of those who create original works.,Appellate judges should respect the original decisions of trial judges.,The Constitution should be interpreted in light of the intent of those who wrote it.,D,[],[],[],[],[],[],-,False
high_school_government_and_politics/test/56,high_school_government_and_politics,Social Sciences,Which of the following statements is true of congressional incumbents who run for reelection?,Incumbent senators are more likely to be reelected than are incumbent members of the House of Representatives.,Incumbents are prohibited by law from spending more on their reelection campaigns than their challengers spend.,Incumbents have a great advantage over challengers because they are better known and can raise campaign funds more easily.,"Ever since the 1994 election, the majority of congressional incumbents have failed in their reelection attempts.",C,"['regional', 'regional', 'regional', 'regional']","['No', 'No', 'No', 'No']","['-', '-', {'end': 69, 'label': 'Geographic', 'score': None, 'start': 45}, {'end': 73, 'label': 'Geographic', 'score': None, 'start': 45}]",[],['North America'],"['United States of America (USA)', 'United States of America (USA)', 'United States of America (USA)']",CS,True
high_school_government_and_politics/test/58,high_school_government_and_politics,Social Sciences,Which of the following is a direct result of an electoral system that features single-member districts?,Only two major parties can successfully be supported.,National campaigns can be conducted without incurring great expense.,Third parties can be as successful as the two major political parties can.,Each political party tends to focus its campaign on a single issue.,A,[],[],[],[],[],[],-,False
high_school_government_and_politics/test/59,high_school_government_and_politics,Social Sciences,All of the following contribute to lower voting rates among Americans in the 18-to-25 age bracket EXCEPT,college attendance in a state other than one's home state,frequent relocation of one's primary residence,the remoteness of most political issues to the daily lives of young people,the fact that the minimum voting age in some states is 21,D,[],[],[],[],[],[],-,False
high_school_government_and_politics/test/60,high_school_government_and_politics,Social Sciences,Which of the following may file an amicus curiae brief?,A defendant who wants to know what witnesses the plaintiff plans to call.,Former presidents who wish to send instructions to the justices who they appointed.,A senator who wants to impeach a Supreme Court justice.,Companies that are not involved in a court case but wish to affect the outcome.,D,"['regional', 'regional', 'regional']","['No', 'No', 'No']","['-', '-', '-']",[],['North America'],['United States of America (USA)'],CS,True
high_school_government_and_politics/test/61,high_school_government_and_politics,Social Sciences,Which of the following best predicts how someone will vote in an election?,The voter's gender,The voter's political party affiliation,The voter's socioeconomic status,The voter's religion,B,"['regional', 'none', 'cultural']","['Yes', 'No', 'No']","['-', '-', '-', '-']",['Western Culture'],[],[],CS,True
high_school_government_and_politics/test/62,high_school_government_and_politics,Social Sciences,Which of the following statements about the electoral college is correct?,Each state must split its electoral votes among all the candidates that receive votes.,Each state is equally represented in the electoral college.,The electoral college was created by an amendment to the Constitution.,"The results of electoral college voting tend to distort the winner's margin of victory, when compared with the popular vote for president.",D,[],[],[],[],[],[],-,False
high_school_government_and_politics/test/63,high_school_government_and_politics,Social Sciences,A sound bite would most likely be used during a presidential election in order to,"avoid ""horse race"" politics",provide the audience with a candidate's view in a limited amount of time,reduce the amount of negative advertising used,ensure a candidate is presented in the best light,B,[],[],[],[],[],[],-,False
high_school_government_and_politics/test/64,high_school_government_and_politics,Social Sciences,Interest groups are barred from taking part in which of the following activities?,Sending lawmakers to educational seminars,Giving tangible gifts to lawmakers,Providing research to government officials,Staging protests and boycotts,B,[],[],[],[],[],[],-,False
high_school_government_and_politics/test/66,high_school_government_and_politics,Social Sciences,A member of which of the following demographic groups is most likely to support a Republican presidential candidate?,Married white male,Unmarried white female,"African American, male or female","Youths under the age of 25, male or female",A,[],[],[],[],[],[],-,False
high_school_government_and_politics/test/67,high_school_government_and_politics,Social Sciences,"Which of the following is the primary purpose of ""motor voter"" laws?",To increase turnout on election days,To make it easier for citizens to register to vote,To require that all voters know how to drive,To establish voter identification laws,B,[],[],[],[],[],[],-,False
