sample_id,subject,subject_category,question,option_a,option_b,option_c,option_d,answer,required_knowledge,time_sensitive,reference,culture,region,country,cultural_sensitivity_label,is_annotated
high_school_physics/test/116,high_school_physics,STEM,"A children’s toy consists of a cart whose very light wheels are attached to a rubber band. This rubber band can wind and unwind around the axle supporting the wheels. This toy is given a shove, after which the toy rolls across a flat surface and up a ramp. It is observed that the toy does not go a consistent distance up the ramp—in some trials it ends up higher than in other trials, even though the shove imparts the same kinetic energy to the cart each time. Which of the following is a reasonable explanation for this phenomenon?","Depending on how the rubber band is initially wound, more or less potential energy can be transferred from the rubber band to the kinetic energy of the car’s motion.",The normal force on the cart’s wheels will be different depending on how much the rubber band winds or unwinds.,How much energy is transferred from kinetic energy to gravitational potential energy depends on the vertical height at which the cart ends up.,Some of the cart’s initial kinetic energy will be dissipated due to work done by friction.,A,[],[],[],[],[],[],-,False
high_school_physics/test/118,high_school_physics,STEM,"Two ice skaters are moving on frictionless ice and are about to collide. The 50-kg skater is moving directly west at 4 m/s. The 75-kg skater is moving directly north at 2 m/s. After the collision they stick together. For this scenario, which of the following is true?",The linear momentum of the system is conserved because the net force on the system is nonzero during the collision.,Only the kinetic energy of the system is conserved because it is an inelastic collision.,Only the kinetic energy of the system is conserved because it is an elastic collision.,The linear momentum of the system is conserved because the net force on the system is zero.,D,[],[],[],[],[],[],-,False
high_school_physics/test/119,high_school_physics,STEM,"The mass of the Earth is 5.97 × 10^24 kg. The Moon, whose center is 3.84 × 10^8 m from the Earth’s center, has mass 7.35 × 10^22 kg. Which of the following is the best estimate of the gravitational force of the Earth on the Moon?",10^39 N,10^29 N,10^19 N,10^9 N,C,"['none', 'none', 'regional', 'cultural']","['No', 'No', 'No', 'No']","['-', '-', {'end': 40, 'label': 'Geographic', 'score': None, 'start': 25}, {'end': 228, 'label': 'Cultural', 'score': None, 'start': 184}]",['Western Culture'],[],[],CS,True
high_school_physics/test/124,high_school_physics,STEM,Which of the following conditions are necessary for an object to be in static equilibrium? I. The vector sum of all torques on the object must equal zero. II. The vector sum of all forces on the object must equal zero. III. The sum of the object’s potential and kinetic energies must be zero.,I only,II only,III only,I and II only,D,"['none', 'none', 'none', 'none']","['No', 'No', 'No', 'No']","['-', '-', '-', '-']",[],[],[],CA,True
high_school_physics/test/125,high_school_physics,STEM,"A student pushes a puck across a table, moving it from position x = 0 to position x = 0.2 m. After he lets go, the puck continues to travel across the table, coming to rest at position x = 1.2 m. When the puck is at position x = 1.0 m, which of the following is a correct assertion about the net force on the puck?","The net force is in the negative direction, because the puck is moving in the positive direction but slowing down.","The net force is down, because the puck is near the Earth, where gravitational acceleration is 10 m/s^2 downward.","The net force is in the positive direction, because the student’s push caused the puck to speed up in the positive direction.","The net force is zero, because the student’s push in the positive direction must equal the force of friction in the negative direction.",A,[],[],[],[],[],[],-,False
high_school_physics/test/136,high_school_physics,STEM,"A rigid, solid container of constant volume holds an ideal gas of volume v1 and temperature T1 and pressure P1. The temperature is increased in an isochoric process. Which of the following is NOT true?",The average speed of the molecules increases.,The pressure increases.,The kinetic energy of the system increases.,The volume increases.,D,[],[],[],[],[],[],-,False
high_school_physics/test/138,high_school_physics,STEM,"A spherical charge distribution varies with the radius r by the equation ρ = ar, where ρ is the volume charge density and a is a positive constant. The distribution goes out to a radius R. Which of the following is true of the electric field strength due to this charge distribution at a distance r from the center?",It increases as r approaches infinity.,It decreases linearly for r > R.,It increases linearly for r > R.,It increases non-linearly for r < R.,D,[],[],[],[],[],[],-,False
high_school_physics/test/142,high_school_physics,STEM,"A nonconducting sphere is given a nonzero net electric charge, +Q, and then brought close to a neutral conducting sphere of the same radius. Which of the following will be true?",An electric field will be induced within the conducting sphere.,The conducting sphere will develop a net electric charge of –Q.,The spheres will experience an electrostatic attraction.,The spheres will experience an electrostatic repulsion.,C,[],[],[],[],[],[],-,False
high_school_physics/test/146,high_school_physics,STEM,"A rock drops onto a pond with a smooth surface. A few moments later, the wave produced by the rock’s impact arrives at the shore, touching the ankles of a wading child. Which of the following observations provides evidence that the portion of the wave hitting the child’s ankles carries less energy than the wave did when it was first created by the rock’s impact?",The wave is moving more slowly.,The wave pulse’s width has become greater.,The wave pulse’s width has become smaller.,The wave’s height has become smaller.,D,[],[],[],[],[],[],-,False
high_school_physics/test/147,high_school_physics,STEM,Physics students are checking the constant acceleration equations of kinematics by measuring the velocity of a tennis ball that is dropped and falls 6 meters and then passes through a photogate. The predicted velocity is 20% above the velocity measured by the photogate. Which of the following best describes the cause of the large percent difference?,The ball changes its shape while falling.,The acceleration of gravity varies as the ball is falling.,Air resistance increases the acceleration of the ball.,The acceleration of the balls varies with the velocity.,D,"['regional', 'none', 'none', 'regional']","['No', 'No', 'No', 'No']","['-', '-', '-', '-']",[],[],[],CS,True
high_school_physics/test/150,high_school_physics,STEM,"An artificial satellite orbits Earth just above the atmosphere in a circle with constant speed. A small meteor collides with the satellite at point P in its orbit, increasing its speed by 1%, but not changing the instantaneous direction of the satellite’s velocity. Which of the following describes the satellite’s new orbit?","The satellite now orbits in an ellipse, with P as the farthest approach to Earth.","The satellite now orbits in an ellipse, with P as the closest approach to Earth.",The satellite now orbits in a circle of larger radius.,The satellite now orbits in a circle of smaller radius.,B,"['none', 'none', 'none', 'none']","['No', 'No', 'No', 'No']","['-', '-', '-', '-']",[],[],[],CA,True
