sample_id,subject,subject_category,question,option_a,option_b,option_c,option_d,answer,required_knowledge,time_sensitive,reference,culture,region,country,cultural_sensitivity_label,is_annotated
high_school_physics/test/4,high_school_physics,STEM,Two identical capacitors are hooked in parallel to an external circuit. Which of the following quantities must be the same for both capacitors? I. the charge stored on the capacitor II.  the voltage across the capacitor III. the capacitance of the capacitor,I only,II only,II and III only,"(E) I, II, and III",D,"['none', 'none', 'none', 'none']","['No', 'No', 'No', 'No']","['-', '-', '-', '-']",[],[],[],CA,True
high_school_physics/test/6,high_school_physics,STEM,"A student is experimenting with a simple spring-block oscillator of spring constant k and amplitude A. The block attached to the spring has a mass of m. If the student places a small block of mass m on top of the original block, which of the following is true?","The small block is most likely to slide off when the original block is at maximum displacement from the equilibrium position, but will not slide off as long as the coefficient of static friction between the blocks is greater than kA/[(M+m)g].","The small block is most likely to slide off when the original block is at the equilibrium position, but will not slide off as long as the coefficient of static friction between the blocks is greater than kA/[(M+m)g].","The small block is most likely to slide off when the original block is at maximum displacement from the equilibrium position, but will not slide off as long as the coefficient of static friction between the blocks is greater than (M+m)g/(kA).","The small block is most likely to slide off when the original block is at the equilibrium position, but will not slide off as long as the coefficient of static friction between the blocks is greater than (M+m)g/(kA).",A,[],[],[],[],[],[],-,False
high_school_physics/test/10,high_school_physics,STEM,Two identical containers are filled with different gases. Container 1 is filled with hydrogen and container 2 is filled with nitrogen. Each container is set on a lab table and allowed to come to thermal equilibrium with the room. Which of the following correctly compares the properties of the two gases?,The average kinetic energy of the hydrogen gas is greater than the nitrogen gas.,The average force exerted on the container by the hydrogen gas is greater than the nitrogen gas.,The density of the hydrogen gas is less than the nitrogen gas.,The pressures of the gases cannot be compared without knowing the number of molecules in each container.,D,"['none', 'none', 'none', 'none']","['No', 'No', 'No', 'No']","['-', '-', '-', '-']",[],[],[],CA,True
high_school_physics/test/11,high_school_physics,STEM,"A girl of mass m and a boy of mass 2m are sitting on opposite sides of a see-saw with its fulcrum in the center. Right now, the boy and girl are equally far from the fulcrum, and it tilts in favor of the boy. Which of the following would NOT be a possible method to balance the see-saw?",Move the boy to half his original distance from the fulcrum.,Move the girl to double her original distance from the fulcrum.,Allow a second girl of mass m to join the first.,Move the fulcrum to half its original distance from the boy.,D,[],[],[],[],[],[],-,False
high_school_physics/test/12,high_school_physics,STEM,"When hot water is poured into a beaker containing cold alcohol, the temperature of the mixture will eventually reach the same temperature. Considering the scale of the size of the molecules of the fluids, which of the following is the primary reason for this phenomenon?",The high temperature water will rise to the top of the container until it has cooled and then mixes with the alcohol.,"The molecules of the water continue to have a higher kinetic energy than the molecules of the alcohol, but the two liquids mix until the energy is spread evenly throughout the container.",The hot water produces thermal radiation that is absorbed by the cold alcohol until the kinetic energy of all the molecules is the same.,"The water molecules collide with the alcohol molecules, transferring energy until the average kinetic energy of both the water and alcohol molecules are the same.",D,"['none', 'none', 'none', 'none']","['No', 'No', 'No', 'No']","['-', '-', '-', '-']",[],[],[],CA,True
high_school_physics/test/14,high_school_physics,STEM,The radius of Mars is about half that of Earth; the mass of Mars is about one-tenth that of Earth. Which of the following is closest to the gravitational field at the surface of Mars?,10 N/kg,4 N/kg,2 N/kg,0.5 N/kg,B,[],[],[],[],[],[],-,False
high_school_physics/test/23,high_school_physics,STEM,Each of the following ionized isotopes is projected with the same speed into a uniform magnetic field B such that the isotope's initial velocity is perpendicular to B. Which combination of mass and charge would result in a circular path with the largest radius?,"m = 16 u, q = –5 e","m = 17 u, q = –4 e","m = 18 u, q = –3 e","m = 20 u, q = –1 e",D,[],[],[],[],[],[],-,False
high_school_physics/test/25,high_school_physics,STEM,"A person can stand outside on a cold day for hours without ill effect, but falling into a cold lake can kill a person in a matter of minutes. Which of the following is the primary reason for this phenomenon?","The molecules of the person are, on average, moving faster than those of the surroundings.",Thermal energy moves from high concentration areas (hot) to low concentration areas (cold).,"As heat flows out of the person and warms the fluid surrounding the person, the warmer fluid rises, allowing fresh cool fluid to come in contact with the person and increasing the rate of heat transfer.","Water has more molecules per volume than air, increasing molecular contact with the person.",D,[],[],[],[],[],[],-,False
high_school_physics/test/28,high_school_physics,STEM,A very slow-moving positron interacts with a stationary electron. Which of the following statements correctly describes a possible outcome of this reaction and why it would occur?,"Conservation of mass indicates that if a single new particle were created in the reaction, it must have a total mass equal to the combined masses of the electron and positron.",Conservation of charge indicates that all new particles created in the reaction would have no electric charge.,Conservation of momentum indicates that two identical gamma rays moving off in opposite directions could be created.,"Conservation of energy indicates that the antimatter positron could annihilate into energy, leaving the stationary electron behind.",C,[],[],[],[],[],[],-,False
high_school_physics/test/32,high_school_physics,STEM,"If the force of gravity between the Moon and the Earth were to stop, which statement best describes the resulting motion of the moon?","It would continue rotating on its axis, and it would revolve around the Earth as usual.","It would continue rotating on its axis, but it would stop revolving around the Earth.","It would stop rotating on its axis, but it would revolve around the Earth as usual.","It would stop rotating on its axis, and it would stop revolving around the Earth.",B,[],[],[],[],[],[],-,False
high_school_physics/test/33,high_school_physics,STEM,A person stands on a scale in an elevator. He notices that the scale reading is less than his usual weight. Which of the following could possibly describe the motion of the elevator?,It is moving downward and slowing down.,It is moving upward and slowing down.,It is moving upward at a constant speed.,It is moving downward at a constant speed.,B,"['none', 'none', 'none', 'none', 'none']","['No', 'No', 'No', 'No', 'No']","['-', '-', '-', '-', '-']",[],[],[],CA,True
high_school_physics/test/34,high_school_physics,STEM,"A whiffle ball is tossed straight up, reaches a highest point, and falls back down. Air resistance is not negligible. Which of the following statements are true?
I. The ball’s speed is zero at the highest point.
II. The ball’s acceleration is zero at the highest point.
III. The ball takes a longer time to travel up to the highest point than to fall back down.",I only,II only,I & II only,I & III only,C,"['regional', 'none', 'none', 'none', 'none', 'none']","['No', 'No', 'No', 'No', 'No', 'No']","['-', '-', '-', '-', '-', '-']",['Western Culture'],['North America'],['United States of America (USA)'],CA,True
high_school_physics/test/38,high_school_physics,STEM,"During an isothermal expansion, a confined ideal gas does 150 J of work against its surroundings. Which of the following describes the heat transfer during this process?",150 J of heat was added to the gas.,150 J of heat was removed from the gas.,300 J of heat was added to the gas.,300 J of heat was removed from the gas.,A,[],[],[],[],[],[],-,False
high_school_physics/test/40,high_school_physics,STEM,A guitar string creates a sound wave of known frequency. Which of the following describes a correct and practical method of measuring the wavelength of the sound wave with a meterstick?,Lightly touch the guitar string in the middle such that a single node is created. Measure the length of the string; this is the wavelength.,Measure the length of the guitar string; this is half the wavelength.,Adjust the length of a pipe placed near the string so that resonances are heard. Measure the difference between the pipe lengths for consecutive resonances; this is half the wavelength.,Measure the peak-to-peak distance of the wave as it passes; this is the wavelength.,C,"['none', 'none', 'none', 'none', 'none', 'none', 'none']","['No', 'No', 'No', 'No', 'No', 'No', 'No']","['-', '-', '-', '-', '-', '-', '-']",[],[],[],CA,True
high_school_physics/test/41,high_school_physics,STEM,Which of the following statements about images is true?,Images produced by concave lenses are always real.,Images produced by concave mirros are always real.,Images produced by convex lenses can be both real and virtual.,Images produced by convex mirrors can be both real and virtual.,C,"['none', 'none', 'none', 'none', 'none']","['No', 'No', 'No', 'No', 'No']","['-', '-', '-', '-', '-']",[],[],[],CA,True
high_school_physics/test/42,high_school_physics,STEM,"Pretend someone actually managed to dig a hole straight through the center of the Earth all the way to the other side. If an object were dropped down that hole, which of the following would best describe its motion? Assume ideal conditions and that the object cannot be destroyed.",It would fall to the center of the Earth and stop there.,"It would fall through the hole to the other side, continue past the opposite side’s opening, and fly into space.",It would oscillate back and forth from one opening to the other indefinitely.,It would fall to the other side and stop there.,C,"['none', 'none', 'none', 'none']","['No', 'No', 'No', 'No']","['-', '-', '-', '-']",[],[],[],CA,True
high_school_physics/test/44,high_school_physics,STEM,In which of the following situations involving a source of sound and a detector of the sound is it possible that there is NO perceived Doppler shift?,The source travels toward the stationary detector.,The detector travels toward the stationary source.,Both the source and detector travel in the same direction.,"Both the source and detector travel in opposite directions, with the source and detector moving away from each other.",C,[],[],[],[],[],[],-,False
high_school_physics/test/49,high_school_physics,STEM,"In an experiment designed to study the photoelectric effect, it is observed that low-intensity visible light of wavelength 550 nm produced no photoelectrons. Which of the following best describes what would occur if the intensity of this light were increased dramatically?","Almost immediately, photoelectrons would be produced with a kinetic energy equal to the energy of the incident photons.","Almost immediately, photoelectrons would be produced with a kinetic energy equal to the energy of the incident photons minus the work function of the metal.","After several seconds, necessary for the electrons to absorb sufficient energy from the incident light, photoelectrons would be produced with a kinetic energy equal to the energy of the incident photons minus the work function of the metal.",Nothing would happen.,D,[],[],[],[],[],[],-,False
high_school_physics/test/50,high_school_physics,STEM,"Two traveling waves of equal frequency, one of amplitude 4 cm and the other of amplitude 6 cm, superimpose in a single medium. Which of the following best describes the displacement, D, of the resultant wave?",2 cm ≤ D ≤ 10 cm,D = 5 cm,D = 10 cm,10 cm ≤ D ≤ 12 cm,A,[],[],[],[],[],[],-,False
high_school_physics/test/51,high_school_physics,STEM,"In Collision A, two carts collide and bounce off each other. In Collision B, a ball sticks to a rigid rod, which begins to rotate about the combined center of mass. Which of the following statements about quantities in each collision is correct?","Collision A: each cart experiences the same force, time of collision, and change in kinetic energy. Collision B: the ball and the rod each experience the same torque, time of collision, and change in rotational kinetic energy.","Collision A: each cart experiences the same force, time of collision, and change in linear momentum. Collision B: the ball and the rod each experience the same torque, time of collision, and change in angular momentum.","Collision A: each cart experiences the same force, time of collision, and change in kinetic energy. Collision B: the ball and the rod each experience the same torque, time of collision, and change in angular momentum.","Collision A: each cart experiences the same force, time of collision, and change in velocity. Collision B: the ball and the rod each experience the same torque, time of collision, and change in angular velocity",B,[],[],[],[],[],[],-,False
high_school_physics/test/52,high_school_physics,STEM,"An object of mass 2 kg is acted upon by three external forces, each of magnitude 4 N. Which of the following could NOT be the resulting acceleration of the object?",0 m/s^2,2 m/s^2,4 m/s^2,8 m/s^2,D,[],[],[],[],[],[],-,False
high_school_physics/test/53,high_school_physics,STEM,Spring scales are used to measure the net force applied to an object; a sonic motion detector is used to measure the object’s resulting acceleration. A graph is constructed with the net force on the vertical axis and the acceleration on the horizontal axis. Which of the following quantities is directly measured using the slope of this graph?,Gravitational mass,Weight,Velocity,Inertial mass,D,[],[],[],[],[],[],-,False
high_school_physics/test/60,high_school_physics,STEM,"A textbook weighs 30 N at sea level. Earth’s radius is 6,400 km. Which of the following is the best estimate of the textbook’s weight on a mountain peak located 6,000 m above sea level?",60 N,15 N,30 N,7.5 N,C,[],[],[],[],[],[],-,False
high_school_physics/test/61,high_school_physics,STEM,Which of the following correctly describes the motion of a real object in free fall? Assume that the object experiences drag force proportional to speed and that it strikes the ground before reaching terminal sped.,It will fall with increasing speed and increasing acceleration.,It will fall with increasing speed and decreasing acceleration.,It will fall with decreasing speed and increasing acceleration.,It will fall with decreasing speed and decreasing acceleration.,B,"['none', 'none', 'none', 'none']","['No', 'No', 'No', 'No']","['-', '-', '-', '-']",[],[],[],CA,True
high_school_physics/test/62,high_school_physics,STEM,A bi-convex lens has a radius of curvature of magnitude 20 cm. Which of the following best describes the image formed of an object of height 2 cm placed 30 cm from the lens?,"Real, inverted, height = 1 cm","Virtual, upright, height = 0.25 cm","Real, upright, height = 1 cm","Virtual, inverted, height = 0.25 cm",A,[],[],[],[],[],[],-,False
high_school_physics/test/63,high_school_physics,STEM,"Two spheres of net charge +5e and -6e briefly come into contact. Afterward, which of the following is a possible combination of net charges for the two spheres?",+3e and -4e,+1.5e and -2.5e,Both of the above,None of the above,A,[],[],[],[],[],[],-,False
high_school_physics/test/64,high_school_physics,STEM,"The circumference of a helium-filled balloon is measured for three different conditions: at room temperature, after being in a warm oven for 30 minutes, and after being in a freezer for 30 minutes. A student plotting the circumference cubed C^3 as a function of temperature T, should expect to find which of the following?",a cubic relationship between C^3 and T,an indirect relationship between C^3 and T,an extrapolated temperature T where C^3 reaches zero,a maximum C^3 as the temperature T increases,C,[],[],[],[],[],[],-,False
high_school_physics/test/65,high_school_physics,STEM,The charge on an oil drop is measured in the laboratory. Which of the following measurements should be rejected as highly unlikely to be correct?,6.4 × 10^-19 C,8.0 × 10^-19 C,4.8 × 10^-19 C,2.4 × 10^-19 C,D,[],[],[],[],[],[],-,False
high_school_physics/test/67,high_school_physics,STEM,Which of the following changes to a circuit will always bring about an increase in the current?,Increased voltage and increased resistance,Decreased voltage and decreased resistance,Increased voltage and decreased resistance,Decreased voltage and increased resistance,A,[],[],[],[],[],[],-,False
high_school_physics/test/68,high_school_physics,STEM,Which of the following concerning uniform circular motion is true?,The centrifugal force is the action-reaction pair of the centripetal force.,The centripetal acceleration and velocity point in the same direction.,The velocity of the object in motion changes whereas the acceleration of the object is constant.,A satellite undergoing uniform circular motion is falling toward the center in a circular path.,D,[],[],[],[],[],[],-,False
high_school_physics/test/72,high_school_physics,STEM,"A proton enters a solenoid. Upon entry, the proton is moving in a straight line along the axis of the solenoid. Which of the following is a correct description of the proton’s motion within the solenoid?",The proton will be bent in a parabolic path.,The proton will be bent in a circular path.,The proton will continue in its straight path at constant velocity.,The proton will continue in its straight path and slow down.,C,"['none', 'none', 'none', 'none']","['No', 'No', 'No', 'No']","['-', '-', '-', '-']",[],[],[],CA,True
high_school_physics/test/76,high_school_physics,STEM,"Data is collected in an experiment preformed on an ideal gas. In the experiment, temperature (in K) is the independent variable and volume (in m^3) is the dependent variable. If a plot is produced where the dependent variable is on the vertical axis, which of the following is true about the slope and y-intercept of the graph?",The slope will be linearly proportional to the pressure of the gas and the intercept will be 0 m^3.,The slope will be inversely proportional to the pressure of the gas and the intercept will be 0 m^3.,The slope will be linearly proportional to the pressure of the gas and the intercept will not be 0 m^3.,The slope will be inversely proportional to the pressure of the gas and the intercept will not be 0 m^3.,B,"['none', 'none', 'regional', 'none']","['No', 'No', 'No', 'No']","['-', '-', '-', '-']",[],['North America'],[],CA,True
high_school_physics/test/82,high_school_physics,STEM,"Two charged, massive particles are isolated from all influence except those between the particles. They have charge and mass such that the net force between them is 0 N. Which of the following is NOT true?",The particles must have the same sign of charge.,"If the distance between the particles changes, the force will no longer be 0 N.",The particles must have the same mass.,Such a situation is impossible as the net force between the two particles cannot be 0.,A,[],[],[],[],[],[],-,False
high_school_physics/test/83,high_school_physics,STEM,Which one of the following statements is true concerning the motion of an ideal projectile launched at an angle of 45° to the horizontal?,The acceleration vector points opposite to the velocity vector on the way up and in the same direction as the velocity vector on the way down.,The speed at the top of the trajectory is zero.,The object's total speed remains constant during the entire flight.,The vertical speed decreases on the way up and increases on the way down.,D,"['none', 'none', 'none', 'none', 'none']","['No', 'No', 'No', 'No', 'No']","['-', '-', '-', '-', '-']",[],[],[],CA,True
high_school_physics/test/85,high_school_physics,STEM,"A moving 1.5-kg cart collides with and sticks to a 0.5-kg cart which was initially at rest. Immediately after the collision, the carts each have the same ______ as each other.",Velocity,Kinetic energy,Mass,Linear momentum,A,"['regional', 'regional', 'regional', 'none']","['No', 'No', 'No', 'No']","[{'end': 15, 'label': 'Geographic', 'score': None, 'start': 13}, {'end': 15, 'label': 'Geographic', 'score': None, 'start': 13}, '-', '-']",[],[],[],CS,True
high_school_physics/test/87,high_school_physics,STEM,"A car moving with speed v reaches the foot of an incline of angle θ. The car coasts up the incline without using the engine. Neglecting friction and air resistance, which of the following is correct about the magnitude of the car’s horizontal acceleration ax and vertical acceleration ay?",ax = 0; ay < g,ax = 0; ay = g,ax < g; ay < g,ax < g; ay = g,C,[],[],[],[],[],[],-,False
high_school_physics/test/88,high_school_physics,STEM,Which of the following would increase the capacitance of a parallel-plate capacitor?,Using smaller plates,Replacing the dielectric material between the plates with one that has a smaller dielectric constant,Decreasing the voltage between the plates,Moving the plates closer together,D,"['none', 'none', 'none', 'none']","['No', 'No', 'No', 'No']","['-', '-', '-', '-']",[],[],[],CA,True
high_school_physics/test/89,high_school_physics,STEM,A man stands with his hands to his sides on a frictionless platform that is rotating. Which of the following could change the angular momentum of the man-platform system?,The man catches a baseball thrown to him by a friend.,The man thrusts his arms out away from his body,"The man thrusts his arms out away from his body, and then quickly brings his arms back to his side again.",The man jumps straight up in the air and lands back on the platform.,A,[],[],[],[],[],[],-,False
high_school_physics/test/91,high_school_physics,STEM,Which of the following types of electromagnetic radiation has the longest wavelength?,Gamma rays,Ultraviolet,Blue light,Orange light,D,[],[],[],[],[],[],-,False
high_school_physics/test/101,high_school_physics,STEM,Which of the following changes to a double-slit interference experiment would increase the widths of the fringes in the interference pattern that appears on the screen?,Use light of a shorter wavelength.,Move the screen closer to the slits.,Move the slits closer together.,Use light with a lower wave speed.,C,"['none', 'none', 'none', 'none', 'none', 'none']","['No', 'No', 'No', 'No', 'No', 'No']","['-', '-', '-', '-', '-', '-']",[],[],[],CA,True
high_school_physics/test/103,high_school_physics,STEM,A particle is subjected to a conservative force whose potential energy function is U(x) = (x – 2)3 – 12x where U is given in joules when x is measured in meters. Which of the following represents a position of stable equilibrium?,x = –4,x = –2,x = 0,x = 4,D,[],[],[],[],[],[],-,False
high_school_physics/test/105,high_school_physics,STEM,"A ball of mass is attached to a string connected to the ceiling, forming a pendulum. When the string is raised to an angle of 50 degrees below the horizontal (the ceiling) and released, the ball swings back and forth with a period of 0.4 s. Which of the following changes to the pendulum would decrease the period of the pendulum?",Increasing the mass of the ball,Decreasing the length of the string,Decreasing the angle of the string from the horizontal when released,Decreasing the mass of the ball,B,"['none', 'none', 'none', 'none']","['No', 'No', 'No', 'No']","['-', '-', '-', '-']",[],[],[],CA,True
high_school_physics/test/109,high_school_physics,STEM,Which of the following statements about electric and magnetic fields is FALSE:,"A charge moving along the direction of an electric field will experience a force, but a charge moving along the direction of a magnetic field will not experience a force.","All charges experience a force in an electric field, but only moving charges can experience a force in a magnetic field.",A positive charge moves in the direction of an electric field; a positive charge moves perpendicular to a magnetic field.,All moving charges experience a force parallel to an electric field and perpendicular to a magnetic field.,C,[],[],[],[],[],[],-,False
high_school_physics/test/111,high_school_physics,STEM,"A confined ideal gas undergoes a cyclical process in three steps—an isobaric step, followed by an isochoric step, followed by an isothermal step. Which of the following must be true?",The change in internal energy of the gas is equal to the work done during the isobaric step.,The change in internal energy of the gas is equal to the work done during the isobaric step minus the work done during the isothermal step.,The total work done during the cycle is positive.,The total work done during the cycle is equal but opposite to the net amount of heat transferred.,D,[],[],[],[],[],[],-,False
high_school_physics/test/115,high_school_physics,STEM,Which of the following is NOT equal to one tesla?,1 J/(A*m^2),1 kg/(C*s),1 N/(A*m),1 A*N/V,D,"['none', 'none', 'none', 'none']","['No', 'No', 'No', 'No']","['-', '-', '-', '-']",[],[],[],CA,True
