sample_id,subject,subject_category,question,option_a,option_b,option_c,option_d,answer,required_knowledge,time_sensitive,reference,culture,region,country,cultural_sensitivity_label,is_annotated
high_school_government_and_politics/test/69,high_school_government_and_politics,Social Sciences,"Which of the following is the largest source of ""automatic spending"" for the federal government?",Salaries to employees of the U.S. Post Office,Interest payments made to U.S. bondholders,Entitlement programs,National defense,C,[],[],[],[],[],[],-,False
high_school_government_and_politics/test/70,high_school_government_and_politics,Social Sciences,"Which of the following is an example of ""horse-race journalism""?",A news story focuses on a politician's scandals rather than achievements.,A television news anchor reports an event before the station's rivals.,A reporter announces which candidate leads in a public opinion poll.,A newspaper editor prints stories about long-term political developments.,C,[],[],[],[],[],[],-,False
high_school_government_and_politics/test/71,high_school_government_and_politics,Social Sciences,All of the following are core values of American political culture EXCEPT,income equality,democracy,individual liberty,due process,A,[],[],[],[],[],[],-,False
high_school_government_and_politics/test/75,high_school_government_and_politics,Social Sciences,Which of the following actions can the president take without congressional approval?,Grant reprieves and pardons,Appoint Supreme Court justices,Negotiate and ratify treaties,Declare war,A,[],[],[],[],[],[],-,False
high_school_government_and_politics/test/77,high_school_government_and_politics,Social Sciences,The swift adoption of the Bill of Rights in the years following ratification of the Constitution demonstrates the,Framers' unqualified commitment to individual rights,small states' determination to receive equal representation in the legislature,Northern states' support for abolitionism,states' fears of an overpowerful national government,D,[],[],[],[],[],[],-,False
high_school_government_and_politics/test/78,high_school_government_and_politics,Social Sciences,Incumbent members of the House of Representatives win reelection more often than incumbent senators for all of the following reasons EXCEPT,representatives' constituents more often belong largely to the representative's party,"senators have more political power than representatives, and Senate races are accordingly contested more aggressively",representatives may use federal funds to publicize their achievements via direct mail to constituents,representatives more often run uncontested,C,[],[],[],[],[],[],-,False
high_school_government_and_politics/test/80,high_school_government_and_politics,Social Sciences,Which of the following is an accurate statement about the leadership of the two major political parties?,The national party organization controls all facets of party activity throughout the country.,"Party leadership is dispersed among numerous officials at the national, state, and local levels.",The highest elected official in each national party directs that party's activities and operations all the way down to the state and local levels.,All major decisions concerning party activities are made during each party's presidential nomination conventions.,B,[],[],[],[],[],[],-,False
high_school_government_and_politics/test/82,high_school_government_and_politics,Social Sciences,"Which of the following is the best illustration of ""pork barrel"" legislation?",A federal agency is created to ensure the safety of food and animal products.,A bill can be passed only if a majority of congresspersons from rural districts approve of it.,A senator refuses to vote for a tax increase without a corresponding decrease in spending.,A member of Congress inserts a provision into a bill to secure funding for a project in his or her district.,D,[],[],[],[],[],[],-,False
high_school_government_and_politics/test/83,high_school_government_and_politics,Social Sciences,All of the following statements about gerrymandering are true EXCEPT that it,favors incumbent candidates over challengers,can divide like-minded voters into several districts to reduce their influence,has been allowed by the Supreme Court in some instances,increases the control voters have over their elected officials,D,[],[],[],[],[],[],-,False
high_school_government_and_politics/test/84,high_school_government_and_politics,Social Sciences,"Which of the following was the legal basis for the 1973 Roe v. Wade majority opinion, in which the Supreme Court struck down a state ban on abortion?",The Nineteenth Amendment secures for women the right to vote.,The Civil Rights Act of 1964 prohibits discrimination based on gender.,The Bill of Rights implies a right to privacy.,The Ninth Amendment reserves powers to the people.,C,[],[],[],[],[],[],-,False
high_school_government_and_politics/test/85,high_school_government_and_politics,Social Sciences,"Of the following, American federalism is most clearly exemplified by the",system of checks and balances among the three branches of the national government,process by which international treaties are completed,"special constitutional status of Washington, D.C.",Tenth Amendment to the Constitution,D,[],[],[],[],[],[],-,False
high_school_government_and_politics/test/88,high_school_government_and_politics,Social Sciences,Which of the following is an example of an implied power of the Congress?,regulation of interstate commerce,borrowing money on the credit of the United States,oversight of executive branch agencies,declarations of war,C,[],[],[],[],[],[],-,False
high_school_government_and_politics/test/91,high_school_government_and_politics,Social Sciences,Filibusters are less likely to occur in the House of Representatives than in the Senate because,Senate decorum forbids one senator from attempting to stop another's speech,the House meets for substantially fewer hours per day than does the Senate,"Senate sessions, unlike House sessions, are open to the public",debate in the House is in most instances strictly regulated by the rules,D,[],[],[],[],[],[],-,False
high_school_government_and_politics/test/92,high_school_government_and_politics,Social Sciences,"When the Democratic Party pursues liberal social policies, it is most likely to alienate which of its traditional bases?",People holding advanced academic degrees,Northeastern city dwellers,Southerners,Jewish Americans,C,[],[],[],[],[],[],-,False
high_school_government_and_politics/test/94,high_school_government_and_politics,Social Sciences,Which of the following is NOT a way in which the powers of the executive branch are balanced by the legislative branch?,The Senate may use the filibuster to block an executive order.,"Congress may impeach and convict a president for ""high crime and misdemeanors.""",The Senate can decline to ratify a treaty.,The Senate can decline to approve a president's nominee for the Supreme Court.,A,[],[],[],[],[],[],-,False
high_school_government_and_politics/test/98,high_school_government_and_politics,Social Sciences,Which of the following statements about voting populations is most accurate?,Individuals are less likely to vote in a closely contested race.,Voters are more likely to vote at age 18 than they are at age 65.,An individual with a graduate degree is more likely to vote than an individual who has only a high school diploma.,Affluent individuals are less likely to vote than impoverished individuals.,C,[],[],[],[],[],[],-,False
high_school_government_and_politics/test/100,high_school_government_and_politics,Social Sciences,"Which of the following best describes the practice of ""ticket splitting""?",A presidential nominee selects a running mate who can appeal to voter groups whose support of the nominee is weak.,"A voter chooses the presidential nominee of one major party, but chooses congressional nominees of the other major party.",A mayor orders the local police force to hand out fewer parking violations in the weeks leading up to the general election.,A delegate to a national party convention supports the front-runner but remains uncommitted on the party platform.,B,[],[],[],[],[],[],-,False
high_school_government_and_politics/test/101,high_school_government_and_politics,Social Sciences,Which of the following is the most direct result of an electoral system with single-member districts?,Proliferation of many small parties,A balance of power that favors the president over Congress,A persistent third-party presence,Development of a two-party system,D,[],[],[],[],[],[],-,False
high_school_government_and_politics/test/105,high_school_government_and_politics,Social Sciences,Under which of the following circumstances does a president usually experience a reduction in political power? I. The president is in the final two years of his or her second term II. The number and severity of international crises is increasing III. Different parties control Congress and the White House IV. The economy is strong and the president's approval ratings are high,I only,I and II only,I and III only,II and III only,C,[],[],[],[],[],[],-,False
high_school_government_and_politics/test/106,high_school_government_and_politics,Social Sciences,Which of the following is LEAST likely to explain low voter turnout for an election?,The preclearance provision of the Voting Rights Act,Low levels of political efficacy among registered voters,Regulations that require voters to show identification,The frequency with which state and local elections occur,A,[],[],[],[],[],[],-,False
high_school_government_and_politics/test/112,high_school_government_and_politics,Social Sciences,Which of the following best describes the fate of most popular third-party movements?,They displace one of the two major parties and become major parties themselves.,They are ultimately abandoned by the public because their politics are perceived as too radical.,Their supporters become frustrated and withdraw from the political process.,They disintegrate when one or both of the major parties adopt the third party's goals.,D,[],[],[],[],[],[],-,False
high_school_government_and_politics/test/115,high_school_government_and_politics,Social Sciences,"The No Child Left Behind Act, which established educational standards that states must meet to receive federal educational funding, is an example of which of the following?",A federal mandate,A constitutional amendment,Affirmative action,Tort reform,A,[],[],[],[],[],[],-,False
high_school_government_and_politics/test/119,high_school_government_and_politics,Social Sciences,Which of the following presidential powers is shared with the Senate?,Deploying troops,Drafting appropriations bills,Negotiating treaties,Forcing Congress into session,C,[],[],[],[],[],[],-,False
high_school_government_and_politics/test/120,high_school_government_and_politics,Social Sciences,Which of the following is a significant difference between the Senate and the House of Representatives?,Only the House has the power to issue subpoenas.,Only the Senate may introduce revenue bills.,"States are equally represented in the House, while representation in the Senate is proportional to population.","The Senate allows unlimited debate, while the House does not.",D,[],[],[],[],[],[],-,False
high_school_government_and_politics/test/122,high_school_government_and_politics,Social Sciences,All of the following are ways in which lobbyists attempt to persuade legislators EXCEPT,distributing propaganda to media,endorsing candidates for office,socializing with government officials,acquiring corporate campaign donations for candidates,D,[],[],[],[],[],[],-,False
high_school_government_and_politics/test/123,high_school_government_and_politics,Social Sciences,All of the following are consequences of low voter turnout in the United States EXCEPT,a perception of the government as illegitimate,a lack of true democracy,a lack of minority representation,an imposition of a fine on non-voters,D,[],[],[],[],[],[],-,False
high_school_government_and_politics/test/124,high_school_government_and_politics,Social Sciences,Which of the following statements is true regarding delegates to presidential nomination conventions?,Delegates are generally more likely to register as third party voters at some point.,The majority of the general population is more educated than the delegates.,Delegates typically have little interest in politics.,"Typically, the general population is less ideological than the delegates.",D,"['none', 'none', 'regional', 'regional', 'none', 'regional']","['No', 'No', 'Yes', 'No', 'No', 'No']","['-', '-', '-', '-', '-', '-']","['Western Culture', 'Western Culture']",['North America'],"['United States of America (USA)', 'United States of America (USA)']",CS,True
high_school_government_and_politics/test/125,high_school_government_and_politics,Social Sciences,All of the following are specifically mentioned in the Constitution EXCEPT,judicial review,the national census,rules of impeachment,the State of the Union address,A,[],[],[],[],[],[],-,False
high_school_government_and_politics/test/126,high_school_government_and_politics,Social Sciences,Which of the following is true of the Supreme Court?,Every case appealed to the Supreme Court is ruled upon by the court.,The court helps set the public agenda by deciding which appeals to hear.,The court hears all cases when two or more justices agree that the case has merit.,"In deciding cases, the chief justice's vote counts as two votes.",B,"['none', 'regional', 'regional', 'none']","['No', 'No', 'No', 'No']","['-', '-', '-', '-']",['Western Culture'],['North America'],"['United States of America (USA)', 'United States of America (USA)']",CS,True
high_school_government_and_politics/test/127,high_school_government_and_politics,Social Sciences,"While best known for protecting freedom of speech and religion, the First Amendment also protects Americans' right to",due process of the law in any criminal case,retain personal property unless justly compensated by the government,not be subjected to excessive fines or unusual punishment,petition the government for a redress of grievances,D,[],[],[],[],[],[],-,False
high_school_government_and_politics/test/128,high_school_government_and_politics,Social Sciences,The Voting Rights Act of 1965 has had which of the following effects?,States have been prohibited from establishing voter identification requirements.,Voters must now pass literacy tests before voting.,Voting participation for racial minority voters has increased.,The voting age was lowered from 21 to 18.,C,[],[],[],[],[],[],-,False
high_school_government_and_politics/test/131,high_school_government_and_politics,Social Sciences,Which of the following does NOT appear in the Constitution?,The electoral college,Political parties,Separation of powers,The term length for members of Congress,B,"['regional', 'regional', 'regional', 'regional', 'regional']","['No', 'No', 'No', 'No', 'No']","[{'end': 58, 'label': 'Geographic', 'score': None, 'start': 46}, {'end': 58, 'label': 'Geographic', 'score': None, 'start': 46}, {'end': 59, 'label': 'Geographic', 'score': None, 'start': 46}, {'end': 58, 'label': 'Geographic', 'score': None, 'start': 46}, {'end': 58, 'label': 'Geographic', 'score': None, 'start': 42}]",['Western Culture'],"['North America', 'North America']","['United States of America (USA)', 'United States of America (USA)', 'United States of America (USA)', 'United States of America (USA)']",CS,True
high_school_government_and_politics/test/132,high_school_government_and_politics,Social Sciences,"Which of the following constitutional principles might be violated if the Environmental Protection Agency issued, enforced, and adjudicated all disputes regarding a new regulation?",Vertical federalism,Due process of law,Comity,Separation of powers,D,"['regional', 'regional', 'regional']","['No', 'No', 'No']","[{'end': 105, 'label': 'Geographic', 'score': None, 'start': 74}, {'end': 48, 'label': 'Geographic', 'score': None, 'start': 23}, '-', '-']",['Western Culture'],"['North America', 'North America']","['United States of America (USA)', 'United States of America (USA)', 'United States of America (USA)']",CS,True
high_school_government_and_politics/test/133,high_school_government_and_politics,Social Sciences,Which of the following correctly states the relationship between the federal and state judiciaries?,Federal courts are higher courts than state courts and may overturn state decisions on any grounds.,"The two are entirely autonomous, and neither ever hears cases that originate in the other.","The two are generally autonomous, although federal courts may rule on the constitutionality of state court decisions.",State courts are trial courts; federal courts are appeals courts.,C,[],[],[],[],[],[],-,False
high_school_government_and_politics/test/136,high_school_government_and_politics,Social Sciences,Which of the following is true of federal judges?,They serve four-year terms that coincide with the presidential term.,They are appointed for life and can only be removed by impeachment.,They are elected by Congress and serve ten-year terms.,They are appointed for life and cannot be removed from office.,B,"['regional', 'regional', 'regional', 'regional', 'cultural', 'regional', 'cultural']","['No', 'No', 'No', 'No', 'No', 'No', 'No']","['-', '-', '-', '-', '-', '-', '-']","['Western Culture', 'Western Culture']","['North America', 'North America']",['United States of America (USA)'],CS,True
high_school_government_and_politics/test/138,high_school_government_and_politics,Social Sciences,Which of the following is true of congressional redistricting?,The responsibility for redrawing congressional districts belongs to congressional committees.,It is a noncontroversial process because it has few political ramifications.,It occurs every 10 years to reflect changes in population according to the census.,The Supreme Court has ruled that legislators may not consider racial demographics when redrawing districts.,C,[],[],[],[],[],[],-,False
high_school_government_and_politics/test/139,high_school_government_and_politics,Social Sciences,Which of the following most accurately describes The Federalist Papers?,"The Federalist party platform during the presidency of John Adams, the first Federalist president",A popular anti-British booklet of the pre-Revolutionary era,A collection of essays arguing the merits of the Constitution,A series of congressional acts defining the relationship between the federal and state governments,C,"['regional', 'regional', 'regional', 'regional']","['No', 'No', 'No', 'No']","[{'end': 70, 'label': 'Geographic', 'score': None, 'start': 49}, {'end': 70, 'label': 'Geographic', 'score': None, 'start': 49}, {'end': 70, 'label': 'Cultural', 'score': None, 'start': 49}, {'end': 70, 'label': 'Geographic', 'score': None, 'start': 49}]",['Western Culture'],"['North America', 'North America']","['United States of America (USA)', 'United States of America (USA)', 'United States of America (USA)', 'United States of America (USA)']",CS,True
high_school_government_and_politics/test/140,high_school_government_and_politics,Social Sciences,Which of the following is true of court cases in which one private party is suing another?,They are tried in civil court.,The federal court system has exclusive jurisdiction over them.,They are tried in criminal court.,The state court system has exclusive jurisdiction over them.,A,[],[],[],[],[],[],-,False
high_school_government_and_politics/test/141,high_school_government_and_politics,Social Sciences,Which of the following statements about political action committees (PACs) is most accurate?,"They may only campaign for issues, not for individual candidates",Their activities are not regulated by the Federal Election Commission (FEC),Their activities are limited to national presidential elections,"They raise money to influence federal, state, and local elections",D,[],[],[],[],[],[],-,False
high_school_government_and_politics/test/143,high_school_government_and_politics,Social Sciences,"In which of the following cases did the Supreme Court decision establish the ""separate but equal"" doctrine of state-sponsored racial segregation?",Plessy v. Ferguson,McCulloch v. Maryland,Gibbons v. Ogden,Brown v. Board of Education,A,[],[],[],[],[],[],-,False
high_school_government_and_politics/test/144,high_school_government_and_politics,Social Sciences,Which of the following categories of spending are paid without an appropriations bill?,Department of Education special acts and authorizations,Justice department budgets,Federal budget entitlements,Department of Defense funding,C,[],[],[],[],[],[],-,False
high_school_government_and_politics/test/148,high_school_government_and_politics,Social Sciences,All of the following are true under the system of checks and balances EXCEPT,the president's nominees must be approved by the Senate before taking office,two-thirds of the Senate must approve presidentially negotiated treaties,the president can override a congressional veto and pass laws,Congress can override a presidential veto,C,[],[],[],[],[],[],-,False
high_school_government_and_politics/test/149,high_school_government_and_politics,Social Sciences,The Supreme Court case Regents of University of California v. Bakke concerned which of the following issues?,The rights of students to protest on a publicly funded campus,In-class prayer at a publicly funded school,The rights of students to carry concealed weapons on campus,The use of racial quotas in public university admissions,D,[],[],[],[],[],[],-,False
high_school_government_and_politics/test/154,high_school_government_and_politics,Social Sciences,"According to Brown v. Board of Education (1954), which of the following amendments was violated by the ""separate but equal"" doctrine that had been established in Plessy v. Ferguson (1896)?",First Amendment,Sixth Amendment,Ninth Amendment,Fourteenth Amendment,D,[],[],[],[],[],[],-,False
high_school_government_and_politics/test/156,high_school_government_and_politics,Social Sciences,All of the following statements about Congress are true EXCEPT:,Only Congress can pass laws.,A proposed amendment must be approved by two-thirds of the delegates in both houses of Congress.,Congress can override a presidential veto if two-thirds of the House and Senate agree to do so.,Congressional power over the bureaucracy is less than that of the president.,D,"['regional', 'regional', 'regional', 'regional']","['Yes', 'No', 'No', 'No']","[{'end': 46, 'label': 'Geographic', 'score': None, 'start': 38}, {'end': 46, 'label': 'Geographic', 'score': None, 'start': 38}, '-', '-']",['Western Culture'],['North America'],"['United States of America (USA)', 'United States of America (USA)', 'United States of America (USA)']",CS,True
high_school_government_and_politics/test/158,high_school_government_and_politics,Social Sciences,Which of the following most accurately states the impact of the Civil Rights Act of 1964 on school desegregation in the South?,"Because it included no enforcement provisions, the Civil Rights Act of 1964 had no appreciable effect on school desegregation.","By overturning the ""separate but equal"" principle, the Civil Rights Act of 1964 ended segregation in public schools.",The Civil Rights Act of 1964 hastened school desegregation by cutting off federal funds to discriminatory school systems.,The Civil Rights Act of 1964 sent federal troops to every segregated public school in the South to force school desegregation.,C,[],[],[],[],[],[],-,False
high_school_government_and_politics/test/160,high_school_government_and_politics,Social Sciences,Which of the following statements best characterizes cooperative federalism?,The executive and legislative branches working on legislation together,The federal government granting power over a policy area to the states,Governments working with businesses to address an issue,State and federal governments working on the same issue,D,[],[],[],[],[],[],-,False
high_school_government_and_politics/test/162,high_school_government_and_politics,Social Sciences,Which of the following is not a special position held by a member of Congress?,President pro tempore,Speaker of the House,Congressional Management Foundation Chair,Minority Whip,C,"['regional', 'regional', 'regional', 'regional']","['No', 'No', 'Yes', 'No']","[{'end': 77, 'label': 'Geographic', 'score': None, 'start': 69}, {'end': 77, 'label': 'Geographic', 'score': None, 'start': 69}, {'end': 77, 'label': 'Geographic', 'score': None, 'start': 69}, {'end': 77, 'label': 'Geographic', 'score': None, 'start': 59}]",[],"['North America', 'North America']","['United States of America (USA)', 'United States of America (USA)', 'United States of America (USA)', 'United States of America (USA)']",CS,True
high_school_government_and_politics/test/163,high_school_government_and_politics,Social Sciences,All of the following statements concerning the likelihood that a person will vote are true EXCEPT:,"When there is a strong front-runner in a state, people in that state are less likely to vote.","White-collar workers are more likely to vote than are blue-collar workers, with the exception of blue-collar workers who belong to unions.",Voters who are registered as independent are less likely to vote than those who are registered Democrats or Republicans.,There is no difference in the likelihood of voting among those with undergraduate degrees and those with postgraduate degrees.,D,[],[],[],[],[],[],-,False
