sample_id,subject,subject_category,question,option_a,option_b,option_c,option_d,answer,required_knowledge,time_sensitive,reference,culture,region,country,cultural_sensitivity_label,is_annotated
logical_fallacies/test/3,logical_fallacies,Humanities,The false analogy fallacy is,a specific type of false cause fallacy that argues that since two event happened at the same time one event must have caused the other,arguing that an event that preceded another event necessarily is the cause of the second event,arguing that since something is new it is necessarily good,drawing a conclusion based on a comparison when the items being compared are not similar enough to support the conclusion.,D,[],[],[],[],[],[],-,False
logical_fallacies/test/5,logical_fallacies,Humanities,Arguing that what is true of an entire object is also true of each part of that object is the fallacy of,false criteria,hasty generalization,ad crumenam,division,D,"['cultural', 'none', 'none', 'none']","['No', 'No', 'No', 'No']","['-', '-', '-', '-']",['Western Culture'],[],[],CA,True
logical_fallacies/test/11,logical_fallacies,Humanities,"Polonius in William Shakespeare's Hamlet: ""Your noble son is mad: Mad call I it, for to define true madness, What is't but to be nothing else but mad?""",Attacking the Person (ad hominem),Equivocation,Begging the Question,Appeal to Pity,C,"['none', 'none', 'cultural', 'none']","['No', 'No', 'No', 'No']","['-', '-', '-', '-']",['Western Culture'],[],['United Kingdom (UK)'],CA,True
logical_fallacies/test/15,logical_fallacies,Humanities,Arguing that a claim must be true merely because a substantial number of people believe it is called the fallacy of...,Tu quoque,Composition,Appeal to the masses,Appeal to reason,C,[],[],[],[],[],[],-,False
logical_fallacies/test/26,logical_fallacies,Humanities,"I don't know what the answer is to number 8. But Heather hasn't made the third option into the correct answer for a while, and even then only once, so I'm guessing that this is the fallacy of Composition!",Gambler's Fallacy,Equivocation,Fallacy of Composition,Appeal to Pity,A,[],[],[],[],[],[],-,False
logical_fallacies/test/31,logical_fallacies,Humanities,Another name for the fallacy of false dilemma is,Guilt by association,Circular reasoning,Laudatory personality,False dichotomy,D,[],[],[],[],[],[],-,False
logical_fallacies/test/86,logical_fallacies,Humanities,The false sign fallacy is,arguing that what is true of part of an object is necessarily true of the entire object,arguing that two things are similar enough that what is true of one is true of the other,arguing that since something is inexpensive it is necessarily of low quality,reasoning by sign when there is really not a direct relationship between the alleged sign and the subject of the argument,D,[],[],[],[],[],[],-,False
logical_fallacies/test/129,logical_fallacies,Humanities,False analogy is another name for which fallacy?,Over generalization,Composition,Concomitant variation,Imperfect analogy,D,"['cultural', 'none', 'none', 'none', 'regional']","['No', 'No', 'No', 'No', 'No']","['-', '-', '-', '-', '-']",['Western Culture'],['North America'],[],CA,True
logical_fallacies/test/143,logical_fallacies,Humanities,The false cause fallacy is,arguing that since someone is poor she must have high moral character,arguing that two things are causally related without evidence of a causal relationship,arguing that since something is new it is necessarily bad,substituting individual stories for a larger sample in support of a claim,B,"['none', 'cultural', 'none', 'cultural']","['No', 'No', 'No', 'No']","['-', '-', '-', '-']","['Western Culture', 'Western Culture']",[],[],CS,True
