sample_id,subject,subject_category,question,option_a,option_b,option_c,option_d,answer,required_knowledge,time_sensitive,reference,culture,region,country,cultural_sensitivity_label,is_annotated
nutrition/test/149,nutrition,Medical,"Which of these factors is associated with an increase in the risk for prostate cancer?
",Insulin-like growth factor-1,Dietary fat,Alcohol,Salt,A,[],[],[],[],[],[],-,False
nutrition/test/152,nutrition,Medical,"What is the basic functional unit of skeletal muscle tissue?
",the muscle fibre,the sarcomere,the myofibril,the sarcoplasmic reticulum,B,[],[],[],[],[],[],-,False
nutrition/test/155,nutrition,Medical,"What are histones?
",Lipids,Carbohydrates,Nucleotides,Proteins,D,[],[],[],[],[],[],-,False
nutrition/test/157,nutrition,Medical,"Alcohol is a major risk factor for cancer development. Which alcohol metabolite plays a prominent role in cancer development?
",fatty acid ethyl esters (FAEE),acetate,acetaldehyde,alcohol,C,"['none', 'none', 'none', 'none']","['No', 'No', 'No', 'No']","['-', '-', '-', '-']",[],[],[],CA,True
nutrition/test/158,nutrition,Medical,"The body mass index (BMI) of vegetarians differs on average from meat-eaters by how much?
",3 units of BMI,0.5 units of BMI,1 unit of BMI,2 units of BMI,C,[],[],[],[],[],[],-,False
nutrition/test/160,nutrition,Medical,"Cholesterol and fatty acids absorbed from the intestinal lumen are packaged into which types of lipoproteins and secreted from the enterocytes into the lymph?
",Chylomicrons and HDL,Chylomicrons and VLDL,HDL and LDL,VLDL and HDL,A,[],[],[],[],[],[],-,False
nutrition/test/164,nutrition,Medical,"The intake of which minerals is not affected by high intakes of foods containing phytic acid?
",Calcium,Potassium,Zinc,Iron,B,[],[],[],[],[],[],-,False
nutrition/test/170,nutrition,Medical,"What dietary pattern shows most promise in preventing age related cognitive decline
",The Western diet,The Mediterranean diet,Neither,Both,B,[],[],[],[],[],[],-,False
nutrition/test/171,nutrition,Medical,"What enzyme is responsible for copying methylation marks from the parental to the daughter strand of DNA during replication?
",DNMT1,DNMT3a,DNMT3b,DNMT3L,A,[],[],[],[],[],[],-,False
nutrition/test/172,nutrition,Medical,"What is the worldwide prevalence of obesity?
",11%,13%,15%,39%,B,[],[],[],[],[],[],-,False
nutrition/test/173,nutrition,Medical,"Lactose
",Is always the cause of milk intolerance,Cannot be digested in the human gut,Intolerance is present in up to 20% of the population,Is excluded on a low FODMAP diet,D,[],[],[],[],[],[],-,False
nutrition/test/174,nutrition,Medical,"How many stages within the food supply chain can food availability and consumption be measured?
",10,5,2,4,B,[],[],[],[],[],[],-,False
nutrition/test/176,nutrition,Medical,"The vitamins which are lost most readily during cooking are:
",vitamin E and niacin,vitamin D and vitamin E,riboflavin and vitamin C,vitamin C and thiamin,D,[],[],[],[],[],[],-,False
nutrition/test/177,nutrition,Medical,"Doses of substances used in animal toxicity studies are usually many times greater than those experienced by people because:
",Animals are generally much less sensitive than people,Such tests can detect only very large risks because of the fact that only small numbers of animals can be used,It is difficult in such studies to determine whether the observed toxic effects were caused by the substance,It is the only way to ensure results are applicable to people,B,[],[],[],[],[],[],-,False
nutrition/test/178,nutrition,Medical,"Risk management for chemical contaminants of food generally relies on:
",Banning of the contaminant from food,Allowing levels of contamination based on what manufacturers believe is achievable,Banning any food found to contain detectable amounts of the contaminants,Prohibiting the introduction into commerce food containing contaminants at levels greater than a specified level (a risk-based MRL or tolerance),D,[],[],[],[],[],[],-,False
nutrition/test/179,nutrition,Medical,"The effects of iron on certain aspects of socio-emotional development (shyness, orientation/engagement and response to unfamiliar pictures) is due to:
",The role of iron in myelination,The role of iron in neurochemistry,The role of iron in dopamine production,None of the above,C,[],[],[],[],[],[],-,False
nutrition/test/180,nutrition,Medical,"Insulin deficiency is associated with
",Reduced lipolysis,Increased ketogenesis,Reduced gluconeogenesis,Reduced proteolysis,B,[],[],[],[],[],[],-,False
nutrition/test/182,nutrition,Medical,"On an average daily basis, the gross energy intake of a healthy woman is 9279 kJ, the energy content of her faeces and urine are 647 kJ and 318 kJ, respectively. Her average daily digestible energy intake and metabolisable energy intake would be, respectively,:
",647 kJ and 318 kJ,9279-318 kJ and 9279-647 kJ,9279+318 kJ and 9279+647 kJ,9279-647 kJ and 9279-(647+318) kJ,D,[],[],[],[],[],[],-,False
nutrition/test/183,nutrition,Medical,"When epidemiologists judge the evidence to establish possible causes of a health outcome, they consider
",The estimated strength of the association between an exposure and the outcome.,Evidence that the exposure of interest has appeared before the outcome.,Evidence showing that reductions in the exposure level will reverse the risk of the outcome.,All of the options given.,D,[],[],[],[],[],[],-,False
nutrition/test/184,nutrition,Medical,"Women who are planning a pregnancy are recommended to take a supplement of 400ìg folic acid/ day before and until the end of the first trimester of pregnancy. What effect does such supplementation have on methylation of the imprinted gene IGF2 in the resulting children?
",No effect.,Methylation of IGF2 is increased.,Methylation of IGF2 is decreased.,The effect depends on whether the child is male or female.,B,[],[],[],[],[],[],-,False
nutrition/test/185,nutrition,Medical,"Occasionally infants are born without a normally functioning immune system. What are the signs most suggestive of a severe combined immunodeficiency?
",Recurrent severe infections,Family history of unexplained death in infancy,Generalised spread of the Tuberculosis strain BCG after vaccination,All of the options given are correct,D,[],[],[],[],[],[],-,False
nutrition/test/186,nutrition,Medical,"Fibre supplements
",May be helpful in diverticular disease,Are always easily fermented by colonic bacteria,Are usually derived from soluble fibre sources,Should be avoided in constipation,A,[],[],[],[],[],[],-,False
nutrition/test/187,nutrition,Medical,"Which life-style factors do not confound the interpretation of the health of vegetarians compared with meat-eaters?
",Smoking habit,Social class/position,Physical activity,Age,D,"['none', 'none', 'none', 'none']","['No', 'No', 'No', 'No']","['-', '-', '-', '-']",[],[],[],CA,True
nutrition/test/192,nutrition,Medical,"What difference will urbanisation make for hunger and malnutrition?
",No significant difference; low-income urban and rural people face similar constraints in accessing food and consume similar diets in developing countries.,It will reduce poverty and hunger because these are almost entirely concentrated in rural areas.,"Urban dwellers depend more than rural people on purchases to acquire food, have little opportunity to grow their own food, and so are much more vulnerable to food price increases.","Poor city folk eat mainly sorghum, millet, maize and root crops, so a lot more of those foods will need to be produced as the world urbanises.",C,[],[],[],[],[],[],-,False
nutrition/test/193,nutrition,Medical,"Which membrane fatty acids are precursors for eicosanoids?
",C20 and C22 saturated fatty acids,C18 and C22 polyunsaturated fatty acids,C20 and C22 monounsaturated fatty acids,C20 and C22 polyunsaturated fatty acids,D,"['none', 'none', 'none', 'none', 'none']","['No', 'No', 'No', 'No', 'No']","['-', '-', '-', '-', '-']",[],[],[],CA,True
nutrition/test/195,nutrition,Medical,"The most direct method for measuring body composition is:
",underwater weighing,Skinfold test,Body mass index,weight,A,[],[],[],[],[],[],-,False
nutrition/test/196,nutrition,Medical,"What type of diet is recommended for weight maintenance?
",Low protein and low GI,High protein and high GI,Low protein and high GI,High protein and low GI,D,[],[],[],[],[],[],-,False
nutrition/test/197,nutrition,Medical,"The Worldwide HIV/AIDS campaigns have made significant progress over the last years. The HIV infection rates in Europe
",Have been significantly decreasing,Have been unchanged,Have been increasing,Are unknown,B,[],[],[],[],[],[],-,False
nutrition/test/198,nutrition,Medical,"For certain micronutrients, 'biochemical functional indices' have been developed, to assess the adequacy of one or more biochemical pathways that respond predictably to changes in status of that specific micronutrient. One example is serum methylmalonic acid as a biochemical functional index for vitamin B12 status. What is the primary aim of such biochemical functional index measurements?
",To achieve a better estimate of the dietary intake of the micronutrient.,"To overcome interference, eg by acute phase-linked effects.","To correct for nutrient losses, e.g. through urinary excretion.","To provide an additional status estimate that can probe critical tissue adequacy, and hence the risk of consequent clinical disease or physiological malfunction.",D,[],[],[],[],[],[],-,False
nutrition/test/200,nutrition,Medical,"All babies lose weight after birth, you should be concerned when:
",Weight loss is 5%,Weight loss is < than 10%,Birth weight is not regained by day 7,Weight loss in > than 10% or birth weight is not regained by day 14,D,[],[],[],[],[],[],-,False
nutrition/test/202,nutrition,Medical,"Risk assessment is applied to data on toxicity and human exposure to:
","Estimate the likelihood, or probability, of a toxic effect on exposed humans",To support risk management decisions for food substances,To derive Allowable Daily Intakes,All of the above,A,[],[],[],[],[],[],-,False
nutrition/test/203,nutrition,Medical,"What is the typical body composition of a normal weight young adult man?
","Fat = 17%, Fat Free Mass=83%, Intracellular Fluid= 40%, Extracellular Fluid= 20%","Fat = 83%, Fat Free Mass=40%, Intracellular Fluid= 17%, Extracellular Fluid= 20%","Fat = 20%, Fat Free Mass=17%, Intracellular Fluid= 40%, Extracellular Fluid= 83%","Fat = 40%, Fat Free Mass=20%, Intracellular Fluid= 17%, Extracellular Fluid= 83%",A,[],[],[],[],[],[],-,False
nutrition/test/204,nutrition,Medical,"The critical pH below which demineralisation of tooth enamel occurs is usually around:
",6,5.7,5.5,5,C,[],[],[],[],[],[],-,False
nutrition/test/205,nutrition,Medical,"The supplementation of diet with which fat soluble vitamins has been shown to reduce cardiovascular disease?
",Vitamin A and D,Vitamin A and K,Vitamin D and E,None of the above,D,[],[],[],[],[],[],-,False
nutrition/test/206,nutrition,Medical,"Vitamin D deficiency can often be found as a single nutrient deficiency, that is, in an otherwise well-nourished person. The main reason this can happen is because:
",Foods containing large amounts of vitamin D are eaten by both poor and wealthy people according to various cultural reasons.,The content of vitamin D in foods depends on the soil in which the food was grown so is not related to wealth or age.,Most vitamin D in the body does not come from food so access to food is not an important determinant of vitamin D status.,Diets containing sufficient other nutrients to promote growth can increase the requirement of vitamin D so that it becomes limiting.,C,[],[],[],[],[],[],-,False
nutrition/test/209,nutrition,Medical,"Current recommendations are that:
",All babies should be exclusively breastfed until around 6 months,Solids should be introduced at 4 months of age,Cow's milk is appropriate for all children from 6 months,Bottle feeding is more appropriate for babies than breast feeding,A,"['cultural', 'regional', 'cultural', 'cultural', 'regional']","['Yes', 'No', 'Yes', 'No', 'Yes']","['-', '-', '-', '-', '-']",['Western Culture'],[],[],CS,True
nutrition/test/210,nutrition,Medical,"Food allergies:
",Are avoidable if the allergic agents are not allowed to exceed specified limits,Are a form of food intolerance,Usually occur only after an individual has been sensitized by prior exposure,Are uncomfortable but generally of little medical concern,C,[],[],[],[],[],[],-,False
nutrition/test/213,nutrition,Medical,"What is meant by the term 'functional isolation'?
",A child that is only developing one single function at the time,A child that is isolated from proper nutrition and therefore not developing adequately,"A malnourished, apathetic child that is not receiving the same stimulation from the environment affecting his/her development negatively",None of the above,C,[],[],[],[],[],[],-,False
nutrition/test/215,nutrition,Medical,"What is the prevalence of alcoholic myopathy in alcoholics
",30 to 50%,40 to 60%,20 to 40%,10 to 30%,B,[],[],[],[],[],[],-,False
nutrition/test/216,nutrition,Medical,"Molecules of natural polyunsaturated fatty acids in vegetable oils contain:
",18 carbon atoms with one carbon-carbon double bond in the cis configuration,20 carbon atoms with at least two carbon-carbon double bonds in the cis configuration,18 carbon atoms with at least two carbon-carbon double bonds in the trans configuration,18 carbon atoms with at least two carbon-carbon double bonds in the cis configuration,D,[],[],[],[],[],[],-,False
nutrition/test/219,nutrition,Medical,"The WHO made a strong recommendation that the maximum intake of free sugars by individuals within populations should be
",<5%,5-10%,<10%,>10%,C,[],[],[],[],[],[],-,False
nutrition/test/220,nutrition,Medical,"Rickets of prematurity is associated with:
",Hypocalcaemic convulsions,Use of frusemide diuretic,Vitamin D deficiency in the mother,All of the options given are correct,D,"['none', 'none', 'none', 'none']","['No', 'No', 'No', 'No']","['-', '-', '-', '-']",[],[],[],CA,True
nutrition/test/223,nutrition,Medical,"Since the 1996 World Food Summit, how has the number of food insecure people in the world changed?
",The Summit's goal of cutting the number of hungry people in half by 2015 was achieved.,"The number decreased, but not by nearly enough to meet the Summit's goal.",The number increased slightly.,"Because of rising food prices, the number increased dramatically.",B,"['none', 'regional', 'none']","['No', 'Yes', 'No']","['-', '-', '-', '-']",[],[],[],CA,True
nutrition/test/225,nutrition,Medical,"What caused the food-price spike of 2007-2008?
",Long-term neglect of agricultural and rural development caused the spike.,The use of food crops to produce biofuel caused food prices to rise.,It was caused by commodity price speculation.,All of the above were among the causes.,D,"['none', 'none', 'none', 'none']","['No', 'No', 'No', 'No']","['-', '-', '-', '-']",[],[],[],CA,True
nutrition/test/228,nutrition,Medical,"The risk factors for type 2 diabetes mellitus include:
",family history,being overweight,high intake of dietary fat,All of the options listed are correct,D,[],[],[],[],[],[],-,False
nutrition/test/229,nutrition,Medical,"The World Health Organization recommends zinc supplements for which groups of people?
",Pregnant and lactating women,Children with severe malnutrition or diarrhoea,All children in low income areas with high prevalence of stunting,Elderly people with low incomes,B,[],[],[],[],[],[],-,False
nutrition/test/231,nutrition,Medical,"Confounding is a particular challenge in nutritional epidemiology because
",people change their diets over time.,it is difficult to measure people's diets accurately in large studies.,the are no good methods to adjust for confounding in nutritional studies.,"different dietary components are correlated with each other, making it difficult to separate their effects.",D,"['none', 'none', 'none', 'none']","['No', 'No', 'No', 'No']","['-', '-', '-', '-']",[],[],[],CA,True
nutrition/test/232,nutrition,Medical,"Infants born to mothers who are vegan may be at increased risk of deficiency of which nutrient?
",Vitamin C,Folate,Vitamin B12,Calcium,C,"['none', 'none', 'none', 'none']","['No', 'No', 'No', 'No']","['-', '-', '-', '-']",[],[],[],CA,True
nutrition/test/236,nutrition,Medical,"Gluten
",May increase carbohydrate malabsorption,Is a constituent of avenin,Is the main protein in maize,May be contra-indicated in UC,A,"['none', 'none', 'none', 'none']","['No', 'No', 'No', 'No']","['-', '-', '-', '-']",[],[],[],CA,True
nutrition/test/237,nutrition,Medical,"Adaptive thermogenesis refers to:
",A decrease in heat loss when exposed to cold,A decrease in non-shivering thermogenesis when exposed to cold,An increase in basal metabolic rate that is not fully explained by a change in body composition during chronic overfeeding,A decrease in spontaneous physical activity during chronic overfeeding.,C,[],[],[],[],[],[],-,False
nutrition/test/239,nutrition,Medical,"Assessing growth in routine practice should be:
",Height only,Weight only,Weight and height,Head circumference,C,[],[],[],[],[],[],-,False
nutrition/test/240,nutrition,Medical,"The daily amount of protein oxidized in the body of a person spending 24 hours in a respiratory chamber can be determined from his/her:
",O2 consumption alone,CO2 production alone,Breath collection,Total urinary nitrogen excretion alone,D,[],[],[],[],[],[],-,False
nutrition/test/241,nutrition,Medical,"What is the primary lipoprotein secreted from the liver that is at least partially composed of dietary derived lipids?
",Chylomicrons,HDL,VLDL,LDL,C,[],[],[],[],[],[],-,False
nutrition/test/245,nutrition,Medical,"What are the limitations of food balance sheets? (select all that apply)?
",No account is taken of waste or losses of food,Consumption estimates give higher values than those derived from other types of surveys,No information is available on the distribution of consumption within a country,All of the options given are correct,D,[],[],[],[],[],[],-,False
nutrition/test/247,nutrition,Medical,"A deficiency of which vitamin has been associated with enamel defects and increased risk of dental caries?
",Vitamin A,Folic acid,Vitamin C,Vitamin D,D,[],[],[],[],[],[],-,False
nutrition/test/248,nutrition,Medical,"Which of these factors reduces the risk for cancer of the colorectum?
",Vitamin C,Dietary fibre,Alcohol,Oestrogen,B,[],[],[],[],[],[],-,False
nutrition/test/250,nutrition,Medical,"Which of two hormones act on the hypothalamus to increase satiety and hunger, respectively?
",Leptin and insulin,Leptin and ghrelin,Ghrelin and leptin,Ghrelin and insulin,B,"['none', 'none', 'none', 'none', 'none', 'none', 'none']","['No', 'No', 'No', 'No', 'No', 'No', 'No']","['-', '-', '-', '-', '-', '-', '-']",[],[],[],CA,True
nutrition/test/251,nutrition,Medical,"What is the phenotype of a congenital disorder impairing the secretion of leptin?
","Normal energy intake, normal body weight and hyperthyroidism","Obesity, excess energy intake, normal growth and hypoinsulinaemia","Obesity, abnormal growth, hypothyroidism, hyperinsulinaemia","Underweight, abnormal growth, hypothyroidism, hyperinsulinaemia",C,[],[],[],[],[],[],-,False
nutrition/test/252,nutrition,Medical,"What are the effects of globalisation on food security?
",Wealthy countries subsidies and trade barriers make it difficult for developing countries to take advantage of the potential of globalisation for advancing food security.,"World Trade Organisation rules do not cover agriculture, so globalisation really has no bearing on food security.",Supermarkets are so far the only way in which food and agriculture have experienced globalisation.,Developing countries need to create publicly-owned food reserves in order to realise the potential benefits.,A,"['none', 'none', 'regional', 'regional']","['No', 'No', 'No', 'No']","['-', '-', '-', '-']",[],[],[],CS,True
nutrition/test/256,nutrition,Medical,"Which of these factors increases the risk for lung cancer?
",Saturated fat,Obesity,High dose ß-carotene supplements,Alcohol,C,[],[],[],[],[],[],-,False
nutrition/test/257,nutrition,Medical,"According to the recommendations for the nutritional management of patients with diabetes, the consumption of saturated fat should be:
",<10% of total daily energy,<12%,<15%,<16%,A,[],[],[],[],[],[],-,False
nutrition/test/258,nutrition,Medical,"When using bioelectrical impedance for measuring body composition, why does an electrical current travel faster through muscle than it does through fat?
",Muscle contains less water than fat,Muscle contains more water than fat,Muscle weighs more than fat,Muscle weighs less than fat,B,[],[],[],[],[],[],-,False
nutrition/test/261,nutrition,Medical,"How many calories should a woman eat each day during pregnancy?
",Less than 200 kCal,An additional 200 kCal in the third trimester only,An additional 200 kCal throughout pregnancy,No change from pre-pregnant levels,B,[],[],[],[],[],[],-,False
nutrition/test/265,nutrition,Medical,"Deficiency of vitamin A in children causes:
",Goitre,Poor cognitive development,Poor bone growth,Increased risk of mortality,D,[],[],[],[],[],[],-,False
nutrition/test/266,nutrition,Medical,"Which of these factors increases the risk for postmenopausal breast cancer?
",Red meat,Dietary fat,Fish,Obesity,D,"['none', 'none', 'none', 'none']","['No', 'No', 'No', 'No']","['-', '-', '-', '-']",[],[],[],CA,True
nutrition/test/271,nutrition,Medical,"The thermic effect of food
",is substantially higher for carbohydrate than for protein,is accompanied by a slight decrease in body core temperature.,is partly related to sympathetic activity stimulation in the postprandial phase,is not attenuated by food malabsorption.,C,[],[],[],[],[],[],-,False
nutrition/test/272,nutrition,Medical,"What is the primary method of dietary assessment used in epidemiological studies?
",Weighed diary,Unweighed diary,24-hour recall,Food frequency questionnaire,D,[],[],[],[],[],[],-,False
nutrition/test/273,nutrition,Medical,"Calculate the body mass index (BMI) for a patient whose height is 1.75 m and whose weight is 99 kg.
",29,32,39,43,B,[],[],[],[],[],[],-,False
nutrition/test/275,nutrition,Medical,"How much dietary protein should athletes consume daily?
",<0.8 g protein per kg bodyweight per day,0.8-1.2 g protein per kg bodyweight per day,1.2-1.7 g protein per kg bodyweight per day,>2.0 g protein per kg bodyweight per day,C,[],[],[],[],[],[],-,False
nutrition/test/276,nutrition,Medical,"Which vitamins are important in lowering circulating homocysteine levels
",Vitamin D,Vitamin C,Vitamin A,"Folate, vitamins B6 and B12",D,[],[],[],[],[],[],-,False
nutrition/test/280,nutrition,Medical,"Which diseases are not less frequent among vegetarians?
",Respiratory diseases,Colorectal cancer,Ischaemic heart disease,Diverticular disease,A,[],[],[],[],[],[],-,False
nutrition/test/282,nutrition,Medical,"Although theoretically any food protein could act as a food allergen, there are eight major food allergens in Europe and North America which account for most of the allergic triggers observed in childhood. Which of the allergens pairings contains an allergen, which is not part of the group of eight major allergens?
","Cow's milk, egg","Mustard seeds, lamb,","Soy, peanuts","Fish, shellfish",B,[],[],[],[],[],[],-,False
nutrition/test/283,nutrition,Medical,"Prenatal programming:
",Explains the rise in obesity in the pre-school years,May be effected through the epigenetic effects of intrauterine nutritional inadequacy,Causes high blood pressure in young children,Only affects low birth weight children,B,[],[],[],[],[],[],-,False
nutrition/test/290,nutrition,Medical,"Which vitamin is required for vision in dim light?
",Vitamin A,Vitamin D,Vitamin E,Vitamin K,A,"['none', 'none', 'none', 'none']","['No', 'No', 'No', 'No']","['-', '-', '-', '-']",[],[],[],CA,True
nutrition/test/292,nutrition,Medical,"Additional dietary protein may:
",Increase risk of hip fracture,Decrease calcium excretion in the urine,Stimulate production of insulin-like growth hormone,Reduce muscle mass and strength,C,[],[],[],[],[],[],-,False
nutrition/test/293,nutrition,Medical,"Greater milk consumption
",Has been reported to be associated with a higher incidence of fracture and higher mortality in a few studies,During puberty seems to be associated with higher bone mineral density in later life,Is consistently associated with a lower rate of fractures,In countries with the highest rate of fracture suggests that milk consumption is beneficial to the skeleton.,A,[],[],[],[],[],[],-,False
nutrition/test/295,nutrition,Medical,"What should elite athletes ideally consume during prolonged high intensity exercise (>2.5 hours)?
",60 g glucose per hour,60 g glucose plus fructose per hour,90 g glucose per hour,90 g glucose plus fructose per hour,D,"['none', 'none', 'none', 'none', 'none', 'none', 'none']","['No', 'No', 'No', 'No', 'No', 'No', 'No']","['-', '-', '-', '-', '-', '-', '-']",[],[],[],CA,True
nutrition/test/296,nutrition,Medical,"What endogenous substrate source provides the most energy during moderate to high intensity exercise?
",Liver glycogen,Muscle glycogen,Intramuscular lipid,Adipose tissue lipid,B,[],[],[],[],[],[],-,False
nutrition/test/297,nutrition,Medical,"How does agricultural research help reduce hunger and poverty?
",Transnational private-sector firms are the main source of research oriented towards poor farmers and consumers.,Agricultural research mainly benefits commercial farmers in developed countries.,Research focused on the problems of poor farmers and consumers is a 'public good' with little profit potential but high social benefits; public investment is needed to support it.,Pro-poor research should only focus on organic farming.,C,[],[],[],[],[],[],-,False
