sample_id,subject,subject_category,question,option_a,option_b,option_c,option_d,answer,required_knowledge,time_sensitive,reference,culture,region,country,cultural_sensitivity_label,is_annotated
nutrition/test/298,nutrition,Medical,"Severe acute malnutrition in young children is defined as:
",Weight-for-age Z score <-3,Height-for-age Z score <-3 and oedema,Height-for-age Z score <-3 or weight-for-height Z score <-3 or oedema,Height-for-age Z score <-3 or weight-for-age Z score <-3 or oedema,C,[],[],[],[],[],[],-,False
nutrition/test/299,nutrition,Medical,"What are the main metabolites of alcohol metabolism?
","Acetaldehyde, acetate,","Pyruvate, beta-hydroxybutyrate,","Acetyl-CoA, lipids,","Acetone, lactate",A,"['none', 'none', 'none', 'none']","['No', 'No', 'No', 'No']","['-', '-', '-', '-']",[],[],[],CA,True
nutrition/test/301,nutrition,Medical,"Are most developing-country farmers engaged in subsistence or commercial production?
",Almost all are subsistence farmers.,"Very few engage in subsistence production, instead selling almost all of their produce on the market.",Virtually all small-scale producers are engage in some self-provisioning and market sales.,37% engage in pure subsistence production.,C,[],[],[],[],[],[],-,False
nutrition/test/304,nutrition,Medical,"From the list of oral microorganisms, which is primarily responsible for the initiation of dental caries?
",Mutans streptococci,bifidobacteria,Lactobacilli,P. gingivalis,A,[],[],[],[],[],[],-,False
