sample_id,subject,subject_category,question,option_a,option_b,option_c,option_d,answer,required_knowledge,time_sensitive,reference,culture,region,country,cultural_sensitivity_label,is_annotated
nutrition/test/0,nutrition,Medical,"Which foods tend to be consumed in lower quantities in Wales and Scotland (as of 2020)?
",Meat,Confectionary,Fruits and vegetables,Potatoes,C,[],[],[],[],[],[],-,False
nutrition/test/3,nutrition,Medical,"What are the main causes of the obesity epidemic?
",Increased energy quantity/density and a more sedentary life-style,Decreased leisure time activity,Changes in genetic profiles,None of the options given is correct,A,[],[],[],[],[],[],-,False
nutrition/test/4,nutrition,Medical,"Which vitamin is a major lipid-soluble antioxidant in cell membranes?
",Vitamin A,Vitamin D,Vitamin E,Vitamin K,C,[],[],[],[],[],[],-,False
nutrition/test/6,nutrition,Medical,"Obesity increases the risk of endometrial cancer. Which hormone is thought to mediate this effect?
",Testosterone,Oestrogen,Insulin-like growth factor-1,Thyroxine,B,"['none', 'none', 'none', 'none']","['No', 'No', 'No', 'No']","['-', '-', '-', '-']",[],[],[],CA,True
nutrition/test/7,nutrition,Medical,"Which vitamin is required for calcium absorption from the small intestine?
",Vitamin A,Vitamin D,Vitamin E,Vitamin K,B,[],[],[],[],[],[],-,False
nutrition/test/10,nutrition,Medical,"A food additive is considered to be safe when:
",No evidence of human toxicity has been observed over the period of its use,Estimated Daily Intake (EDI) from its presence in food is less than its ADI,Its toxic effects are observed only at doses 100x the EDI,Its benefits outweigh its risks,B,[],[],[],[],[],[],-,False
nutrition/test/12,nutrition,Medical,"What role do women play in food security?
",Their main role is preparing meals.,"They play a central role as producers of food, managers of natural resources, income earners and caretakers of household nutrition.","They weed the fields, but never plough or plant them, as only men are strong enough for those activities.",Their efforts focus mainly on vegetable gardens and chickens; men are involved with cereal crops and larger livestock.,B,[],[],[],[],[],[],-,False
nutrition/test/15,nutrition,Medical,"Which fatty acids found in plasma phospholipids are associated with reduced cardiovascular mortality?
",Palmitic acid (16:0),Long chain (=20 carbons) saturated and n-3 polyunsaturated fatty acids,á-linolenic acid (18:3),Stearic acid (18:0),B,[],[],[],[],[],[],-,False
nutrition/test/16,nutrition,Medical,"Crohn's disease:
",Always affects the colon,May lead to intestinal obstruction,Is best treated surgically,Requires a gluten free diet,B,[],[],[],[],[],[],-,False
nutrition/test/18,nutrition,Medical,"Which country has undergone the most rapid nutrition transition in the last two decades?
",China,Sweden,Britain,India,A,[],[],[],[],[],[],-,False
nutrition/test/19,nutrition,Medical,"Acute binge drinking is associated with?
",Happy heart syndrome,Home heart syndrome,Beach heart syndrome,Holiday heart syndrome,D,"['none', 'none', 'none', 'none', 'none', 'none', 'none']","['No', 'No', 'No', 'No', 'No', 'No', 'No']","['-', '-', '-', '-', '-']",[],[],[],CA,True
nutrition/test/20,nutrition,Medical,"Why are some specific indices of iron status (such as serum ferritin or transferrin receptors) generally considered to be more reliable indices of iron status, than blood haemoglobin levels are?
",Because they respond more rapidly to changes in iron levels in the diet.,"Because blood haemoglobin levels can also respond to a variety of other factors and insults, such as lead poisoning, chronic disease, etc.",Because the specific iron indices can be measured more accurately and easily.,"Because haemoglobin levels vary with subject age, and between the sexes.",B,[],[],[],[],[],[],-,False
nutrition/test/21,nutrition,Medical,"What stable isotope is commonly given for the measurement of total body water?
",Deuterium,Carbon 13,Nitrogen 15,Oxygen 18,A,[],[],[],[],[],[],-,False
nutrition/test/22,nutrition,Medical,"What are focus areas of nutritional epidemiology?
",The role of nutritional factors in causing disease in a population.,How changes in food intake in the population can promote good health.,Both of the options given are correct.,None of the options given is correct.,C,[],[],[],[],[],[],-,False
nutrition/test/25,nutrition,Medical,"Which vitamin is required for synthesis of the blood clotting proteins?
",Vitamin A,Vitamin D,Vitamin E,Vitamin K,D,[],[],[],[],[],[],-,False
nutrition/test/26,nutrition,Medical,"What the largest endogenous substrate source in the body?
",Liver glycogen,Muscle glycogen,Intramuscular lipid,Adipose tissue,D,[],[],[],[],[],[],-,False
nutrition/test/28,nutrition,Medical,"What is food security?
",It relates to efforts to prevent terrorists from poisoning food supplies.,It is about ensuring everyone's access to food.,"Its component elements include availability, utilisation, and stability, as well as access.",Food security focuses primarily on ending micronutrient malnutrition.,C,[],[],[],[],[],[],-,False
nutrition/test/33,nutrition,Medical,"It has been observed that a reduction in family size and improved sanitary condition have led to an increase in allergic conditions. The 'hygiene hypothesis' suggests that
",The frequent use of antiseptic swipes will reduce allergies,Living on a working farm will help reducing the development of atopic diseases,Particular care must be taken during breast feeding in high risk infants,Living on a working farm will increase the development of atopic diseases,B,[],[],[],[],[],[],-,False
nutrition/test/34,nutrition,Medical,"Why might some biochemical (eg plasma or serum) indices of micronutrient status give misleading results in people with infections or inflammatory states?
","Because people who are sick often alter their diets, and may eat less food.",Because the accuracy of some laboratory assays may be compromised in samples from people who are sick.,"Because some metabolic pathways are altered in sick people, which changes their micronutrient requirements.",Because an acute phase reaction results in changes in inter-tissue distributions of certain micronutrients.,D,"['none', 'none', 'none', 'none']","['No', 'No', 'No', 'No']","['-', '-', '-', '-']",[],[],[],CA,True
nutrition/test/36,nutrition,Medical,"Which of these factors increases the risk for cancer of the oesophagus?
",Processed meat,Fruit and vegetables,Salt,Alcohol,D,[],[],[],[],[],[],-,False
nutrition/test/38,nutrition,Medical,"Higher dietary sodium (salt) intake is generally associated with:
",Decreased calcium excretion in the urine,Increased risk of fracture,Decreased dietary calcium absorption,Negative calcium balance and bone mineral loss,D,[],[],[],[],[],[],-,False
nutrition/test/42,nutrition,Medical,"Which of these factors increases the risk for cancer of the stomach?
",Obesity,Sugar,Salt and salt-preserved foods,Dietary fibre,C,[],[],[],[],[],[],-,False
nutrition/test/43,nutrition,Medical,"What are the main enzyme systems for catalysing ethanol to acetaldehyde?
",Alcohol dehydrogenase (ADH),Catalase,"Alcohol dehydrogenase (ADH), cytochrome P450 2E1 (CYP2EI), catalase",cytochrome P450 2E1 (CYP2EI),C,[],[],[],[],[],[],-,False
nutrition/test/44,nutrition,Medical,"In a healthy person maintaining energy balance in equilibrium (i.e. mathematical equality of energy intake and energy expenditure) is generally achieved on a:
",day-to-day basis,2-3 day basis,3-4 day basis,1-2 week basis,D,[],[],[],[],[],[],-,False
nutrition/test/46,nutrition,Medical,"Intestinal lactase deficiency leads to lactose maldigestion which subsequently can lead to lactose intolerance, i.e. causing clinical symptoms. Infants and children normally express sufficient lactase levels as not to experience clinical symptoms. Overall, adults can be classified as lactase-persisters or lactase non-persisters. What is the approximate percentage of Lactase non-persisters worldwide?
",45%-50%,70%-75 %,10%-15%,30%-35%,B,"['none', 'none', 'none', 'none']","['No', 'No', 'No', 'No']","['-', '-', '-', '-']",[],[],[],CA,True
nutrition/test/49,nutrition,Medical,"IBS
",Is primarily a psychological problem,Is a contra-indication to colonoscopy,May be associated with constipation,always resolves with a gluten free diet.,C,[],[],[],[],[],[],-,False
nutrition/test/50,nutrition,Medical,"The gut microbes metabolize L-carnitine into which metabolite that has been shown increase cardiovascular disease?
",choline,betaine,Trimethylamine,All of the above,C,[],[],[],[],[],[],-,False
nutrition/test/52,nutrition,Medical,"Eosinophilic oesophagitis
",Leads to oesophageal diverticular,May cause oesopgageal obstruction,Is not due to allergy,Benefits from antacid therapy,B,"['none', 'none', 'none', 'none']","['No', 'No', 'No', 'No']","['-', '-', '-', '-']",[],[],[],CA,True
nutrition/test/54,nutrition,Medical,"Children who are obese should:
",Follow a different diet to the rest of the family,Eat the same and take more exercise,"Reduce their total energy intake, increase their activity level and reduce their screen time",Eat more fruit and vegetables,C,"['none', 'none', 'none', 'none']","['No', 'No', 'No', 'No']","['-', '-', '-', '-']",[],[],[],CA,True
nutrition/test/55,nutrition,Medical,"Which of the treatments below has not demonstrated efficacy in BED
",Cognitive Behavioural Therapy,"Antidepressants (Fluoxetine, Sertraline)","Antiobesity agents (Orlistat, Sibutramine)","Benzodizepines (Diazepam, Alprazolam)",D,[],[],[],[],[],[],-,False
nutrition/test/57,nutrition,Medical,"How is iron transported in the circulation from the intestine to the sites of metabolism in the body?
",As simple Fe2+ in the serum,Bound to albumin,Bound to ferritin,Bound to transferrin,D,[],[],[],[],[],[],-,False
nutrition/test/59,nutrition,Medical,"Select the single most accurate statement about the absorptive area of the human intestine?
",The absorptive area is equivalent to that of a tennis court,All of the options given are correct,Changes in motility increase the contact time between nutrients and absorptive surface,"The presence of folds, villi and microvilli on the surface of enterocytes magnifies the absorptive area",B,[],[],[],[],[],[],-,False
nutrition/test/61,nutrition,Medical,"High intake of which of these dietary components predisposes to accelerated cognitive decline
",High glycaemic index carbohydrates,A high n-6:n-3 fat ratio,Long chain saturated fats,All of the above,D,[],[],[],[],[],[],-,False
nutrition/test/65,nutrition,Medical,"What is the main source of protein in the British diet?
",Fish and fish products,Pulses,Meat and meat products,Milk and milk products,C,[],[],[],[],[],[],-,False
nutrition/test/66,nutrition,Medical,"What is leptin resistance?
",Deficiency of leptin caused by a mutation in the leptin gene,Lack of leptin release from the adipose tissue,High concentrations of leptin without reduction in energy intake,Low concentrations of leptin with increased energy intake,C,[],[],[],[],[],[],-,False
nutrition/test/67,nutrition,Medical,"The two most common causes of foodborne illness in the United States and Europe are:
",Salmonella and Campylobacter,Listeria and Salmonella,Shigella and Staphlococcus,E. coli STECs and non-STEC subtypes,A,[],[],[],[],[],[],-,False
nutrition/test/68,nutrition,Medical,"Bariatric surgery is used for obesity treatment but how much is the incidence of type 2 diabetes reduced in obese individuals after surgery?
",80-90%,No reduction in the incidence,Approximately 50 %,None of the options given is correct,A,[],[],[],[],[],[],-,False
nutrition/test/69,nutrition,Medical,"What are the disadvantages of identifying under-reporting of usual intake using the doubly labelled water technique?
",It uses a sophisticated analytical technique,It provides a marker for energy intake only,Mis-reporting of low energy content foods would not be identified,All of the options given are correct,D,[],[],[],[],[],[],-,False
nutrition/test/70,nutrition,Medical,"Facial flushing is seen in approximately 50% of East Asians and is thought to be due to a deficiency of?
",ALDH1,ALDH2,ALDH3,ALDH4,B,[],[],[],[],[],[],-,False
nutrition/test/73,nutrition,Medical,"Ulcerative Colitis
",Carries a risk of colonic cancer,Can be treated with a LOFFLEX diet,Can be caused by small intestinal bacterial overgrowth,Can be caused by milk intolerance,A,[],[],[],[],[],[],-,False
nutrition/test/74,nutrition,Medical,"What characteristic is not representative of a type IIb muscle fibre?
",Low oxidative capacity,High fatigue resistance,High motor unit strength,Fast contractile speed,B,[],[],[],[],[],[],-,False
nutrition/test/76,nutrition,Medical,"Intestinal failiure:
",Always requires parenteral nutritional suport,May follow colectomy,Is always permanent,May benefit from sodium supplementation of >=90mmol/l,D,[],[],[],[],[],[],-,False
nutrition/test/79,nutrition,Medical,"Oral bacterial synthesise extracellular glucans (dextran and mutan) from which host dietary component?
",glucose,Alpha limit dextrins,Sucrose,polysaccharides,C,[],[],[],[],[],[],-,False
nutrition/test/80,nutrition,Medical,"What is the definition of overweight?
",BMI > 25 kg/m2,BMI = 25 kg/m2,BMI 25-29.9 kg/m2,BMI 25-30 kg/m2,C,[],[],[],[],[],[],-,False
nutrition/test/81,nutrition,Medical,"Pregnancy and lactation is known to:
",Decrease calcium requirements,Result in bone mineral loss from the skeleton,Decrease the rate of dietary calcium absorption,Affect bone mineral content later in life,B,[],[],[],[],[],[],-,False
nutrition/test/82,nutrition,Medical,"Observational epidemiology studies have produced useful in identifying health effects of many food contaminants, but not for assessing risk, because:
",It is never possible to know whether observed effects are caused by the contaminant,Human exposure though food is usually much less than exposures that have been studied,Controlled animal studies provide more reliable information,Reliable dose-response data are difficult to acquire and often unavailable,D,[],[],[],[],[],[],-,False
nutrition/test/84,nutrition,Medical,"The respiration quotient (RQ):
",is defined as the ratio of VO2 divided by VCO2.,decreases on a high carbohydrate diet.,increases with fasting.,goes beyond a value of 1.0 when exogenous carbohydrate is converted to endogenous fat.,D,[],[],[],[],[],[],-,False
nutrition/test/86,nutrition,Medical,"At what stage(s) during pregnancy did in utero exposure to the Dutch Hunger Winter have the biggest effects on DNA methylation in blood cells from the adult offspring?
",First trimester of pregnancy.,Second trimester of pregnancy.,Third trimester of pregnancy.,Effects were similar at all stages of pregnancy.,A,[],[],[],[],[],[],-,False
nutrition/test/87,nutrition,Medical,"The body's adjustment of heat production to changes in the plane of nutrition (under- or over-nutrition) and to minimize energy imbalance is known as:
",Basal metabolic rate,Thermic effect of food,Adaptive thermogenesis,Thermal balance,C,[],[],[],[],[],[],-,False
nutrition/test/88,nutrition,Medical,"Which drug(s) is/are approved for the treatment of obesity in Europe?
",Orlistat,Phentermine/Topiramate,Lorcaserin,Naltrexone/Bupropion,A,"['regional', 'regional', 'regional', 'regional']","['Yes', 'Yes', 'Yes', 'No']","[{'end': 69, 'label': 'Geographic', 'score': None, 'start': 21}, {'end': 68, 'label': 'Geographic', 'score': None, 'start': 62}, '-', '-']",[],"['Europe', 'Europe', 'Europe', 'Europe']",[],CS,True
nutrition/test/89,nutrition,Medical,"In order to achieve optimal nutritional status it is recommended that older adults consume:
",A high energy content diet.,A high nutrient dense diet.,A low energy content diet.,A daily antioxidant supplement.,B,[],[],[],[],[],[],-,False
nutrition/test/92,nutrition,Medical,"What is the density of fat free mass?
",0.900 g/cm3,0.730 g/cm3,1.100 g/cm3,None of the above,C,[],[],[],[],[],[],-,False
nutrition/test/93,nutrition,Medical,"In an epidemiological context, what is the population at risk?
",The proportion of a population that engage in risky behaviours.,The group of people that may experience the outcome we want to study.,A group of people participating in a study that may be harmful to them.,The population group with the highest relative risk of disease.,B,[],[],[],[],[],[],-,False
nutrition/test/94,nutrition,Medical,"How will climate change affect future food security?
","It will have negative impacts in most developing countries because of the increased frequency of droughts, storms and floods.","The impact will be positive, because drier weather will mean less habitat for malaria mosquitoes, so fewer workers will be sick at harvest time.",The impact will be positive because there will be more carbon dioxide available for plant photosynthesis.,There currently is no scientific consensus as to whether climate change is occurring or whether it will over the next 50 years.,A,[],[],[],[],[],[],-,False
nutrition/test/95,nutrition,Medical,"What is a major limitation of using BMI (body mass index) as a method of body fat measurements?
",It is not an accurate measure for average people,It is more accurate than height-weight tables,It does not distinguish between fat and fat free mass,All of the above,C,[],[],[],[],[],[],-,False
nutrition/test/97,nutrition,Medical,"Endurance type exercise training modulates fuel storage and substrate use. Adaptive responses include:
",lowering intramuscular lipid storage,Increasing liver glycogen content,Increasing muscle glycogen use during exercise,Increasing intramuscular lipid use during exercise,D,[],[],[],[],[],[],-,False
nutrition/test/100,nutrition,Medical,"In adolescence:
",Brain growth is faster than at any other stage in life,Peak bone mass occurs before the growth spurt ends,Girls physiologically increase their percentage body fat,Type 2 obesity related diabetes remains a very rare problem,C,[],[],[],[],[],[],-,False
nutrition/test/101,nutrition,Medical,"In which form is selenium found in the 25 human selenoproteins?
",Selenophosphate,Selenocysteine,Selenohistidine,Selenate,B,[],[],[],[],[],[],-,False
nutrition/test/102,nutrition,Medical,"On a global scale, trends are suggesting that with rising incomes and urbanization we are seeing a rise in which food commodities?
",Roots and Tubers,Fruits and vegetables,Beans and lentils,Meat and Dairy products,D,[],[],[],[],[],[],-,False
nutrition/test/104,nutrition,Medical,"It is possible to reduce (though not eliminate) information bias in assessment of dietary intake by
",gathering information about many different aspects of people's dietary habits.,"collecting data about dietary intake at the onset of a study, before people have experienced symptoms of disease.",collecting data on all possible confounders.,making sure that the study sample is representative of the population.,B,[],[],[],[],[],[],-,False
nutrition/test/105,nutrition,Medical,"To characterize a binge eating episode one must investigate the presence of:
","If patients feel that their eating habits are chaotic, regardless of meal size.",The consumption of large quantities of sweets between meals.,A subjective component of lack of control and an objective component of large consumption of food in a discrete period of time,The feeling that one cannot choose the type of food eaten even if their quantity is kept under control.,C,[],[],[],[],[],[],-,False
nutrition/test/106,nutrition,Medical,"Which of the factors below is NOT considered a risk factor for Eating Disorders
",Perfectionism traits,Female gender,Dieting during adolescence,Parental anxiety,D,[],[],[],[],[],[],-,False
nutrition/test/108,nutrition,Medical,"Of the classes of dietary fatty acids which have the most beneficial effect on plasma LDL cholesterol levels?
",n-3 and n-6 polyunsaturated fatty acids,Saturated and trans unsaturated fatty acids,Monounsaturated fatty acids,Both a and c,D,[],[],[],[],[],[],-,False
nutrition/test/110,nutrition,Medical,"How many kcal are there in one gram of ethanol?
",23.5 kJ or 5.8 kcal per g,19.7 kJ or 4.1 kcal per g,29.7 kJ or 7.1 kcal per g,36.5 kJ or 8.1 kcal per g,C,"['none', 'regional', 'none', 'none', 'none', 'none']","['No', 'No', 'No', 'No', 'No', 'No']","['-', '-', '-', '-', '-', '-']",[],['North America'],['United Kingdom (UK)'],CA,True
nutrition/test/111,nutrition,Medical,"Colonic microbiome:
",Is present in babies in utero,Is a cause of eosinopjhilic oesophagitis,Is easily changed by probiotic supplementation,May be changed with consumption of oligo-saccharides,D,[],[],[],[],[],[],-,False
nutrition/test/113,nutrition,Medical,"What nutritional strategies will not improve performance during prolonged endurance type exercise?
",Carbohydrate loading,Tapering,The classic glycogen loading regime,Exogenous carbohydrate ingestion during exercise,C,[],[],[],[],[],[],-,False
nutrition/test/114,nutrition,Medical,"Which body composition method would you use to measure body mineral content?
",Magnetic Resonance Imaging,Dual-energy X-ray absorptiometry,Isotope dilution,Skinfold Thickness,B,[],[],[],[],[],[],-,False
nutrition/test/115,nutrition,Medical,"These factors increase risk of osteoporotic fracture:
",High bone mineral density,High body weight,High lean mass,Poor muscle strength,D,[],[],[],[],[],[],-,False
nutrition/test/116,nutrition,Medical,"Fruit and vegetable consumption
",Has been associated with greater bone mineral loss in observational studies,"Has an uncertain relationship with skeletal health because research studies are confounded by associated lifestyle factors such as smoking, exercise and alcohol consumption",Has consistently resulted in less bone loss in supplementation studies,Has large effects on bone mineral loss,B,[],[],[],[],[],[],-,False
nutrition/test/117,nutrition,Medical,"Which are the FIVE main series of apoproteins that have been identified?
","apoA, apoB, apoC, apoD, and apoE","apoA, apo(a), apoB, apoC and apoE","apoA, apoB, apoC, apo E, and apoL","apoB, apoC, apoD, apoE and apoM",B,[],[],[],[],[],[],-,False
nutrition/test/119,nutrition,Medical,"Nutrients may pose health risks:
",When intakes exceed established ULs (Upper Levels),At any level greater than a recommended dietary intake,Only when intakes are less than those required for nutritional benefits,Under no known conditions of usual intake,A,"['none', 'none', 'none', 'none']","['No', 'No', 'No', 'No']","['-', '-', '-', '-']",[],[],[],CA,True
nutrition/test/120,nutrition,Medical,"The Atherogenic Lipoprotein Phenotype (ALP) is a collection of which lipoprotein abnormalities?
","Reduced levels of HDL, a high proportion of small dense LDL and raised triglycerides","Reduced levels of HDL, a high proportion of small dense LDL and normal triglycerides","Raised levels of HDL, a high proportion of small dense LDL and raised triglycerides","Reduced levels of HDL, a low proportion of small dense LDL and raised triglycerides",A,[],[],[],[],[],[],-,False
nutrition/test/123,nutrition,Medical,"What dietary component has been shown to improve hypertension in humans?
",potassium,sodium,polyunsaturated fatty acids,cholesterol,A,[],[],[],[],[],[],-,False
nutrition/test/124,nutrition,Medical,"Fats normally contain triacylglycerols at concentrations of:
",75-95%,50- 75%,> 95%,< 50%,C,[],[],[],[],[],[],-,False
nutrition/test/127,nutrition,Medical,"The test for checking mean plasma glucose concentration over the previous 8-10 weeks is:
",Hemoglobin A1c,Oral glucose tolerance test (OGTT),Fructosamine test,Fasting plasma glucose concentration,A,[],[],[],[],[],[],-,False
nutrition/test/128,nutrition,Medical,"Which one of these organs has the lowest energy expenditure per unit of body mass (kg)?
",Brain,Kidney,Liver,Skeletal Muscle,D,[],[],[],[],[],[],-,False
nutrition/test/129,nutrition,Medical,"Are GM foods a valuable tool with which to address global food security and climate change?
","No, because they may cause cancer and have other unknown health effects thus making them unacceptable to consumers","Yes, because they can provide us with a more abundant and economical food supply for the world as well as continued improvement in nutritional quality","Yes, because they are cheaper than non-GM foods","No, because GM foods cannot adapt to the rate of climate change",B,[],[],[],[],[],[],-,False
nutrition/test/130,nutrition,Medical,"What do flavonoids (polyphenols), including isoflavones (phytoestrogens), inositol phosphates (phytates), lignans (phytoestrogens), isothiocyanates, indoles, phenols and sulphides and thiols, have in common?
",They are all sources of fibre,They are all derived from plant foods,They are all vitamins,They are all nutrients,B,[],[],[],[],[],[],-,False
nutrition/test/137,nutrition,Medical,"What is the estimated global prevalence of untreated dental caries?
",20%,40%,60%,80%,B,[],[],[],[],[],[],-,False
nutrition/test/138,nutrition,Medical,"Bone mineral accretion
",Is rapid in the first 10 weeks of foetal life,Is slow in infancy,"In childhood, adolescence and young adulthood predicts risk of fracture in old age",Is particularly high after the menopause in women,C,[],[],[],[],[],[],-,False
nutrition/test/141,nutrition,Medical,"Deficiency of thiamin in alcoholics leads to
",Wernicke-Korsakoff syndrome,Cushing syndrome,Fatty liver,Hypogonadism,A,[],[],[],[],[],[],-,False
nutrition/test/142,nutrition,Medical,"In human DNA, which nucleotide base is methylated at the 5' position?
",Adenosine,Thymine,Cytosine,Guanine,C,"['none', 'none', 'none', 'none']","['No', 'No', 'No', 'No']","['-', '-', '-', '-']",[],[],[],CA,True
nutrition/test/145,nutrition,Medical,"Basal Metabolic Rate (BMR):
",is measured in comfortable sitting position,is unaltered in hypothyroidism and hyperthyroidism,Is higher after weight gain because part of the excess weight is fat-free mass.,is not altered after weight loss.,C,[],[],[],[],[],[],-,False
