sample_id,subject,subject_category,question,option_a,option_b,option_c,option_d,answer,required_knowledge,time_sensitive,reference,culture,region,country,cultural_sensitivity_label,is_annotated
sociology/test/10,sociology,Social Sciences,Which of the following was not defined by Giddens (1998) as part of New Labour's 'third way':,the democratization of the family,putting an end to privatization,"positive welfare: 'a hand up, not a hand-out'",the strengthening of civil society,B,[],[],[],[],[],[],-,False
sociology/test/20,sociology,Social Sciences,Which of the following policies did the New Labour government not pursue?,setting and streaming pupils by ability,parental choice of school,supporting LEAs that appeared to be failing,state regulation and control of the curriculum,C,[],[],[],[],[],[],-,False
sociology/test/32,sociology,Social Sciences,Émile Durkheim believed the primary focus of sociology should be which of the following?,Social action,Social facts,Class relations,Cultural dynamics,B,[],[],[],[],[],[],-,False
sociology/test/33,sociology,Social Sciences,"The term ""sociology"" was coined in the early 1800s by which of the following?",Auguste Comte,Robert K. Merton,Karl Marx,Emile Durkheim,A,[],[],[],[],[],[],-,False
sociology/test/42,sociology,Social Sciences,Seven people standing silently while waiting for a bus at a bus stop is an example of which of the following?,A primary group,A secondary group,An aggregate,A social category,C,[],[],[],[],[],[],-,False
sociology/test/52,sociology,Social Sciences,"A major car accident occurs. One man stops his car and starts helping people. After seeing him stop, others also stop and start helping. Which of the following theories best explains the scenario?",Convergence,Emergent-norm,Contagion,Value-added,B,"['cultural', 'none', 'none', 'none']","['Yes', 'No', 'No', 'No']","['-', '-', '-', '-']",['Western Culture'],[],[],CA,True
sociology/test/53,sociology,Social Sciences,A new highway extends from a major city though an area used for farmland. Which of the following is most likely to happen as a result?,Farmers will increase the acreage under production.,The city will evolve into a multiple nuclei model.,Suburbanization will develop because the time it takes to commute to the city has been decreased.,"People from the countryside will move to the city, depopulating the farmland region.",C,[],[],[],[],[],[],-,False
sociology/test/67,sociology,Social Sciences,"Religious organizations such as the Church of Norway, Islam, the Church of England, and the Church of Greece have which of the following characteristics in common?",They are cultures as well as churches.,They practice separation of church and state.,They exclude women as clergy.,They are monotheistic.,D,[],[],[],[],[],[],-,False
sociology/test/68,sociology,Social Sciences,"A researcher mailed 1,000 questionnaires to members of a labor union and received 300 back. Most of those who returned the questionnaires indicated that they were dissatisfied with the union. Results based only on the returned questionnaires are most likely contaminated by",response rate bias,researcher bias,confusing correlation and causation,statistical regression,A,[],[],[],[],[],[],-,False
sociology/test/71,sociology,Social Sciences,"Leroy visits his parents, who live in a primarily African American working-class neighborhood. During his visit, he notices that the community is changing. Several developments have been built to accommodate single-family homes, and upscale shopping centers have been added. While Leroy appreciates these changes, he is worried that his parents will not be able to afford to continue living in their neighborhood because property values are rising. Which of the following best explains what is happening to Leroy's old neighborhood?",Gentrification,Urbanization,White flight,The demographic transition,A,[],[],[],[],[],[],-,False
sociology/test/78,sociology,Social Sciences,Which of the following best describes the practice of placing the blame for the problems of a society on one particular group?,Ethnocentrism,Stereotyping,Scapegoating,Institutionalization,C,[],[],[],[],[],[],-,False
sociology/test/82,sociology,Social Sciences,Which of the following is consistent with results of current research conducted in the area of gender roles and the workplace?,"In about a quarter of households with children, men stay home with the children so their wives can work.","Most women believe that there is equal opportunity today between men and women in career choice, advancement, and income.",Most men believe that women should be homemakers because men earn more money.,Most men married to working women do not share housework and childcare obligations equally with their working wives.,D,[],[],[],[],[],[],-,False
sociology/test/89,sociology,Social Sciences,Which of the following sociological perspectives views society as a system of interdependent and coordinated parts?,Functionalism,Conflict theory,Symbolic interactionism,Role theory,A,[],[],[],[],[],[],-,False
sociology/test/118,sociology,Social Sciences,Which of the following is not a feature of globalization?,an increasing awareness of the world as a whole,the extended power of nation states,the destruction of distance through communications technologies,the stretching of social relations beyond national boundaries,B,"['none', 'none', 'none', 'none', 'none', 'none', 'none', 'none']","['No', 'No', 'No', 'No', 'No', 'No', 'No', 'No']","['-', '-', '-', '-', '-', '-', '-', '-']",[],[],[],CA,True
sociology/test/137,sociology,Social Sciences,Millions of immigrant children who entered the United States learned English and the duties of citizenship while attending public schools in the communities in which they settled. This is an example of which of the following sociological concepts?,Acculturation,Collective behavior,Social stratification,Social mobility,A,[],[],[],[],[],[],-,False
sociology/test/140,sociology,Social Sciences,Which of the following is not recognised as a level of society?,the household,the office,the global village,the nation state,B,[],[],[],[],[],[],-,False
sociology/test/145,sociology,Social Sciences,Which of the following is not identified as a new form of community?,"ethnic communities, based on shared identity and experiences of discrimination","gay villages, which are formed in certain parts of large cities","sociological communities, formed by unpopular lecturers",virtual communities that exist only in cyberspace,C,"['cultural', 'none', 'none', 'none']","['Yes', 'No', 'No', 'No']","['-', '-', '-', '-']",['Western Culture'],[],[],CA,True
sociology/test/148,sociology,Social Sciences,Which of the following was not part of Weber's ideal type of bureaucracy?,impersonal rules,extensive paperwork,hierarchy of officials,Salaries,B,[],[],[],[],[],[],-,False
sociology/test/149,sociology,Social Sciences,Which of the following is the most important agent of socialization in early childhood?,A preschool provider,A peer group,The mass media,The family,D,[],[],[],[],[],[],-,False
sociology/test/150,sociology,Social Sciences,Which of the following is not a 'research purpose'?,triangulation,explanation,description,exploration,A,[],[],[],[],[],[],-,False
sociology/test/151,sociology,Social Sciences,'Scientific' theories in the nineteenth century tried to explain race in naturalistic terms. Which of the following ideas was not considered?,genetics,evolution,height,brain size,C,[],[],[],[],[],[],-,False
sociology/test/152,sociology,Social Sciences,Which of the following is not a regular national survey carried out by the British government?,Labour Force Survey,General Household Survey,Fashion Sensibility Survey,Family Expenditure Survey,C,[],[],[],[],[],[],-,False
sociology/test/153,sociology,Social Sciences,Which of the following industries did Blauner (1964) suggest was most alienating to its employees?,machine-based factory work,textile work as craft production,car manufacturing in assembly plants,chemical processing with automated practices,C,[],[],[],[],[],[],-,False
sociology/test/158,sociology,Social Sciences,Which of the following groups or organizations can be identified as having the characteristics of a bureaucracy?,"An extended or consanguine family, including all the relatives by blood, marriage, or adoption",The government of a large city,A book club in which books are chosen by members who take turns alphabetically to lead discussion,The volunteers who gather annually to clean the neighborhood,B,[],[],[],[],[],[],-,False
sociology/test/165,sociology,Social Sciences,Which of the following best describes the definition of poverty used by the United States government?,It specifies the poverty line at a level set in the 1960s and adjusted since to reflect inflation.,"It includes the value of government services, such as Medicaid or public housing, when setting the poverty line.","It is based on the concept of relative deprivation, and the poverty line changes as the distribution of income changes.","It is based on the concept of lifestyle, and the poverty line varies according to the needs of the individual.",A,[],[],[],[],[],[],-,False
sociology/test/168,sociology,Social Sciences,Which of the following was not a strategy used by the Conservative government of 1979 to reduce the power of the labour movement?,making all strike action illegal,imposing restrictions on picketing,banning political strikes that were not primarily concerned with the worker's own conditions of work,making secondary action (in support of workers elsewhere) illegal,A,"['regional', 'regional', 'regional', 'regional']","['Yes', 'No', 'No', 'No']","[{'end': 77, 'label': 'Geographic', 'score': None, 'start': 54}, {'end': 128, 'label': 'Cultural', 'score': None, 'start': 86}, '-', '-']",['Western Culture'],['Europe'],"['United Kingdom (UK)', 'United States of America (USA)']",CS,True
sociology/test/170,sociology,Social Sciences,The population pyramid of a population that has had a slightly larger birth rate than death rate for several generations will most likely have which of the following shapes?,Wider at the top than in the middle,Wider at the bottom than at the top,Bulging in the middle,Having parallel sides,B,[],[],[],[],[],[],-,False
sociology/test/172,sociology,Social Sciences,Giselle graduated from college with high honors in management. She was recruited immediately following college by a large corporation and accepted a position in junior management. She quickly advanced to middle management. Ten years later Giselle was still in a middle-management position and had witnessed junior male colleagues promoted over her. Which of the following is a phenomenon that is most likely to explain Giselle's lack of promotion?,Glass ceiling,Gender constancy,Underemployment,Glass elevator,A,[],[],[],[],[],[],-,False
sociology/test/180,sociology,Social Sciences,Which of the following is not a characteristic of totalitarian societies?,indoctrination and propaganda,freedom of movement for citizens,one-party rule,a centrally planned economy,B,[],[],[],[],[],[],-,False
sociology/test/182,sociology,Social Sciences,Which of the following theories focuses on how society manages to carry out the activities necessary to maintain order and stability?,Functionalism,Interactionism,Rational-choice theory,Conflict theory,A,[],[],[],[],[],[],-,False
sociology/test/183,sociology,Social Sciences,Which of the following is a personal document with closed access?,government 'white paper',confidential medical records,household account book,the shares register of a business,C,"['none', 'none', 'none', 'none']","['No', 'No', 'No', 'No']","['-', '-', '-', '-']",[],[],[],CA,True
sociology/test/189,sociology,Social Sciences,Which of the following is not identified by Fulcher & Scott as a criterion of community?,a shared sense of identity and belonging together,common activities involving all-round relationships,a fixed geographical location,collective action based on common interests,C,[],[],[],[],[],[],-,False
sociology/test/192,sociology,Social Sciences,Which of the following is not a consequence of global tourism?,decreased rates of prostitution and sex tourism,developing countries can depend on it as a crucial source of income,"the exploitation of cheap, unregulated labour in poor countries",we have become more aware of 'other' societies and ways of living,A,[],[],[],[],[],[],-,False
sociology/test/193,sociology,Social Sciences,Which of the following did Thatcher's government not strive to achieve:,marketization and privatization,"individual freedom, choice and responsibility","generous financial benefits for single parents, students and the unemployed",the rolling back of the welfare state,C,[],[],[],[],[],[],-,False
sociology/test/200,sociology,Social Sciences,Which of the following did Domhoff not identify as a process of decision-making in the USA?,the ideology process,the exploitation process,the policy-formation process,the candidate-selection process,B,[],[],[],[],[],[],-,False
